"text","text_en","cmp_code","eu_code"
"Durch die deutlich verbesserte Anerkennung von Bildungs- und Weiterbildungsphasen, Unterbrechungen der Erwerbstätigkeit und die vollständige Anerkennung von Kindererziehungszeiten werden dem Rentensystem realistische Lebens- und Erwerbsverläufe zugrunde gelegt","The significantly improved recognition of periods of education and further training, interruptions in employment and the full recognition of child-raising periods mean that the pension system is based on realistic life and employment histories","504",NA
"Niedrige Rentenbeiträge aufgrund von Teilzeitbeschäftigung werden aufgestockt, besonders ”schlechte” Versicherungsjahre werden ausgeklammert","Low pension contributions due to part-time employment are topped up, particularly ""bad"" insurance years are excluded","504",NA
"Diese Veränderungen wirken sich besonders für Frauen aus, die so (höhere) eigenständige Rentenansprüche erwerben","These changes have a particular impact on women, who thus acquire (higher) independent pension entitlements","503",NA
"Reichen die eigenen Rentenansprüche nicht aus, so wird die Rente durch die Einführung eines Mindestsockels in Höhe der Grundsicherung aus Steuermitteln aufgebessert","If your own pension entitlements are not sufficient, your pension will be topped up from tax revenue by introducing a minimum basic level equivalent to basic income support","504",NA
"Insgesamt wollen wir mit unseren Vorschlägen Menschen mit niedrigen Einkommen und unsteten Erwerbsverläufen systematisch besserstellen","Overall, our proposals aim to systematically improve the situation of people with low incomes and unstable employment histories","504",NA
"Zur Sicherung des individuellen Lebensstandards soll die gesetzliche Rentenversicherung so ausgebaut werden, daß eine Höher- und Weiterversicherung erleichtert wird","To safeguard the individual standard of living, the statutory pension insurance scheme is to be expanded in such a way as to facilitate higher and continued insurance cover","504",NA
"Wir werden die Bedingungen für die betriebliche Altersvorsorge erheblich verbessern","We will significantly improve the conditions for company pension schemes","505",NA
"Sie muß sich ebenfalls an unsteten Erwerbsverläufen orientieren, die Bedingungen für den Anspruch auf Leistungen niedriger ansetzen und die Möglichkeit der Übertragung von Anwartschaften erleichtern","It must also be geared to unsteady employment histories, set lower conditions for entitlement to benefits and facilitate the possibility of transferring entitlements","403",NA
"Für kleine und mittlere Unternehmen müssen neue Spielräume geschaffen werden, ihren MitarbeiterInnen entsprechende Angebote machen zu können","New scope must be created for small and medium-sized enterprises to be able to make appropriate offers to their employees","402",NA
"Neue Finanzierungsanteile","New financing shares",NA,NA
"Die Finanzierung der Renten muß den demographischen und finanziellen Anforderungen gerecht werden","The financing of pensions must meet demographic and financial requirements","504",NA
"Wir wollen die Altersabsicherung für alle durch erhöhte Zuschüsse aus Steuermitteln und durch Umschichtungen innerhalb des Systems finanzieren","We want to finance old-age security for all through increased subsidies from tax revenue and through reallocations within the system In","503",NA
"Konkret bedeutet dies, daß hohe Renten im Verhältnis schrittweise sinken müssen, um die Erhöhung niedriger Renten finanzieren zu können","concrete terms, this means that high pensions must gradually decrease in proportion to be able to finance the increase in low pensions","503",NA
"Zur Entlastung der BeitragszahlerInnen und um den Erfordernissen des Arbeitsmarkts Rechnung zu tragen, wird aus Mitteln des Aufkommens der Ökologischen Steuerreform die Erhöhung des Zuschusses aus Steuermitteln finanziert","In order to relieve the burden on contributors and to take account of the requirements of the labor market, the increase in the subsidy will be financed from tax revenue from the proceeds of the ecological tax reform","504",NA
"Durch einen demographischen Faktor in der Rentenformel soll die gestiegene Lebenserwartung berücksichtigt werden","A demographic factor in the pension formula is to take account of increased life expectancy","504",NA
"BÜNDNIS 90/DIE GRÜNEN halten an der solidarischen Absicherung des Erwerbsunfähigkeitsrisikos fest","Alliance 90/The Greens maintain solidarity-based coverage of the risk of disability","606",NA
"Soziales Netz durch Wertschöpfungskomponente sichern","Securing social network through value-added component",NA,NA
"Bei nicht mehr steigendem Beschäftigungsvolumen, aber eher steigenden Anforderungen an das System der sozialen Sicherung kann dieses nicht mehr allein auf der Erwerbsarbeit gegründet sein","With the volume of employment no longer rising, but rather the demands on the social security system increasing, it can no longer be based solely on gainful employment","504",NA
"Zusätzliche Zuschüsse aus Steuermitteln (Ökosteuer) müssen ebenso hinzutreten wie mittelfristig eine Teilfinanzierung über die betriebliche Wertschöpfung","Additional subsidies from tax revenue (eco-tax) must be added, as well as partial financing in the medium term via company value added","403",NA
"Die Grünen wollen in der nächsten Legislaturperiode eine Reform vorbereiten, die mittelfristig den Arbeitgeberanteil der Sozialversicherung durch eine Wertschöpfungsabgabe ersetzt","In the next legislative period, the Greens want to prepare a reform that will replace the employer's social security contribution with a value-added tax in the medium term","403",NA
"So würden beschäftigungsintensive Betriebe (z| B| Klein- und Handwerksbetriebe) entlastet, kapital- und technologieintensive Betriebe aber stärker in das System der sozialen Verantwortung einbezogen","would relieve the burden on employment-intensive companies (e.g., small businesses and craft enterprises), while capital- and technology-intensive companies would be more strongly integrated into the social responsibility system The","403",NA
"Die Wertschöpfungsabgabe müßte allerdings so ausgestaltet sein, daß sie nicht als Investitions- und Modernisierungsbremse wirkt","value-added tax would, however, have to be designed in such a way that it does not act as a brake on investment and modernization","411",NA
"Selbstbestimmt statt ausgegrenzt","Self-determined instead of excluded",NA,NA
"Eine demokratische und emanzipatorische Gesellschaft muß für Behinderte Selbstbestimmung und umfassende gesellschaftliche Teilhabe (Integration) gewährleisten","A democratic and emancipatory society must guarantee self-determination and comprehensive social participation (integration) for people with disabilities","705",NA
"Auch Pflegebedürftige müssen ihre Lebensumstände eigenständig bestimmen können","People in need of care must also be able to determine their own living conditions","705",NA
"Für unsere am Grundsatz der Emanzipation und Selbstbestimmung orientierte Behindertenpolitik stehen nicht die Kostenargumente im Vordergrund, sondern die Schaffung von Rahmenbedingungen, durch die den Betroffenen ein gleichberechtigtes Leben im Alltag ermöglicht wird","For our disability policy, which is based on the principle of emancipation and self-determination, the focus is not on cost arguments, but on creating framework conditions that enable those affected to lead an equal life in everyday life","705",NA
"Wir wollen daher die Rechtsansprüche auf berufliche Rehabilitation für behinderte Jugendliche und Erwachsene in das Arbeitsförderungsrecht wieder einführen","We therefore want to reintroduce the legal entitlement to vocational rehabilitation for disabled young people and adults into employment promotion law","705",NA
"Werkstätten für Behinderte sollen vor allem ein Ort der Ausbildung und des Lernens werden","Workshops for the disabled should primarily be a place for training and learning","705",NA
"Integrationsbetriebe, in denen Behinderte und Nichtbehinderte zusammen arbeiten, müssen gefördert werden","Integration companies in which disabled and non-disabled people work together must be promoted","705",NA
"Statt Behinderte aus Kostengründen in Heime und Einrichtungen abzuschieben, fordern wir das Recht für Behinderte und Pflegebedürftige, die Form ihrer Betreuung selbst zu wählen","Instead of relegating disabled people to homes and institutions for cost reasons, we demand the right for disabled people and those in need of care to choose the form of their care themselves","705",NA
"Dazu gehört auch das Recht, mit den Pflegekräften ein Arbeitsverhältnis einzugehen (ArbeitgeberInnenmodell)","This also includes the right to enter into an employment relationship with the nursing staff (employer model)","705",NA
"Auch dieser Form der Pflege muß ein Zugang zu den Sachleistungen der Pflegeversicherung eingeräumt werden","This form of care must also be given access to care insurance benefits in kind","705",NA
"Insbesondere behinderte und pflegebedürftige Frauen müssen das Recht haben, nur weibliche Pflegekräfte zu akzeptieren","Disabled women and women in need of care in particular must have the right to accept only female caregivers","503",NA
"Ein eigenes Leistungsgesetz für Behinderte muß die Ansprüche auf Leistungen zur Eingliederung und anderer Hilfen unter Berücksichtigung des Grundsatzes der Bedarfsdeckung neu und transparent regeln","A separate law on benefits for the disabled must regulate entitlements to integration benefits and other assistance in a new and transparent way, taking into account the principle of meeting needs","303",NA
"Die Einführung der Pflegeversicherung war mit einer Vielzahl von Fehlentscheidungen verbunden","The introduction of long-term care insurance was associated with a large number of wrong decisions","303",NA
"Jetzt geht es darum, an den dringlichsten Punkten Korrekturen vorzunehmen","The task now is to make corrections to the most urgent points","303",NA
"Durch die zweite Stufe der Pflegeversicherung wurden die Pflegestandards in den Behinderten- und Altenpflegeheimen radikal gesenkt","The second stage of care insurance has radically lowered care standards in homes for the disabled and elderly","504",NA
"Der Mechanismus, Kosten auf die Sozialversicherungsträger abzuwälzen, ist ungebremst","The mechanism of passing on costs to social insurance providers is unchecked","504",NA
"Sie muß nachgebessert werden in Hinblick auf den Leistungskatalog und die Abgrenzung zu ergänzenden Hilfesystemen","It must be improved with regard to the benefits catalog and the distinction from supplementary assistance systems","504",NA
"Der enge, auf die körperliche Grundpflege reduzierte Pflegebegriff muß zu Gunsten eines ganzheitlichen Pflegebegriffes abgelöst werden, in den physische, psychische, pädagogische und soziale Aspekte eingehen","The narrow concept of care, reduced to basic physical care, must be replaced by a holistic concept of care that includes physical, psychological, educational and social aspects","504",NA
"Die Erbringung von Pflegeleistungen nach standardisierten ”Modulen” verletzt die Menschenwürde und muß daher ersetzt werden durch Regeln, die die Individualität und Selbstbestimmung pflegebedürftiger Menschen achten","The provision of care services according to standardized ""modules"" violates human dignity and must therefore be replaced by rules that respect the individuality and self-determination of people in need of care","201",NA
"Lebensqualität und Selbstbestimmungsansprüche von Menschen dürfen nicht als ”finanzielle Zumutung” eingestuft werden","People's quality of life and right to self-determination must not be classified as a ""financial imposition""","504",NA
"Langfristig sind die Mittel durch Einführung einer Bedarfsprüfung auf diejenigen zu konzentrieren, die auf sie angewiesen sind","In the long term, funds should be concentrated on those who need them by introducing a needs test","504",NA
"Für eine humane Gesundheitspolitik","For a humane health policy",NA,NA
"Die von der Bundesregierung betriebene ”Gesundheitsreform” bricht Kernstücke aus der solidarischen Gesetzlichen Krankenversicherung (GKV) und belastet Kranke und Alte mit Gebühren, Zuzahlungen und Selbstbeteiligungen","The ""health reform"" pursued by the federal government breaks core elements from the solidary statutory health insurance (GKV) and burdens the sick and the old with fees, co-payments and deductibles","504",NA
"Im Ergebnis existiert eine umfassende gesundheitliche Versorgung nur noch für diejenigen, die sie sich leisten können","As a result, comprehensive health care now exists only for those The","504",NA
"Das Gerede von der ”Kostendämpfung” verdeckt den Ausstieg aus dem Solidarsystem und die massive Bedienung der Interessen bestimmter Anbieter und der Pharmaindustrie","talk of ""cost containment"" conceals the withdrawal from the solidarity system and the massive servicing of the interests of certain providers and the pharmaceutical industry","504",NA
"BÜNDNIS 90/DIE GRÜNEN stellen dem ein solidarisches gesundheitspolitisches Reformprogramm entgegen, das Gleichberechtigung sowie Teilhabe betont und die Gesundheit aller Gruppen der Bevölkerung fördert","Alliance 90/The Greens oppose this with a solidarity-based health policy reform program that emphasizes equality and participation and promotes the health of all groups of the population","606",NA
"Wir streben damit das durch die Weltgesundheitsorganisation geprägte Ideal von Gesundheit als Zustand physischen, psychischen und sozialen Wohlbefindens an","We are thus striving for the ideal of health as a state of physical, mental and social well-being, as defined by the World Health Organization","606",NA
"Für eine gesunde Lebens- und Arbeitsumwelt","For a healthy living and working environment",NA,NA
"Gesundheit ist mehr als die Abwesenheit von Krankheit","Health is more than the absence of illness","706",NA
"Gesundheitspolitik betrifft alle Lebensbereiche","Health policy affects all areas of life","706",NA
"Umweltbelastung, gesundheitliche Risiken am Arbeitsplatz, psychosozialer Streß und Diskriminierungen stellen individuell nur schwer beeinflußbare Krankheitsauslöser dar","Environmental pollution, health risks at the workplace, psychosocial stress and discrimination are disease triggers that are difficult to influence individually","706",NA
"Dies hat sich in einer der Gesundheit aller Menschen dienlichen Gesamtpolitik widerzuspiegeln","This must be reflected in an overall policy that benefits the health of all people","706",NA
"Prävention in diesem Bereich ist daher eine politische Aufgabe der Gesellschaft","Prevention in this area is therefore a political task for society","504",NA
"In der Medizinforschung müssen neue Prioritäten gesetzt werden, insbesondere hinsichtlich des Gesundheitsschutzes am Arbeitsplatz und in der Umweltmedizin","New priorities must be set in medical research, particularly with regard to health protection in the workplace and in environmental medicine","411",NA
"Wir wollen, daß die Förderung der Gesundheit zum Leitbild der Gesundheitspolitik wird","We want the promotion of health to become the guiding principle of health policy","706",NA
"Sie muß heilenden, rehabilitativen und pflegerischen Maßnahmen vorangestellt werden und an den krankheitsverursachenden Verhältnissen ansetzen","It must precede curative, rehabilitative and nursing measures and address the conditions that cause the disease","504",NA
"Der Sackgassenweg der High-Tech-Medizin verstärkt sich durch den Einsatz der Gentechnik","The dead-end path of high-tech medicine is reinforced by the use of genetic engineering","416",NA
"In ihren Möglichkeiten weit überschätzt, hat sie im Einzelfall bei einigen Medikamenten und Diagnostika einen bedingten Nutzen","Far overestimated in its potential, it has a limited benefit in individual cases with some drugs and diagnostics","411",NA
"Den Risiken muß durch größtmögliche Transparenz und Kontrolle der Forschung, eine begleitende Risikoforschung und einer Verschärfung des Haftungsrechtes soweit wie möglich begegnet werden","The risks must be countered as far as possible by the greatest possible transparency and control of research, accompanying risk research and a tightening of liability law","403",NA
"Wir wollen eine Umverteilung der öffentlichen Forschungsgelder, um auch alternative Heilmethoden zu fördern und zu entwickeln","We want a redistribution of public research funds to also promote and develop alternative healing methods","604",NA
"Das Schüren nicht erfüllbarer Hoffnungen auf Heilung schwerkranker Menschen lehnen wir als unredlich und unverantwortlich ab","We reject as dishonest and irresponsible the raising of unfulfillable hopes of curing seriously ill people","603",NA
"BÜNDNIS 90/DIE GRÜNEN lehnen Gentechnik in der Medizin weiterhin im Grundsatz ab","Alliance 90/The Greens continue to reject genetic engineering in medicine in principle","603",NA
"Wir respektieren jedoch den Einsatz der Gentechnik bei Medikamenten, Diagnostik und Grundlagenforschung, wenn die heutige Medizin den Betroffenen keine Alternative bietet","However, we respect the use of genetic engineering in medicines, diagnostics and basic research if current medicine offers no alternative to those affected","411",NA
"Den Plänen, über eine EU-Patentierungsrichtlinie Eigentumsrechte und Verwertungsmonopole über Gene und Teile des menschlichen Körpers festzuschreiben, setzen wir unseren entschiedenen Widerstand entgegen","We strongly oppose the plans to establish property rights and exploitation monopolies over genes and parts of the human body via an EU patent directive","201",NA
"Das mit der Gentechnik verbundene Menschenbild gefährdet die Menschenwürde und das Recht auf körperliche Unversehrtheit","The image of humanity associated with genetic engineering jeopardizes human dignity and the right to physical integrity","201",NA
"Die Bioethikkonvention des Europarates und die UNESCO-Deklaration lehnen wir ab","We reject the Council of Europe's Bioethics Convention and the UNESCO Declaration","603",NA
"Für ein demokratisches und solidarisches Gesundheitssystem","For a democratic and solidarity-based healthcare system",NA,NA
"BÜNDNIS 90/DIE GRÜNEN wollen ein demokratisches Gesundheitssystem","Alliance 90/The Greens want a democratic healthcare system","202",NA
"Dies bedeutet eine umfassende Beteiligung der Versicherten und einen Ausbau von PatientInnenrechten und -schutz","This means comprehensive involvement of the insured and an expansion of patient rights and protection","202",NA
"Selbsthilfebewegung und -organisation muß gestärkt werden","Self-help movement and organization must be strengthened","606",NA
"Die solidarische Absicherung aller Risiken im Krankheitsfall ist ein Grundpfeiler des Sozialstaates","Solidarity-based cover for all risks in the event of illness is a cornerstone of the welfare state","504",NA
"Die Finanzierung der GKV zu gleichen Teilen durch ArbeitnehmerIn und ArbeitgeberIn muß wiederhergestellt werden","The financing of the SHI system must be restored in equal shares by employees and employers","504",NA
"Zuzahlungen sind zurückzuführen","Additional payments are due","504",NA
"Die GKV bedarf einer gerechteren und faireren Grundlage, z.B. kurzfristig durch die Angleichung der Beitragsbemessungs- und der Versicherungspflichtgrenze auf das Niveau der Rentenversicherung und langfristig durch die Einbeziehung der Beamten und Selbständigen in das solidarische Versicherungssystem","The statutory health insurance system needs a fairer and more equitable basis, e.g. in the short term by aligning the contribution assessment threshold and the compulsory insurance threshold with the level of pension insurance and in the long term by including civil servants and the self-employed in the solidarity-based insurance system","606",NA
"Ein einheitliches Versorgungsangebot ist ein Grundelement der sozialen Sicherung","A standardized supply is a basic element of social security","504",NA
"Um dabei den Besonderheiten der Regionen gerecht werden zu können, ist die Regionalisierung der gesundheitsbezogenen Planung erforderlich","Regionalization of health-related planning is necessary in order to do justice to the special features of the regions","301",NA
"Die gesundheitliche Versorgung muß sich an strengen Qualitätskriterien messen lassen, die der demokratischen Kontrolle unterliegen","Healthcare must be measured against strict quality criteria that are subject to democratic control","403",NA
"Dies dient dem PatientInnenschutz, verhindert unsinnige Maßnahmen und spart zudem Ausgaben ein","This serves to protect patients, prevents nonsensical measures and also saves costs","403",NA
"Für ein dem ganzheitlichen Menschenbild verpflichtetes Gesundheitssystem","For a healthcare system committed to a holistic view of humanity",NA,NA
"Gesundheit ist eine ganzheitliche Aufgabe","Health is a holistic task","504",NA
"PatientInnennahe Versorgung bedarf neben der gleichberechtigten Mitwirkung von Angehörigen der Zusammenarbeit von ÄrztInnen, PsychotherapeutInnen, Pflegekräften, SozialarbeiterInnen und anderen Gesundheitsberufen","In addition to the equal participation of relatives, patient-oriented care requires cooperation between doctors, psychotherapists, nurses, social workers and other healthcare professionals","303",NA
"Wir wollen die soziale und kommunikative Kompetenz der AkteurInnen stärken","We want to strengthen the social and communication skills of those involved","303",NA
"Unter anderem ist eine entsprechende Reform des Medizinstudiums notwendig","Among other things, a corresponding reform of medical studies is necessary","506",NA
"Im Krankheitsfalle müssen HausärztInnen in Absprache mit den PatientInnen vor dem Hintergrund der Wahlfreiheit Koordination und Steuerung der weiteren gesundheitlichen Versorgung übernehmen","In the event of illness, GPs must coordinate and manage further healthcare provision in consultation with the patient against the background of freedom of choice","504",NA
"Hierzu ist u.a. ein neues Honorarsystem notwendig","This requires, among other things, a new fee system","303",NA
"Dezentrale integrierte Versorgungsangebote, kooperative Praxisformen und berufsübergreifende Kooperationen sind zu fördern","Decentralized integrated care services, cooperative forms of practice and interprofessional cooperation should be promoted","303",NA
"Die Verzahnung und Vernetzung von ambulantem und stationärem Bereich muß gefördert werden durch den Erhalt und Ausbau poliklinischer Einrichtungen sowie Krankenhäuser und die Förderung von Gesundheitszentren zur Aufrechterhaltung und Verbesserung der Gesundheitsversorgung","The interlinking and networking of the outpatient and inpatient sectors must be promoted by maintaining and expanding polyclinical facilities and hospitals and promoting health centers to maintain and improve health care.","504",NA
"Bei der Planung und Finanzierung der Krankenhäuser stehen die Länder in der Verantwortung","The federal states are responsible for planning and financing hospitals","504",NA
"Kurortmedizin vereint beispielhaft Prävention und Rehabilitation","Spa medicine combines prevention and rehabilitation in exemplary fashion","504",NA
"Daher müssen die einseitigen Veränderungen durch die Gesundheitsstrukturreform im Interesse eines ganzheitlichen Gesundheitssystems rückgängig gemacht werden","For this reason, the one-sided changes brought about by the structural health reform must be reversed in the interests of a holistic healthcare system","504",NA
"Die besonderen Therapierichtungen sind als gleichwertige Heilmethoden anzuerkennen, sofern ihr Nutzen für PatientInnen erkennbar ist","The special therapeutic directions are to be recognized as equivalent healing methods, provided their benefits for patients are recognizable","504",NA
"Für die Vergütung durch die Kassen sind Kriterien zu entwickeln, die ihnen in ihrer Verschiedenartigkeit gerecht werden","Criteria must be developed for remuneration by the health insurance funds that do justice to their diversity","303",NA
"Die psychiatrische Versorgung ist als gemeindenahe sozialpsychiatrische Versorgung weiterzuentwickeln","Psychiatric care must be further developed as community-based social psychiatric care","504",NA
"Die gesetzlichen Rahmen- und Finanzierungsbedingungen sind in Fortschreibung der Psychiatriereform fortzuentwickeln","The legal framework and funding conditions must be further developed in line with the psychiatric reform","303",NA
"Für eine humane Drogenpolitik","For a humane drug policy",NA,NA
"Die Sucht- und Drogenpolitik der Bundesregierung schafft Probleme und Gefahren, die weitaus größer sind als die Risiken, die von den Drogen selbst ausgehen","The federal government's addiction and drug policy creates problems and dangers that are far greater than the risks posed by the drugs themselves","303",NA
"Wir fordern statt Nulltoleranz und Drogenkrieg eine Schadensreduzierung und Risikominimierung für die DrogengebraucherInnen","Instead of zero tolerance and drug war, we demand harm reduction and risk minimization for drug users","604",NA
"Der Schlüssel für eine Wende in der Sucht- und Drogenpolitik liegt in der Gesundheitspolitik, der Justiz- und Innenminister endlich Luft zum Atmen geben müssen","The key to a turnaround in addiction and drug policy lies in health policy, which justice and interior ministers must finally give breathing space to","303",NA
