"text","text_en","cmp_code","eu_code"
"Wir wollen, dass bei uns in Deutschland alle Bürgerinnen und Bürger in wärmegedämmten und energieeffizienten Wohnungen leben, sich energiesparende Haushaltsgeräte leisten können und bezahlbaren Zugang zu umweltfreundlicher Mobilität haben, um nicht immer mehr Geld ihres Haushaltseinkommens durch unsere Abhängigkeit von teuren fossilen Energieträgern zu verlieren.","We want all citizens in Germany to live in thermally insulated and energy-efficient homes, to be able to afford energy-saving household appliances and to have affordable access to environmentally friendly mobility so that they do not lose more and more of their household income due to our dependence on expensive fossil fuels.","503",NA
"Klimaschutz sichert und schafft Freiheit.","Climate protection secures and creates freedom.","501",NA
"Wir müssen jetzt das Klima schützen, sonst werden wir morgen zu Getriebenen und verlieren die Möglichkeit zu einem selbstbestimmten Leben.","We have to protect the climate now, otherwise we will become driven people tomorrow and lose the possibility of a self-determined life.","501",NA
"Deshalb gehört der Klimaschutz als Staatsziel ins Grundgesetz.","This is why climate protection should be a constitutional goal.","501",NA
"Wir GRÜNE kämpfen für Unabhängigkeit von fossilen Rohstoffen.","We GREENS fight for independence from fossil raw materials.","501",NA
"Wir wollen weg vom Öl, weg von Kohle und Uran.","We want to move away from oil, away from coal and uranium.","501",NA
"Wir wollen in den Städten wieder atmen können","We want to be able to breathe in cities again","501",NA
"und frei von Feinstaub und Lärmbelästigung leben.","and live free of particulate matter and noise pollution.","501",NA
"Wir wollen Mobilität für alle, statt im Stau festzusitzen – mit intelligenten Verkehrskonzepten und nachhaltiger Mobilität.","We want mobility for everyone instead of being stuck in traffic jams - with intelligent traffic concepts and sustainable mobility.","411",NA
"Deswegen sind eine neue Energiepolitik","That is why a new energy policy","411",NA
"und der Umweltund Klimaschutz das Herzstück eines grünen Neuen Gesellschaftsvertrages.","and environmental and climate protection are at the heart of a green New Social Contract.","501",NA
"Öffentliche Investitionen und die Rahmenbedingungen für den Markt müssen darauf ausgerichtet sein, den Umstieg vom fossil-atomaren in das solare Zeitalter so schnell wie möglich zu schaffen.","Public investment and the market framework must be geared toward making the transition from the fossil-nuclear to the solar age as quickly as possible.","501",NA
"Zum Erhalt unserer eigenen Lebensgrundlagen und mit Blick auf nachfolgende Generationen müssen wir das Klima genauso schützen","To preserve our own livelihoods and with a view to future generations, we must protect the climate as","501",NA
"wie auch die biologische Vielfalt, Luft, Wasser und Boden.","well as biodiversity, air, water and soil.","501",NA
"Zugleich legen wir damit die Grundlagen für eine zukunftsfähige Wirtschaft","At the same time, we are laying the foundations for a sustainable economy","408",NA
"und für Beschäftigungswachstum in wichtigen Zukunftsindustrien.","and for job growth in important industries of the future.","408",NA
"Mit dem grünen Neuen Gesellschaftsvertrag wird endlich Schluss damit gemacht, dass Ökologie, Ökonomie und Soziales gegeneinander ausgespielt werden.","The Green New Social Contract will finally put an end to playing ecology, economy and social issues off against each other.","305",NA
"Mit uns wächst zusammen, was zusammen gehört: Klima,","With us, what belongs together grows together: climate,","501",NA
"Gerechtigkeit","Justice","503",NA
"und Freiheit.","and freedom.","201",NA
"Neue Energie ...","New energy ...",NA,NA
"Warum Geld für den Import von Öl, Kohle und Gas ausgeben, wenn sich das Geld besser investieren lässt?","Why spend money on importing oil, coal and gas when the money could be better invested?","303",NA
"Im Jahr 2008 haben wir die unglaubliche Summe von 100 Milliarden Euro für den Import von Öl, Kohle, Gas und Uran ausgegeben.","In 2008, we spent the incredible sum of 100 billion euros on the import of oil, coal, gas and uranium.","303",NA
"Dieses Geld lässt sich besser anlegen.","This money can be better invested.","303",NA
"Die Sonne schickt uns keine Rechnung.","The sun does not send us a bill.","501",NA
"Der Neue Gesellschaftsvertrag heißt für uns: Schritt für Schritt vollständig auf Erneuerbare Energien wie Wind, Wasser, Sonne, Biomasse und Geothermie umzustellen","For us, the New Social Contract means: step by step, switching completely to renewable energies such as wind, water, sun, biomass and geothermal","501",NA
"und die Energieeffizienz deutlich zu steigern.","energy and significantly increasing energy efficiency.","501",NA
"Das lohnt sich dreifach: Es schützt das Klima,","This pays off threefold: It protects the climate,","501",NA
"schafft Jobs,","creates jobs,","408",NA
"stärkt die regionale Wirtschaft und nützt Handwerk und Mittelstand.","strengthens the regional economy and benefits crafts and small and medium-sized businesses.","403",NA
"Bis 2020 setzen wir auf einen Anteil von mindestens 40 Prozent bei der Stromproduktion und 30 Prozent bei der Wärmeproduktion.","By 2020, we are aiming for a share of at least 40 percent in electricity production and 30 percent in heat production.","501",NA
"Der Erfolg gibt uns Recht.","Our success proves us right.","305",NA
"Bis Ende 2008 haben wir durch das von uns im Jahr 2000 durchgesetzte Erneuerbare-Energien-Gesetz (EEG) bereits mehr als 15 Prozent beim Strom erreicht.","By the end of 2008, we had already achieved more than 15 percent in electricity thanks to the Renewable Energy Sources Act (EEG), which we pushed through in 2000.","501",NA
"Das EEG ist inzwischen zum weltweiten Modell für erfolgreiche Energiepolitik geworden und muss erhalten bleiben.","The EEG has now become a global model for successful energy policy and must be preserved.","501",NA
"Den Ausbau der Netze wollen wir durch bessere Bedingungen für Erdkabel erleichtern und beschleunigen.","We want to facilitate and accelerate the expansion of the networks by improving the conditions for underground cables.","411",NA
"Wir wollen einen weiteren starken Ausbau der Erneuerbaren Energien.","We want a further strong expansion of renewable energies.","501",NA
"Bestehende bauplanerische Hindernisse wollen wir unter Wahrung der Naturschutzbelange ausräumen.","We want to remove existing obstacles to construction planning while respecting nature conservation concerns.","411",NA
"Weil der Klimawandel schneller voranschreitet als noch vor wenigen Jahren vorhergesagt, müssen wir viel mehr tun.","Because climate change is happening faster than predicted just a few years ago, we need to do much more.","501",NA
"Der nächste große Schritt muss folgen.","The next big step must follow.","501",NA
"Nach dem Boom beim Strom muss nun der Boom bei der Wärme folgen.","The boom in electricity must now be followed by a boom in heat.","501",NA
"Immer mehr Ortschaften stellen inzwischen ihre Energieversorgung vollständig auf erneuerbare Quellen um.","More and more localities are now converting their energy supply entirely to renewable sources.","501",NA
"Sie beziehen Energie von ihren Bäuerinnen und Bauern, die Biomasse von Feldern und Wäldern zu Strom und Wärme machen.","They get energy from their farmers, who turn biomass from fields and forests into electricity and heat.","501",NA
"Diesen Pionieren sollen viele Orte folgen.","These pioneers are to be followed by many places.","501",NA
"Wir wollen ein Wärmegesetz, das auch im Gebäudebestand die Nutzung Erneuerbarer Energien vorgibt.","We want a heating law that also stipulates the use of renewable energies in existing buildings.","501",NA
"Mit ihrem nur auf wenige Neubauten beschränkten Gesetz ist die große Koalition auch hier zu kurz gesprungen.","With its law, which is limited to only a few new buildings, the grand coalition has also fallen short here.","305",NA
"Wir wollen eine effiziente Wärmeversorgung und vor allem keine Abwärme aus industriellen Prozessen mehr vergeuden, sondern sie über den Ausbau der Wärmenetze nutzbar machen.","We want an efficient heat supply and, above all, we don't want to waste any more waste heat from industrial processes, but instead make it usable by expanding the heat networks.","501",NA
"Wir wollen eine Verpflichtung zur Nachrüstung aller Gebäude auf mindestens 20 Prozent erneuerbare Wärme bis 2020, weil das auf Dauer Kosten spart.","We want a commitment to retrofit all buildings to at least 20 percent renewable heat by 2020, because that saves money in the long run.","501",NA
"Damit die Umstellung heute bereits bezahlbar wird, wollen wir ein umfassendes Finanzprogramm für die energetische Gebäudesanierung, das Hausbesitzern auch direkte Zuschüsse bietet.","To make the switch affordable today, we want a comprehensive financial program for energy-efficient building renovation that also offers homeowners direct subsidies.","501",NA
"Darüber hinaus wollen wir Energiespar-Dienstleistungen erleichtern.","In addition, we want to facilitate energy-saving services.","501",NA
"Wir wollen die EU zu einer Gemeinschaft für Erneuerbare Energien (EURENEW), Energieeinsparung und Energieeffizienz machen.","We want to make the EU a community for renewable energies (EURENEW), energy saving and energy efficiency.","501","108"
"Sie soll Prioritäten neu setzen und Impuls für eine moderne und intelligente Stromerzeugung und -nutzung im 21. Jahrhundert sein.","It is intended to set new priorities and provide the impetus for modern and intelligent power generation and use in the 21st century.","108",NA
"Damit der Wind aus dem Norden und die Sonne aus dem Süden die Haushalte im ganzen Land erreichen, ist es notwendig, unsere Stromnetze zu erneuern und intelligenter zu machen.","To ensure that the wind from the north and the sun from the south reach homes across the country, it is necessary to renew our power grids and make them smarter.","411",NA
"Mit einem »Masterplan Netzintegration« wollen wir ein intelligentes Stromnetz mit optimaler Integration Erneuerbarer Energien schaffen","With a ""Grid Integration Master Plan,"" we want to create an intelligent power grid with optimal integration of renewables","411",NA
"sowie den Bau eines europaweiten Hochspannungsgleichstromnetzes (HGÜ) zum Transport von Strom aus Erneuerbaren Energien voranbringen.","and advance the construction of a Europe-wide high-voltage direct-current (HVDC) grid for transporting electricity from renewables.","411",NA
"Im EEG wollen wir neue Regelungen für die Förderung von Kombikraftwerken inklusive Speicher verankern und so weitere Anreize für den Umbau der Netze","We want to anchor new regulations for the promotion of combined-cycle power plants including storage in the EEG and thus create further incentives for the conversion of the grids.","411",NA
"und den Ausbau Erneuerbarer Energien schaffen.","and the expansion of renewable energies.","501",NA
"Die Energienetze gehören in die Hand einer konzernunabhängigen Deutschen Netzgesellschaft mit staatlicher Mehrheitsbeteiligung und Regulierung.","The energy networks belong in the hands of an independent German grid company with majority state ownership and regulation.","413",NA
"Nur so sichern wir den diskriminierungsfreien Zugang für die Erneuerbaren Energien.","This is the only way to ensure non-discriminatory access for renewable energies.","503",NA
"Auf der Verteilnetzebene ist das am besten von bürgernah orientierten Stadtwerken leistbar.","At the distribution network level, this can best be achieved by municipal utilities with a citizen orientation.","301",NA
"Energiesparen ist einer der schnellsten Wege, das Klima zu schützen","Saving energy is one of the fastest ways to protect the climate","501",NA
"und den Geldbeutel von hohen Energiekosten zu entlasten.","and relieve your wallet from high energy costs.","408",NA
"Unser Umgang mit Energie ist gekennzeichnet durch eine unglaubliche Verschwendung.","Our use of energy is characterized by incredible waste.","501",NA
"Eine Glühbirne macht nur drei Prozent der eingesetzten Energie zu Licht, Häuser lassen bis zu 90 Prozent der Heizenergie ungenutzt nach außen entweichen, drei Viertel der Energie in Kraftstoffen geht im Verbrennungsmotor als Abwärme verloren.","A light bulb converts only three percent of the energy used into light, houses allow up to 90 percent of the heating energy to escape unused to the outside, and three quarters of the energy in fuels is lost as waste heat in the combustion engine.","501",NA
"Zu all diesen Verschwendungsproblemen gibt es technische Lösungen, die nahezu verlustfrei dasselbe leisten.","There are technical solutions to all these waste problems that accomplish the same thing with almost no loss.","501",NA
"Energiesparlampen, Niedrigstenergiehaus oder Elektromotoren reduzieren die Verluste, so dass wir auf Kohle, Öl und Gas verzichten können.","Energy-saving lamps, low-energy houses or electric motors reduce losses so that we can do without coal, oil and gas.","501",NA
"... mit Atomausstieg …","... with nuclear phase-out ...",NA,NA
"Am 27. September entscheiden Sie auch über den Atomausstieg.","On September 27, you will also decide on the nuclear phase-out.","501",NA
"CDU/CSU und FDP wollen eine Renaissance der Atomenergie.","CDU/CSU and FDP want a renaissance of nuclear energy.","305",NA
"Mit uns gibt es kein zurück in diese gefährliche Risikotechnologie.","With us, there is no going back to this dangerous risk technology.","501",NA
"Nur BÜNDNIS 90/DIE GRÜNEN sind dafür die verlässliche politische Kraft!","Only Alliance 90/The Greens are the reliable political force for this!","305",NA
"Wir setzen den Atomausstieg ohne Wenn und Aber fort.","We are continuing the nuclear phase-out without any ifs or buts.","501",NA
"Nach dem Atomausstiegsgesetz werden in der kommenden Legislaturperiode bis zu sieben Atomkraftwerke abgeschaltet.","According to the Nuclear Phase-out Act, up to seven nuclear power plants will be shut down in the coming legislative period.","501",NA
"Alte, besonders riskante Meiler wollen wir vorzeitig vom Netz nehmen.","We want to take old, particularly risky reactors off the grid early.","501",NA
"Der Umbau unserer Energieversorgung zu mehr Effizienz und Erneuerbaren Energien wird umso schneller gelingen, je früher die unflexiblen, nuklearen Großkraftwerke vom Netz genommen werden.","The conversion of our energy supply to more efficiency and renewable energies will succeed all the more quickly the sooner the inflexible, large-scale nuclear power plants are taken off the grid.","501",NA
"Es ist eine Lüge, dass Atomkraft den Strom billiger macht.","It is a lie that nuclear power makes electricity cheaper.","305",NA
"Es stimmt auch nicht, dass der Ausstieg eine »Stromlücke« schafft.","Nor is it true that the phase-out will create an ""electricity gap.""","305",NA
"Die leidige Diskussion um Laufzeitverlängerung ist reiner Machtpoker von E.ON, RWE, EnBW und Vattenfall.","The tiresome discussion about lifetime extension is pure power poker of E.ON, RWE, EnBW and Vattenfall.","415",NA
"Diese vier Konzerne verdienen sich schon heute mit ihren abgeschriebenen und veralteten Kraftwerken eine goldene Nase, während sie zugleich die Strompreise erhöhen.","These four corporations are already making a killing with their depreciated and outdated power plants, while at the same time raising electricity prices.","415",NA
"Jeder Tag Verlängerung bedeutet für sie bares Geld, eine Million Euro am Tag für jedes AKW, aber für die Bürgerinnen und Bürger bedeutet er weniger Sicherheit.","Every day of extension means cash for them, a million euros a day for each nuclear power plant, but for citizens it means less safety.","501",NA
"Die Gefahren der Atomkraft bestehen unverändert fort und es sind sogar neue hinzugekommen:","The dangers of nuclear power continue unchanged and even new ones have been added:","501",NA
"Die Gefahr des militärischen Missbrauchs ist von der zivilen Nutzung nicht zu trennen.","The danger of military misuse cannot be separated from civilian use.","105",NA
"Wer über die Fähigkeit zur Urananreicherung oder zur Wiederaufbereitung von Plutonium verfügt, ist grundsätzlich in der Lage, Atomwaffen herzustellen.","Anyone with the capability to enrich uranium or reprocess plutonium is in principle capable of producing nuclear weapons.","105",NA
"Nordkorea, Pakistan, Israel und Indien haben es vorgemacht.","North Korea, Pakistan, Israel and India have led the way.","105",NA
"Wir GRÜNE setzen uns für einen weltweiten Ausstieg aus der zivilen Nutzung der Atomenergie ein.","We GREENS are committed to a worldwide phase-out of the civilian use of nuclear energy.","107",NA
"Die Sicherheitsprobleme steigen mit zunehmendem Alter der Reaktoren.","Safety problems increase as reactors age.","501",NA
"Gerade die ältesten Meiler sind am wenigsten gegen Terrorangriffe geschützt.","Especially the oldest reactors are the least protected against terrorist attacks.","501",NA
"Bei vorliegenden Erkenntnissen über drohende Gefährdungen durch Anschläge müssen auch die anderen Atomkraftwerke schnellstmöglich abgeschaltet werden.","If there are any indications of imminent danger from attacks, the other nuclear power plants must also be shut down as quickly as possible.","501",NA
"Mit uns wird es keine Laufzeitverlängerung geben.","With us, there will be no lifetime extension.","501",NA
"Aufgrund der ungelösten Endlagerfrage für den Atommüll wollen wir die betrieblichen Rückstellungen der Betreiber für die Entsorgung und den Rückbau der Reaktoren in einen öffentlich-rechtlichen Fonds überführen.","Due to the unresolved final storage issue for nuclear waste, we want to transfer the operators' operating reserves for the disposal and dismantling of the reactors to a public-law fund.","408",NA
"Der Versuch der Atomwirtschaft, Gorleben als Endlager durchzudrücken, wird scheitern.","The nuclear industry's attempt to push through Gorleben as a final repository will fail.","501",NA
"Der Skandal um das mit nuklearer Lauge vollgelaufene Testlager Asse illustriert die Risiken und ungelösten Probleme der Endlagerung und das verantwortungslose Agieren der Atomwirtschaft.","The scandal surrounding the Asse test storage facility, which was filled with nuclear brine, illustrates the risks and unsolved problems of final disposal and the irresponsible actions of the nuclear industry.","501",NA
"Die politischen Versäumnisse müssen in einem Untersuchungsausschuss aufgeklärt werden.","The political failures must be clarified in a committee of inquiry.","305",NA
"Die Asse war der Prototyp für Gorleben.","The Asse was the prototype for Gorleben.","501",NA
"Mit ihm sowie dem Lager Morsleben sind bereits zwei Endlager im Salz gescheitert.","With it and the Morsleben repository, two final repositories in salt have already failed.","501",NA
"Den Standort Gorleben halten wir auch aus geologischen Gründen für ungeeignet.","We also consider the Gorleben site unsuitable for geological reasons.","501",NA
"BÜNDNIS 90/DIE GRÜNEN wollen ein Endlagersuchgesetz für ein ergebnisoffenes Suchverfahren der öffentlichen Hand mit einer umfassenden Bürgerbeteiligung;","BÜNDNIS 90/DIE GRÜNEN want a repository search law for an open-ended public search procedure with comprehensive public participation;","202",NA
"eine Vorfestlegung wie bei Schacht Konrad darf sich nicht wiederholen.","a pre-determination like that at Schacht Konrad must not be repeated.","303",NA
"Das Konzept der Nichtrückholbarkeit soll überdacht werden.","The concept of non-retrievability should be reconsidered.","501",NA
"Durch den Vergleich mehrerer Standorte muss der bestgeeignete geologische Ort zur Aufnahme des Millionen Jahre strahlenden Atommülls gefunden werden.","By comparing several sites, the most suitable geological location to hold millions of years of radiating nuclear waste must be found.","501",NA
"Wir wollen die betrieblichen Rückstellungen der Betreiber für die Entsorgung und den Rückbau der Reaktoren in einen öffentlich-rechtlichen Fonds überführen, dessen Mittel nach ambitionierten Nachhaltigkeitsstandards angelegt werden.","We want to transfer the operators' operating reserves for the disposal and decommissioning of the reactors to a public-law fund whose resources are invested in accordance with ambitious sustainability standards.","408",NA
"Aus diesem muss auch die Endlagersuche finanziert werden.","This must also be used to finance the search for a final repository.","303",NA
"Wir wollen eine Brennelementesteuer einführen, um ungerechtfertigte Profite abzuschöpfen","We want to introduce a fuel element tax to skim off unjustified profits","403",NA
"und der Atomwirtschaft Kosten der Atomenergie aufzuerlegen.","and impose nuclear energy costs on the nuclear industry.","403",NA
"Die Sonderrechte und Subventionen für die Atomindustrie müssen endlich abgeschafft werden.","The special rights and subsidies for the nuclear industry must finally be abolished.","403",NA
"Die Begrenzung der Haftpflichtversicherung für Atomkraftwerke ist nicht akzeptabel.","Limiting liability insurance for nuclear power plants is unacceptable.","403",NA
"Zusätzlich zum Sozialen- und Gesundheitsrisiko trägt die Bevölkerung aktuell auch 99 Prozent des finanziellen Risikos einer Atomkatastrophe.","In addition to the social and health risk, the population currently also bears 99 percent of the financial risk of a nuclear disaster.","408",NA
"Wer den Ausstieg will, muss GRÜN wählen.","Those who want the phase-out must vote GREEN.","501",NA
"Und sollte so schnell wie möglich zu einem Ökostromanbieter wechseln.","And should switch to a green power provider as soon as possible.","501",NA
"... und ohne neue Kohlekraftwerke!","... and without new coal-fired power plants!",NA,NA
"Die Wende zu einer klimafreundlichen und schadstoffarmen Energiepolitik gelingt nicht mit dem Bau neuer Kohlekraftwerke.","The turnaround to a climate-friendly and low-emission energy policy will not succeed with the construction of new coal-fired power plants.","501",NA
"Neue Kohlekraftwerke blockieren ebenso wie eine Laufzeitverlängerung von Atomkraftwerken den notwendigen Ausbau der Erneuerbaren Energien und der hocheffizienten Kraft-Wärme-Kopplung.","New coal-fired power plants, like an extension of the operating lives of nuclear power plants, block the necessary expansion of renewable energies and highly efficient combined heat and power generation.","501",NA
"Es ist eine teure Energieverschwendung zu Lasten von Verbraucherinnen und Verbrauchern","It is an expensive waste of energy to the detriment of consumers","403",NA
"sowie dem Klima, neue Großkraftwerke zu bauen, die mehr als die Hälfte der Energie nutzlos an die Umgebung abgeben.","and the climate to build new large-scale power plants, which release more than half of the energy uselessly into the environment.","501",NA
"Deswegen ist es falsch, dass die Bundesregierung neue Klimakiller mit Steuermilliarden subventionieren will.","That's why it's wrong for the German government to want to subsidize new climate killers with billions in taxes.","305",NA
"Selbst die heute wirksamsten Kohlekraftwerke sind für das Erreichen der zugesagten deutschen Klimaziele nicht geeignet.","Even the most effective coal-fired power plants today are not suitable for achieving Germany's promised climate targets.","501",NA
"Wir GRÜNE stehen an der Seite der Bürgerinitiativen und Umweltverbände, die an vielen Orten gegen den Neubau von gesundheitsgefährdenden Kraftwerken kämpfen.","We GREENS stand by the side of the citizens' initiatives and environmental associations who are fighting in many places against the construction of new power plants that are hazardous to health.","202",NA
"Wir lehnen den Bau neuer klimaschädlicher Kohlekraftwerke ab.","We reject the construction of new climate-damaging coal-fired power plants.","501",NA
"Die CCS-Technik ist ein ungedeckter Scheck.","CCS technology is a bad check.","501",NA
"Das von der großen Koalition vorgelegte Gesetz zur CCS-Technologie lehnen wir ab,","We reject the law on CCS technology presented by the grand coalition.","305",NA
"wir wollen keine CO2-Endlagerexperimente zu Lasten nachfolgender Generationen und zukünftiger Nutzungen.","We do not want any CO2 repository experiments at the expense of future generations and future uses.","706",NA
"Derzeit haben die zuständigen Behörden keine juristische Handhabe, den Bau von Kohlekraftwerken aus Klimaschutzgründen zu verhindern.","At present, the relevant authorities have no legal means of preventing the construction of coal-fired power plants on climate protection grounds.","501",NA
"Das ist eine Lehre der Auseinandersetzung um das Kraftwerk Moorburg.","This is a lesson learned from the controversy surrounding the Moorburg power plant.","501",NA
"Wir wollen das Genehmigungsrecht für Kohlekraftwerke so reformieren, dass ein hoher elektrischer Mindestwirkungsgrad für neue Kraftwerke gesetzlich vorgeschrieben wird.","We want to reform the licensing law for coal-fired power plants so that a high minimum electrical efficiency is required by law for new power plants.","501",NA
"Das bedeutet, dass in der Übergangszeit nur noch moderne und effiziente Gaskraftwerke gebaut werden können.","This means that only modern and efficient gas-fired power plants can be built during the transition period.","501",NA
"Wärme muss bezahlbar bleiben","Heat must remain affordable",NA,NA
