"text","text_en","cmp_code","eu_code"
"Für Massenfluchtsituationen brauchen wir europäische Regelungen, die eine rasche, unbürokratische Aufnahme und einen sicheren Aufenthalt garantieren; alle Mitgliedstaaten müssen Verantwortung übernehmen","In mass refugee situations, we need European regulations that guarantee rapid, unbureaucratic admission and a safe stay; all Member States must take responsibility","201",NA
"Kriegs- und Bürgerkriegsflüchtlinge, Kriegsdienstverweigerer und Deserteure sowie Opfer nicht-staatlicher Verfolgung müssen asylrechtlichen Schutz erhalten","War and civil war refugees, conscientious objectors and deserters as well as victims of non-state persecution must receive protection under asylum law","201",NA
"Folter, geschlechtsspezifische Verfolgung von Frauen oder Verfolgung aufgrund der sexuellen Identität (Homosexualität, Transsexualität) sind Asylgründe und müssen endlich als politische Verfolgung anerkannt werden","Torture, gender-specific persecution of women or persecution based on sexual identity (homosexuality, transsexuality) are grounds for asylum and must finally be recognized as political persecution","201",NA
"Das Kindeswohl muß auch im Ausländerrecht Vorrang haben","The best interests of the child must also take priority in immigration law","201",NA
"Vorbehalte gegen die UN-Kinderrechtskonvention müssen zurückgenommen werden","Reservations against the UN Convention on the Rights of the Child must be withdrawn","201",NA
"Im Ausländergesetz sollte geregelt werden, daß die Bundesländer für gefährdete Gruppen und die Kommunen für humanitäre Einzelfälle eigenständig ein dauerhaftes Bleiberecht erteilen können","The Aliens Act should stipulate that the federal states can independently grant a permanent right of residence for vulnerable groups and the municipalities for individual humanitarian cases","201",NA
"Die Möglichkeit, einen Abschiebestopp nach § 54 Ausländergesetz zu erlassen, muß voll ausgeschöpft werden","The possibility of issuing a ban on deportation under Section 54 of the Aliens Act must be fully utilized","201",NA
"Bündnis 90/Die Grünen lehnen die Sonderbehandlung und Ausgrenzung von Flüchtlingen und Asylsuchenden ab und setzen sich für eine soziale und rechtliche Gleichstellung ein","Alliance 90/The Greens reject the special treatment and exclusion of refugees and asylum seekers and are committed to social and legal equality","705",NA
"Das ”Asylbewerberleistungsgesetz” mit seinen diskriminierenden Regelungen wollen wir streichen","We want to abolish the ""Asylum Seekers Benefits Act"" with its discriminatory regulations","705",NA
"Die Pläne, de facto-Flüchtlingen sämtliche soziale Leistungen zu streichen, lehnen wir strikt ab","We strictly reject the plans to cut all social benefits for de facto refugees","504",NA
"Und wir wenden uns gegen Bestrebungen, Flüchtlinge mit einer Asylcard weiter zu diskriminieren","And we oppose efforts to further discriminate against refugees with an asylum card","705",NA
"Menschenwürdige Mindeststandards, wie Zugang zu Gesundheitsversorgung, Schule und Ausbildung, müssen allen Menschen gewährt werden, unabhängig von ihrem Aufenthaltsrecht","Decent minimum standards, such as access to healthcare, education and training, must be granted to all people, regardless of their right of residence","504",NA
"Abschiebungshaft verstößt gegen rechtsstaatliche Prinzipien","Detention pending deportation violates the principles of the rule of law","202",NA
"Wir lehnen sie darum ab","We therefore reject them","202",NA
"Statt den Herkunftstaaten von Flüchtlingen mit dem Entzug der Entwicklungshilfe zu drohen, wollen wir eine entwicklungspolitische Zusammenarbeit, die dazu beiträgt, die Fluchtursachen zu verringern","Instead of threatening the countries of origin of refugees with the withdrawal of development aid, we want development cooperation that helps to reduce the causes of flight","107",NA
"Mit der Bekämpfung der Fluchtursachen müssen wir zu Hause anfangen","We have to start fighting the causes of flight at home","105",NA
"Ein erster Schritt in diese Richtung ist die Unterbindung von Waffenexporten in Staaten, die die Menschenrechte verletzen","A first step in this direction is the prohibition of arms exports to states that violate human rights","105",NA
"Migration: Bürgerrechte und Integration","Migration: civil rights and integration",NA,NA
"Von den mehr als 7 Millionen Nichtdeutschen im Land leben weit mehr als die Hälfte bereits länger als 10 Jahre hier, ein Viertel bereits über 20 Jahre","Of the more than 7 million non-Germans in the country, far more than half have already lived here for more than 10 years, a quarter for more than 20 years","705",NA
"Die Mehrzahl ihrer Kinder ist hier geboren","The majority of their children were born here","705",NA
"Wir wollen nicht mehr, daß das AusländerInnenrecht diesen MigrantInnen die wichtigsten Rechte verwehrt und sie als ”Fremde” und ”Gäste” behandelt","We no longer want, that the law on foreigners denies these migrants the most important rights and treats them as ""strangers"" and ""guests""","705",NA
"Für sie ist Deutschland zur Heimat geworden","For them, Germany has become their home","705",NA
"Sie müssen einen gesicherten Aufenthaltsstatus erhalten und dürfen nicht mehr ausgewiesen werden","They must be given a secure residence status and may no longer be expelled","705",NA
"Wir unterstützen die ImmigrantInnen in ihrer Forderung nach vollen Bürgerrechten","We support the immigrants in their demand for full citizenship rights","201",NA
"Das deutsche Staatsbürgerschaftsrecht von 1913 ist in europäischem Maßstab Schlußlicht","The German citizenship law of 1913 is the worst in Europe","201",NA
"Es fußt immer noch überwiegend auf dem Bluts- und Abstammungsprinzip","It is still based predominantly on the principle of blood and descent","201",NA
"Wo selbst die Tatsache jahrzehntelanger Einwanderung geleugnet wird, kann zukünftige Einwanderung nicht human gestaltet werden","Where even the fact of decades of immigration is denied, future immigration cannot be shaped humanely","705",NA
"Verweigerte Integration von AusländerInnen und AussiedlerInnen schafft aber gravierende soziale Probleme","Refusal to integrate foreigners and ethnic Germans creates serious social problems","705",NA
"Wir wollen diesem Demokratiedefizit und der Fremdenfeindlichkeit ein Programm der Integration entgegenstellen und die Emanzipation der MigrantInnen fördern","We want to counter this democratic deficit and xenophobia with a program of integration and promote the emancipation of migrants","705",NA
"Erleichterte Einbürgerung dient der Integration","Facilitated naturalization serves integration","705",NA
"Mit einem Niederlassungsgesetz die Rechtlosigkeit überwinden","Overcoming lawlessness with a settlement law",NA,NA
"Mit der Unionsbürgerschaft haben MigrantInnen aus EU-Ländern umfassendere Rechte als andere MigrantInnen","EU citizenship gives migrants from EU countries more extensive rights than other migrants","705",NA
"BÜNDNIS 90/DIE GRÜNEN wollen mit einem Niederlassungsgesetz eine weitestgehende rechtliche Gleichstellung von BürgerInnen aus Drittstaaten mit BürgerInnen der Europäischen Union erreichen","BÜNDNIS 90/DIE GRÜNEN want to achieve the greatest possible legal equality of citizens from third countries with citizens of the European Union with a settlement law","705",NA
"Das Niederlassungsgesetz soll anstelle des restriktiven Ausländerrechts für alle gelten, die seit mindestens drei Jahren rechtmäßig in Deutschland leben","The Settlement Act should apply to all those who have been living legally in Germany for at least three years instead of the restrictive law on foreigners","705",NA
"Es umfaßt Rechte der politischen Betätigung, der demokratischen Teilhabe und des sozialen Schutzes","It includes rights of political activity, democratic participation and social protection","705",NA
"Es ermöglicht auch eine Planungssicherheit für diejenigen, die noch keinen Anspruch auf den deutschen Paß erworben haben","It also provides planning security for those who have not yet acquired the right to a German passport","705",NA
"Auch für Angehörige aus Drittstaaten muß das für EU-BürgerInnen geltende Kommunalwahlrecht eingeführt werden","The right to vote in local elections that applies to EU citizens must also be introduced for third-country nationals","202",NA
"Unverzichtbar ist gerade wegen der Gewalt gegenüber Frauen ein eigenständiges Aufenthaltsrecht ausländischer EhepartnerInnen unabhängig von der Ehedauer","An independent right of residence for foreign spouses, regardless of the duration of the marriage, is indispensable precisely because of the violence against women","503",NA
"Mit einem neuen Staatsbürgerschaftsrecht","With a new citizenship law",NA,NA
"Ungerechtigkeit beenden","End injustice",NA,NA
"Ein neues Staatsbürgerschaftsrecht soll allen in Deutschland geborenen Kindern den deutschen Paß geben, wenn mindestens ein Elternteil hier seinen dauerhaften Lebensmittelpunkt hat","A new citizenship law should give all children born in Germany a German passport if at least one parent has their permanent center of life here","705",NA
"Sie sind InländerInnen und dürfen nicht länger als AusländerInnen behandelt werden","They are nationals and must no longer be treated as foreigners","705",NA
"Das Staatsbürgerschaftsrecht muß so geändert werden, daß das Bodenprinzip gleichberechtigt neben das Abstammungsprinzip tritt","Citizenship law must be changed in such a way that the land principle is given equal status with the principle of descent","705",NA
"Nach fünf Jahren müssen hier lebende AusländerInnen das Recht zur Einbürgerung erhalten","After five years, foreigners living here must be granted the right to naturalization","705",NA
"Die Ermessenseinbürgerung muß bereits vorher möglich sein","Discretionary naturalization must be possible beforehand","705",NA
"Beide Instrumente sind von bürokratischen Schikanen zu entrümpeln","Both instruments need to be stripped of bureaucratic red tape","705",NA
"Die Anerkennung der doppelten Staatsbürgerschaft ist längst überfällig - nicht nur für diejenigen, denen die notwendige Ausbürgerung von Seiten ihrer Herkunftstaaten verweigert wird","The recognition of dual citizenship is long overdue - not only for those who are denied the necessary naturalization by their countries of origin","705",NA
"Mit einem transparenten","With a transparent",NA,NA
"Verfahren Einwanderung human gestalten","Procedure Shape immigration humanely",NA,NA
"Deutschland ist schon lange ein Einwanderungsland","Germany has long been a country of immigration","607",NA
"Wir wollen mit transparenten Verfahren zukünftige Einwanderung regeln","We want to regulate future immigration with transparent procedures","705",NA
"Dies wird auch Ängste in der Bevölkerung gegenüber weiterer Zuwanderung reduzieren","This will also reduce fears among the population about further immigration An","607",NA
"Ein Einwanderungsgesetz versetzt das Land in die Lage, auf Einwanderungsprozesse sozial, human und demokratisch zu reagieren","immigration law puts the country in a position to respond to immigration processes in a social, humane and democratic way On the","607",NA
"Es soll zum einen sicherstellen, daß ArbeitsmigrantInnen nach Deutschland kommen können, wenn für sie ein Arbeitsplatz zur Verfügung steht","On the one hand, it is intended to ensure that migrant workers can come to Germany if a job is available for them","607",NA
"Zum anderen sollen mindestens ein Viertel aller Einwanderungsbewilligungen aus humanitären Gründen ausgesprochen werden, denn wir wollen kein reines Arbeitsaufnahmegesetz","other hand, at least a quarter of all immigration permits should be issued for humanitarian reasons, because we do not want a law that merely accepts work","705",NA
"Dies muß mit Maßnahmen zur Integration, etwa Sprachkursen, verbunden werden","This must be combined with measures for integration, such as language courses","705",NA
"Das Recht auf Familiennachzug muß erhalten, die Gleichberechtigung von Lebenspartnerschaften, denen die Eheschließung aus Rechtsgründen verwehrt ist, sichergestellt werden","The right to family reunification must be preserved, and equal rights must be ensured for civil partnerships that are legally barred from marrying,","705",NA
"Nach einer Übergangsfrist sollen SpätaussiedlerInnen allen anderen Einwanderungswilligen rechtlich gleichgestellt werden","After a transitional period, ethnic German immigrants should be placed on an equal legal footing with all other immigrants","705",NA
"Toleranz ist nicht zu verwechseln mit Gleichgültigkeit","Tolerance should not be confused with indifference","607",NA
"Eine funktionsfähige multikulturelle Gesellschaft muß auch konfliktfähig sein","A functioning multicultural society must also be able to deal with conflict","607",NA
"Das Ausländerrecht darf kein Strafrecht sein","The law on foreigners must not be criminal law","705",NA
"Wir lehnen die Praxis der Ausweisung als zusätzliche De-facto-Strafe ab","We reject the practice of deportation as an additional de facto punishment","705",NA
"Es ist ein besonderer Skandal, wenn hier geborene und aufgewachsene Jugendliche abgeschoben werden","It is a particular scandalif young people born and raised here are deported","705",NA
"Ohne gleichberechtigten Einbezug der in Deutschland lebenden MigrantInnen in die Lösung von Konflikten, ohne Öffnung aller Berufe für diese Menschen und ohne Förderung der bürgerrechtlichen und integrativen Arbeit der Verbände von MigrantInnen sind multikulturelle Konflikte nicht lösbar und Integration unmöglich","Without equal inclusion of migrants living in Germany in the resolution of conflicts, without opening all professions to these people and without promoting the civil rights and integrative work of migrants' associations, multicultural conflicts cannot be resolved and integration is impossible","607",NA
"Für ein Antidiskriminierungsgesetz","For an anti-discrimination law",NA,NA
"Am Umgang mit Minderheiten zeigt sich der demokratische Konsens einer Gesellschaft","A society's democratic consensus can be seen in the way it deals with minorities","705",NA
"Zwischen dem Benachteiligungsverbot in der Verfassung und dessen Umsetzung im täglichen Leben klafft häufig eine breite Lücke","There is often a wide gap between the prohibition of discrimination in the constitution and its implementation in everyday life","705",NA
"Viele europäische Länder haben Antidiskriminierungsgesetze erlassen","Many European countries have enacted anti-discrimination laws","705",NA
"Die Regierung Kohl hat dies bislang verweigert","The Kohl government has so far refused to do so","705",NA
"Wir wollen mit einem Antidiskriminierungsgesetz (ADG) benachteiligten Minderheiten wirksame Mittel in die Hand geben, sich gegen Anfeindungen und Diskriminierungen zu wehren","With an anti-discrimination law (ADG), we want to give disadvantaged minorities effective means of defending themselves against hostility and discrimination","705",NA
"Wer aufgrund seiner oder ihrer ethnischen Abstammung, Herkunft oder Zugehörigkeit, Hautfarbe, Nationalität, religiösen Anschauung, sexuellen Identität oder Behinderung benachteiligt wird, soll künftig einen Anspruch auf Schadensersatz und Schmerzensgeld haben","Anyone who is disadvantaged on the basis of his or her ethnic origin, origin or affiliation, skin color, nationality, religious beliefs, sexual identity or disability should in future be entitled to compensation for damages and pain and suffering","705",NA
"Ebenso müssen Maßnahmen gegen die Diskriminierung alter Menschen ergriffen werden","Measures must also be taken to combat discrimination against older people","706",NA
"Sowohl die Betroffenen selbst als auch Verbände von Betroffenen sollen, z.B. gegenüber diskriminierenden ArbeitergeberInnen oder VermieterInnen, Ansprüche auf Beseitigung und Unterlassung durchsetzen können","Both the affected persons themselves and associations of affected persons should be able to enforce claims for removal and injunctive relief, e.g. against discriminatory employers or landlords","705",NA
"Zur Beseitigung bestehender gesetzlicher Ungleichbehandlungen und Barrieren sind spezielle Regelungen für behinderte Menschen, Schwule und Lesben sowie MigrantInnen notwendig","Special regulations for disabled people, gays and lesbians and migrants are needed to eliminate existing legal inequalities and barriers","705",NA
"Zugleich wollen wir zur Prävention die Anti-Gewaltprogramme für alle Minderheiten ausbauen","At the same time, we want to expand anti-violence programs for all minorities to prevent violence","705",NA
"Minderheiten werden von vielen Menschen, die unter der verfehlten Wirtschafts- und Sozialpolitik leiden, zu Sündenböcken erklärt","Minorities are declared scapegoats by many people who are suffering from failed economic and social policies","705",NA
"Gegen solche Tendenzen will unser ADG den Bedrohten rechtlichen Schutz verschaffen, um Ausgrenzung und Herabsetzung zurückzudrängen","Our ADG aims to provide legal protection against such tendencies for those under threat in order to push back marginalization and disparagement","705",NA
"Gleichberechtigte Teilhabe für Menschen mit Behinderungen","Equal participation for people with disabilities",NA,NA
"Wir wenden uns gegen die behindertenfeindlichen Tendenzen in unserer Gesellschaft, in der über die ”Brauchbarkeit” von Menschen oder über ”lebenswertes” und ”lebensunwertes” Leben diskutiert wird und in der trotz der Verfolgung von Behinderten während der NS-Zeit immer wieder Stimmen laut werden, die für die ”Euthanasie” Schwerstbehinderter plädieren","We oppose the anti-disability tendencies in our society, in which the ""usefulness"" of people or ""life worth living"" and ""life not worth living"" are discussed and in which, despite the persecution of disabled people during the Nazi era, voices are repeatedly raised in favor of the ""euthanasia"" of severely disabled people","705",NA
"Menschen mit Behinderungen muß durch das ADG endlich eine gleichberechtigte Teilhabe am Leben der Gemeinschaft ermöglicht werden","The ADG must finally enable people with disabilities to participate equally in the life of the community","705",NA
"Beim Zugang zum Öffentlichen Personenverkehr, zur Telekommunikation und im Baurecht müssen die Bedürfnisse Behinderter gesetzlich abgesichert werden","The needs of people with disabilities must be protected by law when it comes to access to public transport, telecommunications and building law","705",NA
"Die Gebärdensprache gehörloser Menschen ist als eigene Sprache anzuerkennen","The sign language of deaf people must be recognized as a language in its own right","705",NA
"Neben der Verpflichtung zum schrittweisen Abbau von Verkehrsbarrieren sollen die rechtlichen Möglichkeiten behinderter Menschen und ihrer Organisationen gestärkt werden","In addition to the obligation to gradually remove transport barriers, the legal options for people with disabilities and their organizations are to be strengthened","705",NA
"Eine Stärkung der Mitwirkungsrechte ändert auch die gesellschaftliche Rolle behinderter Menschen: weg vom Objekt der Fürsorge anderer hin zum Subjekt des eigenen Lebens","Strengthening participation rights also changes the role of disabled people in society: away from being the object of others' care and towards being the subject of their own lives","705",NA
"Gleiche Rechte für Schwule und Lesben","Equal rights for gays and lesbians",NA,NA
"Schwule und Lesben nehmen Diskriminierung und Mißachtung längst nicht mehr schweigend hin, sondern streiten engagiert für Gleichberechtigung","Gays and lesbians have long since ceased to accept discrimination and disregard in silence, but are committed to fighting for equal rights","705",NA
"Das Europäische Parlament hat auf Initiative der Grünen Mindeststandards für die Bürgerrechte von Lesben und Schwulen empfohlen","The European Parliament, on the initiative of the Greens, has recommended minimum standards for the civil rights of lesbians and gays","705",NA
"Diese Standards wollen wir in der Bundesrepublik umsetzen","We want to implement these standards in the Federal Republic of Germany","705",NA
"Gleichgeschlechtliche Partnerschaften müssen die gleichen Möglichkeiten zur rechtlichen Ausgestaltung ihrer Lebensgemeinschaft erhalten wie heterosexuelle: Eheschließungsrecht und Öffnung aller Regelungen für nichteheliche Lebensgemeinschaften","Same-sex partnerships must be given the same opportunities as heterosexual partnerships to legally structure their cohabitation: Marriage law and opening of all regulations for non-marital cohabitation","604",NA
"Wir wollen Schutz vor Benachteiligungen in der Arbeitswelt und im Mietrecht,","We want protection against discrimination in the world of work and in tenancy law,","705",NA
"Beseitigung von Diskriminierungen im Vereins-, Adoptions-, Kinder- und Jugendhilferecht,","elimination of discrimination in the law on associations, adoption, children and youth welfare,","705",NA
"Sicherstellung des Datenschutzes","ensuring data protection An","201",NA
"Eine aktive Gleichstellungspolitik für Schwule und Lesben soll selbstbestimmte Strukturen auf den Gebieten der Beratung, Kommunikation, Kunst, Wissenschaft und Jugendkultur stärken und fördern","active equality policy for gays and lesbians should strengthen and promote self-determined structures in the fields of counseling, communication, art, science and youth culture A federal","705",NA
"Es ist eine Beauftragtenstelle der Bundesregierung einzurichten","government commissioner's office should be established","705",NA
"Zur Bekämpfung antihomosexueller Gewalt fordern wir ein Bund-Länder-Programm mit folgenden Eckpunkten:","To combat anti-homosexual violence, we call for a federal-state program with the following cornerstones:","605",NA
"Unterstützung homosexueller Anti-Gewaltprojekte,","Support for homosexual anti-violence projects,","705",NA
"Hilfe für Gewaltopfer,","assistance for victims of violence,","705",NA
"Sensibilisierung von Polizei und Justiz,","sensitization of the police and judiciary,","705",NA
"Erforschung von Ausmaß und Ursachen der Gewalt,","research into the extent and causes of violence,","506",NA
"Aufklärungs- und Präventionsprogramme für gewaltbereite Gruppen","education and prevention programs for groups willing to use violence","506",NA
"Öffentliche Sicherheit stärken –","Strengthen public safety -",NA,NA
"Kriminalität verhüten","Prevent crime",NA,NA
"Verhütung von Straftaten","Prevention of crime",NA,NA
"Öffentliche Sicherheit ist eine Frage der Lebensqualität","Public safety is a question of quality of life","605",NA
"Kriminalität, Belästigungen und Aggressivität im Straßenverkehr schaffen ein Gefühl der Verunsicherung","Crime, harassment and aggression in traffic create a feeling of insecurity","605",NA
"Eindimensionale Antworten greifen zu kurz","One-dimensional answers do not go far enough","605",NA
"Wir setzen auf einen ursachenorientierten Umgang mit der Kriminalität","We focus on a cause-oriented approach to crime","605",NA
"Die Bekämpfung von Armut, Arbeitslosigkeit, Perspektivlosigkeit und Diskriminierung muß vorrangiges Ziel der Politik sein","The fight against poverty, unemployment, lack of prospects and discrimination must be the primary goal of politics,","503",NA
"Die Bundesregierung bekämpft dagegen statt der Armut die Armen","The federal government, on the other hand, is fighting the poor instead of poverty","503",NA
"Eine Politik mit der Angst lehnen wir ab","We reject a policy of fear We are","606",NA
"Wir sind gegen weitere Strafrechtsverschärfungen","against further tightening of criminal laws","000",NA
"Sie leisten keinen Beitrag zum Abbau der Kriminalität","They do not contribute to reducing crime","000",NA
"Sie schaffen nicht mehr Sicherheit","They do not create more security","000",NA
"Statt dessen müssen Opferhilfe und Resozialisierungsmaßnahmen ausgebaut werden","Instead, victim assistance and resocialization measures must be expanded","606",NA
"Öffentliche Sicherheit ist eine gemeinsame Aufgabe der Gesellschaft und keine alleinige Domäne der Polizei und Justiz","Public security is a joint task of society and not the sole domain of the police and the judiciary","606",NA
"BÜNDNIS 90/DIE GRÜNEN setzen sich für ein zivilgesellschaftliches Sicherheitsmodell ein: Wir unterstützen die Einrichtung kommunaler Präventionsräte","Alliance 90/The Greens are committed to a civil society security model: We support the establishment of municipal prevention councils","606",NA
"BürgerInnen, Verbände, Vereine, Kirchen und Behörden können mit Unterstützung der Polizei gemeinsam die Sicherheit verbessern","Citizens, associations, churches and authorities can work together to improve security with the support of the police",NA,NA
"Prävention umfaßt Maßnahmen zur Sicherheit im Stadtteil durch eine veränderte Stadtentwicklungs-, Bau- und Verkehrspolitik","Prevention includes measures for safety in the district through a change in urban development, construction and traffic policy","303",NA
"Sie sollen den öffentlichen Raum beleben und sicherer gestalten","They are intended to enliven public spaces and make them safer","605",NA
"Präventionsarbeit gegen Gewaltdelikte muß auch in der Schule und Bildungsarbeit stattfinden","Prevention work against violent crime must also take place in schools and educational work","506",NA
