"text","text_en","cmp_code","eu_code"
"und klare Regeln wie diesen Menschen geholfen werden kann und unter welchen Umständen auch finanzielle Wiedergutmachung zu leisten ist.","and clear rules on how these people can be helped and under which circumstances financial reparations are to be made.","503",NA
"Für zu Unrecht Inhaftierte wollen wir die Haftentschädigung deutlich anheben.","We want to significantly increase prison compensation for those wrongfully imprisoned.","503",NA
"Das muss uns die Freiheit allemal wert sein.","Freedom must always be worth that to us.","201",NA
"Für eine bürgerrechtliche EU-Justiz und Innenpolitik","For a citizens' rights-based EU justice and home affairs policy",NA,NA
"Freiheit, Sicherheit und Recht können heute nicht mehr alleine im nationalen Kontext gewährleistet werden.","Freedom, security and justice can no longer be guaranteed in a national context alone.","107",NA
"Die Verfolgung schwerer grenzüberschreitender Kriminalität oder des internationalen Terrorismus erfordert eine enge Zusammenarbeit mit den europäischen Partnerländern und darüber hinaus.","The prosecution of serious transnational crime or international terrorism requires close cooperation with European partner countries and beyond.","107",NA
"Auch in der europäischen Justiz- und Innenpolitik muss die Balance von Freiheit und Sicherheit stimmen.","The balance between freedom and security must also be right in European justice and home affairs policy.","108",NA
"Leider ist das nicht immer der Fall – die große Koalition trägt hierfür eine erhebliche Mitverantwortung.","Unfortunately, this is not always the case - the grand coalition bears a considerable share of the responsibility for this.","305",NA
"Die deutsche Europapolitik muss die individuellen Rechte der Menschen verteidigen.","German European policy must defend people's individual rights.","201",NA
"Dazu gehört auch die Stärkung des Datenschutzes auf europäischer Ebene","This also includes strengthening data protection at the European level","201","108"
"und des EU-Datenschutzbeauftragten.","and the EU Data Protection Supervisor.","108",NA
"Der weitere Ausbau der Zusammenarbeit von Polizei und Justiz","Further expansion of police and judicial cooperation","108",NA
"muss Hand in Hand gehen mit verbindlichen Garantien zum Schutz der Bürgerrechte.","must go hand in hand with binding guarantees to protect civil rights.","201",NA
"Wer GRÜN wählt, … • ... macht Schluss mit der heimlichen Computerausforschung","Who votes GREEN, ... - ... putsan end to secret computer research","201",NA
"und der Vorratsdatenspeicherung.","and data retention.","201",NA
"• … bringt den Datenschutz ins Grundgesetz.","- ... bring data protection into the Basic Law. - ...","201",NA
"• … erleichtert Einbürgerung,","facilitates naturalization,","607",NA
"stärkt Integration","strengthens integration","607",NA
"und schützt Flüchtlinge.","and protects refugees.","705",NA
"• … spielt Bürgerrechte nicht gegen Innere Sicherheit aus.","- ... does not play civil rights off against internal security. -","201",NA
"• … zeigt jeder Form der Diskriminierung die rote Karte","... shows the red card to all forms of discrimination","503",NA
"und stärkt die Rechte von Schwulen und Lesben. .","and strengthens the rights of gays and lesbians. ...","705",NA
"9. Demokratie wagen – Ohne Input kein Output","9. dare democracy - no output without input",NA,NA
"Um die Demokratie ist es ruhig geworden in unserem Land.","Democracy has become quiet in our country.","202",NA
"Thematisiert wird sie allenfalls, wenn die Wahlbeteiligung wieder gesunken ist oder der Rechtsradikalismus weiter ansteigt.","At best, it is discussed when voter turnout has dropped again or right-wing radicalism continues to rise.","202",NA
"Stattdessen rufen alle nach mehr Effizienz, mehr Kompetenz, mehr Qualität.","Instead, everyone is calling for more efficiency, more competence, more quality.","202",NA
"Aber ohne das Engagement und die Mitsprache der Betroffenen kann es keine guten Ergebnisse geben.","But without the commitment and voice of those affected, there can be no good results.","202",NA
"Ohne Demokratie gibt es weder Gerechtigkeit noch Freiheit.","Without democracy there is neither justice nor freedom.","202",NA
"Ohne guten Input kein guter Output.","Without good input, there is no good output.","202",NA
"60 Jahre nach der Beschlussfassung des Grundgesetzes und 20 Jahre nach der friedlichen Revolution in Ostdeutschland sagen wir deshalb: Wir wollen wieder mehr Demokratie wagen.","60 years after the adoption of the Basic Law and 20 years after the peaceful revolution in East Germany, we therefore say: We want to dare more democracy again.","202",NA
"Einen grünen Neuen Gesellschaftsvertrag kann es ohne eine Erneuerung unserer Demokratie nicht geben.","There can be no Green New Social Contract without a renewal of our democracy.","202",NA
"Der politische Raum wandelt sich rasant.","The political space is changing rapidly.","202",NA
"Politische Verantwortung ist oftmals nur noch schwer zuzuordnen.","Political responsibility is often difficult to assign.","202",NA
"Veränderte politische Entscheidungsebenen durch die europäische Integration, die Globalisierung und ökonomische Entgrenzung wie auch zahlreiche weitere Faktoren tragen dazu bei, dass sich unsere demokratische Praxis wandelt:","Changing levels of political decision-making due to European integration, globalization and economic dissolution, as well as numerous other factors, are contributing to the transformation of our democratic practice:","202",NA
"Die Rolle der Medien hat sich verändert, das Fünf-Parteien-System gehört der Vergangenheit an, Expertinnen und Experten und Kommissionen definieren, was dem Gemeinwohl vermeintlich förderlich ist.","The role of the media has changed, the five-party system is a thing of the past, experts and commissions define what is supposedly beneficial to the common good.","202",NA
"Lobbyistinnen und Lobbyisten interessensgeleiteter Think-Tanks gewinnen einen immer größeren Einfluss auf die Gesetzgebung.","Lobbyists from interest-driven think tanks are gaining an ever greater influence on legislation.","202",NA
"Immer mehr Menschen zweifeln daran, dass es auf ihre Stimme überhaupt noch ankommt.","More and more people doubt that their voice matters at all.","202",NA
"All dies verlangt neue Antworten zur Stärkung von Demokratie.","All of this calls for new responses to strengthen democracy.","202",NA
"Mit dem Neuen Gesellschaftsvertrag wollen wir deshalb mit Ihnen über die Zukunft unserer Demokratie nachdenken.","With the New Social Contract, we therefore want to reflect with you on the future of our democracy.","202",NA
"Wir wollen unseren Verstand und unsere Leidenschaft einsetzen, um hier neue Ideen und tragfähige Ansätze zu entwickeln.","We want to use our minds and our passion to develop new ideas and viable approaches here.","202",NA
"Demokratie braucht eine neue Institutionenpolitik, die auf Teilhabe, Mitsprache und Transparenz zielt.","Democracy needs a new institutional policy aimed at participation, voice and transparency.","202",NA
"Öffentliche Institutionen gehen uns alle an!","Public institutions concern us all!","202",NA
"Und sie braucht einen neuen Republikanismus.","And it needs a new Republicanism.","202",NA
"Gelebte Demokratie braucht bürgerschaftliche Einmischung, soziale Bewegungen und den konstruktiven Streit um das Gemeinwohl.","Democracy in action needs civic involvement, social movements and constructive debate about the common good.","202",NA
"Unsere Partei – BÜNDNIS 90/DIE GRÜNEN – hat sich aus den außerparlamentarischen Bewegungen heraus entwickelt.","Our party - BÜNDNIS 90/DIE GRÜNEN - has developed out of the extra-parliamentary movements.","202",NA
"Heute wie früher verstehen wir uns als Teil der Anti-Atom- und Ökologiebewegung, der Frauenbewegung, der globalisierungskritischen-, der Friedens- und Bürgerrechtsbewegung.","Today, as in the past, we see ourselves as part of the anti-nuclear and ecological movement, the women's movement, the movement critical of globalization, the peace movement and the civil rights movement.","202",NA
"Heute wie damals braucht die Demokratie starke außerparlamentarische Stimmen, die das politische System in Bewegung versetzen,","Today, as then, democracy needs strong extra-parliamentary voices to set the political system in motion,","202",NA
"und viele engagierte Menschen, die die Qualität unseres Zusammenlebens bereichern.","and many committed people to enrich the quality of our life together.","606",NA
"Dies wird umso dringender auf internationaler Ebene, wo die Regelungskraft der klassischen Parteien noch zu gering ist.","This is all the more urgent at the international level, where the regulatory power of the traditional parties is still too limited.","107",NA
"Die Mitbestimmung von sozialen Bewegungen und Nichtregierungsorganisationen in europäischen und internationalen Organisationen hat deshalb eine hohe Bedeutung.","The co-determination of social movements and non-governmental organizations in European and international organizations is therefore of great importance.","202",NA
"Wir GRÜNE wollen auf internationaler Ebene mehr Offenheit bei der Entscheidungsfindung, um die wichtigen Regelungen für globale Probleme auf einen demokratischen Boden zu stellen.","We GREENS want more openness in decision-making at the international level in order to put the important regulations for global problems on a democratic ground.","202",NA
"Demokratie braucht bürgerschaftliches Engagement","Democracy needs civic engagement",NA,NA
"Gerade weil unsere Partei aus Bewegungen entstanden ist und den Gedanken von Einmischung, Eigeninitiative und Engagement in sich trägt, wissen wir um die Bedeutung des bürgerschaftlichen Engagements.","Precisely because our party grew out of movements and carries within it the idea of interference, initiative and commitment, we know the importance of civic engagement.","606",NA
"Bürgerschaftliches Engagement muss integraler Bestandteil unserer Gesellschaft sein und ist kein Ersatz für staatliche Aufgaben.","Civic engagement must be an integral part of our society and is not a substitute for government tasks.","606",NA
"Wir sehen im Engagement sowohl die Notwendigkeit und Chance für die Gesellschaft wie für die und den Einzelnen.","We see commitment as both a necessity and an opportunity for society as well as for the individual.","606",NA
"Engagement bedeutet soziale und kulturelle Teilhabe und persönliche Weiterentwicklung für jede und jeden von uns.","Engagement means social and cultural participation and personal development for each and every one of us.","606",NA
"Für die Zukunft unseres Gemeinwesens bedeutet Engagement Kreativität und Solidarität.","For the future of our community, commitment means creativity and solidarity.","606",NA
"Wir wollen dieses Engagement stärken und dafür sorgen, dass es die notwendige Unterstützung bekommt.","We want to strengthen this commitment and ensure that it receives the necessary support.","606",NA
"Menschen, die sich freiwillig und unentgeltlich engagieren, wollen wir fördern und denjenigen, die es nicht tun, den Zugang erleichtern.","We want to encourage people who volunteer and work for free, and make it easier for those who do not.","606",NA
"Wir brauchen verlässliche Rahmenbedingungen, wenig Bürokratie, sich öffnende Institutionen, Anerkennung und kompetente Anlaufstellen vor Ort.","We need reliable framework conditions, little bureaucracy, institutions that open up, recognition and competent local points of contact.","303",NA
"Deshalb werden wir uns für die Sicherung von Infrastruktureinrichtungen einsetzen.","Therefore, we will work to secure infrastructure facilities.","303",NA
"Eine lebendige Zivilgesellschaft braucht die Einmischung, Kreativität und die Beteiligung vieler Menschen, ob jung oder alt, das zeichnet sie aus.","A vibrant civil society needs the interference, creativity and participation of many people, young and old, that is what distinguishes it.","606",NA
"Mehr Demokratie zu wagen, heißt für uns, Geschlechterdemokratie zu verwirklichen.","For us, daring to be more democratic means making gender democracy a reality.","503",NA
"Im Bundestag liegt der Frauenanteil bei gerade einmal 32 Prozent, in den Kommunen und Landtagen allerdings erheblich niedriger.","In the Bundestag, the proportion of women is just 32 percent, but in the local and state parliaments it is considerably lower.","706",NA
"Die grüne Frauenquote ist eine Erfolgsgeschichte – und doch bleibt noch viel zu tun.","The green women's quota is a success story - and yet much remains to be done.","305",NA
"Mehr Demokratie zu wagen, heißt, der multikulturellen Vielfalt Rechnung zu tragen.","Daring to be more democratic means taking multicultural diversity into account.","607",NA
"Demokratie braucht wechselseitige Anerkennung von Unterschiedlichkeit","Democracy needs mutual recognition of diversity","503",NA
"ebenso wie die gemeinsame Anerkennung von Freiheit,","as well as the common recognition of freedom,","201",NA
"Demokratie","Democracy","202",NA
"und Rechtsstaat.","and the rule of law.","201",NA
"Eine Demokratie ist dann stark, wenn Frauen und Männer gleichermaßen in ihren Parlamenten vertreten sind.","A democracy is strong when women and men are equally represented in its parliaments.","503",NA
"Wir werden uns dafür einsetzen, analog dem französischen Paritätsgesetz Grundlagen dafür zu schaffen, damit mehr Frauen in den Parlamenten vertreten sind.","We will work to create the basis for this, analogous to the French Parity Act, so that more women are represented in parliaments.","706",NA
"Wir brauchen eine Erneuerung der Demokratie auf den verschiedenen Ebenen – von der Kommune bis nach Europa.","We need a renewal of democracy at the various levels - from the community to Europe.","202",NA
"Und wir brauchen eine Erneuerung unserer Demokratie an den verschiedenen gesellschaftlichen Orten – in der Schule, in der Hochschule, im Arbeitsleben oder im Gesundheitswesen.","And we need a renewal of our democracy in the different places of society - in school, in university, in working life or in health care.","202",NA
"Revival der Kommune","Revival of the commune",NA,NA
"In den Kommunen gestalten die Bürgerinnen und Bürger ihr Zusammenleben vor Ort.","In the municipalities, citizens shape their lives together locally.","301",NA
"Dort wird Demokratie und Politik am intensivsten ge- und erlebt.","This is where democracy and politics are experienced most intensively.","202",NA
"Kommunale Politik trifft die Menschen unmittelbar vor ihrer Haustür.","Local politics affects people directly on their doorstep.","301",NA
"Die Kommunen sind damit wichtige Keimzellen der demokratischen Gesellschaft","Municipalities are thus important nuclei of democratic society","202",NA
"und des bürgerschaftlichen Engagements.","and civic engagement.","606",NA
"Wir wollen die Kommunen darin bestärken, diese Rolle offensiv wahrzunehmen.","We want to encourage local authorities to play this role proactively.","301",NA
"Wenn auf Bundesebene das Recht auf einen Kindergartenplatz beschlossen wird, so muss es in den Kommunen umgesetzt werden.","If the right to a kindergarten place is decided at the federal level, it must be implemented in the municipalities.","301",NA
"Die Kommunen haben die Folgen einer nicht chancengerechten Bildungspolitik zu tragen.","The municipalities have to bear the consequences of an education policy that does not provide equal opportunities.","301",NA
"Die Kommunen haben die Folgen einer falschen Mobilitätspolitik auszubaden.","The municipalities have to bear the consequences of a wrong mobility policy.","301",NA
"Die Kommunen haben aber andererseits auch die Ideen und die Menschen, um alle diese Probleme vor Ort anzugehen.","On the other hand, the municipalities also have the ideas and the people to tackle all these problems locally.","301",NA
"Sie müssen dazu allerdings die rechtlichen Möglichkeiten haben.","However, you must have the legal means to do so.","301",NA
"Wo Bundes- und Landeskompetenzen direkt berührt sind, setzen wir auf ein erweitertes Mitspracherecht der Kommunen.","Where federal and state competencies are directly affected, we rely on an extended right of co-determination for the municipalities.","301",NA
"Wir wollen für die Kommunen ein in der Verfassung abgesichertes Anhörungsrecht in Gesetzgebungsverfahren schaffen.","We want to create a constitutional right for local authorities to be heard in legislative processes.","301",NA
"Damit soll es möglich sein, den Sachverstand der Kommunen aus dem Vollzug der Gesetze auch in den Gesetzgebungsprozess einzubringen und auf diese Weise zu einer bürgernäheren Gesetzgebung beizutragen.","This should make it possible to bring the expertise of the municipalities from the execution of the laws into the legislative process and in this way contribute to legislation that is closer to the citizens.","301",NA
"Wir wollen im Zuge der Föderalismusreform die kommunale Selbstverwaltung ausbauen und ihren Schutz vor staatlichen Eingriffen stärken.","In the course of the federalism reform, we want to expand local self-government and strengthen its protection against state intervention.","301",NA
"Demokratie in der Kommune braucht die Stimme Aller.","Democracy in the community needs the voice of all.","202",NA
"Auch Nicht-EU-Bürgerinnen und -Bürger sollen deshalb ein kommunales Wahlrecht erhalten.","Non-EU citizens should therefore also be given the right to vote in local elections.","202",NA
"Die Kommunen brauchen zudem eine solide Finanzbasis, um ihre Aufgaben erfüllen zu können.","The municipalities also need a solid financial basis to be able to fulfill their tasks.","301",NA
"Die Kluft zwischen armen und reichen Kommunen wird immer größer.","The gap between rich and poor communities is widening.","301",NA
"Damit die Städte und Gemeinden ihre Leistungen – von der Wasserversorgung bis zu den Bildungs- und Kultureinrichtungen – auch qualitativ hochwertig für alle Bürgerinnen und Bürger erbringen können, muss ihnen eine finanzielle Mindestausstattung in der Verfassung gesichert werden.","In order for cities and municipalities to be able to provide their services - from water supply to educational and cultural facilities - to all citizens at a high level of quality, they must be guaranteed a minimum level of financial resources in the constitution.","301",NA
"Wir wollen den Städten und Gemeinden zu mehr Mitsprache bei der Gesetzgebung von Bund und Ländern verhelfen.","We want to help cities and communities have a greater say in federal and state legislation.","301",NA
"Wir setzen uns für ein Anhörungsrecht der Kommunen auf Bundesebene ein.","We advocate the right of local authorities to be consulted at federal level.","301",NA
"Damit nicht – wie in der Vergangenheit – die Kosten von neuen Gesetzesvorhaben von Bund und Ländern auf die Kommunen abgewälzt werden, wollen wir sicherstellen, dass der, der die Leistungen bestellt, sie auch bezahlt.","To ensure that the costs of new legislation are not passed on to the municipalities by the federal and state governments - as has happened in the past - we want to make sure that whoever orders the services also pays for them.","301",NA
"Der Bund muss die Möglichkeit erhalten, den Kommunen Aufgaben zu übertragen und ihnen die dafür benötigten Finanzmittel direkt zukommen zu lassen.","The federal government must be given the opportunity to transfer tasks to the municipalities and to provide them directly with the financial resources they require.","301",NA
"Wir halten an der Gewerbesteuer fest und wollen sie zu einer kommunalen Wirtschaftssteuer weiterentwickeln.","We are retaining the trade tax and want to develop it into a municipal business tax.","301",NA
"Alle wirtschaftlich Tätigen vor Ort sollen sich an der Finanzierung der kommunalen Aufgaben beteiligen.","All local businesses should contribute to the financing of municipal tasks.","301",NA
"Die Grundsteuer muss künftig auf der Basis aktualisierter Bodenrichtwerte und nach Maßgabe der Flächeninanspruchnahme erhoben werden.","In the future, property tax must be levied on the basis of updated standard land values and according to land use.","303",NA
"Kommunen sollen sich an der Betreuung von Langzeitarbeitslosen nicht nur beteiligen, sondern diese auch allein durchführen können.","Municipalities should not only participate in the care of the long-term unemployed, but also be able to carry it out on their own.","301",NA
"Demokratisch verfasste Regionen","Democratically constituted regions",NA,NA
"Ob Arbeiten, Wohnen, Einkaufen oder die Organisation der Gesundheitsvorsorge, der Müllabfuhr oder des Nahverkehrs – unsere Lebenswelt organisiert sich zunehmend regional.","Whether it's working, living, shopping or organizing health care, garbage collection or local transport - our living environment is becoming increasingly organized on a regional basis.","301",NA
"Alte Konflikte, wie die interkommunale Konkurrenz, Gewerbeansiedlungen und der Lastenausgleich zwischen Kernstädten und ihrem Umland, bestehen fort.","Old conflicts, such as inter-municipal competition, commercial settlements and burden-sharing between core cities and their surrounding areas, persist.","303",NA
"Die Möglichkeiten der Problemlösung überschreiten vielerorts alte Kreisgrenzen.","In many places, the possibilities for solving problems transcend old county boundaries.","303",NA
"Sie sind regional geworden.","They have become regional.","303",NA
"Wir brauchen deshalb demokratisch legitimierte Institutionen, die diese vielfältig verflochtenen Lebens- und Wirtschaftsräume organisieren und repräsentieren;","We therefore need democratically legitimized institutions that organize and represent these diversely interwoven living and economic spaces;","202",NA
"die den enormen Herausforderungen der demografischen Entwicklung, des ökonomischen Struktur- und Klimawandels und der wirtschaftlichen Konkurrenz der Regionen eine abgestimmte Strategie entgegenstellen.","that counter the enormous challenges of demographic development, economic structural and climate change, and economic competition between regions with a coordinated strategy.","303",NA
"Zusätzlich zur Stärkung der Kommunen muss jetzt das regionale Prinzip in den Vordergrund treten.","In addition to strengthening the municipalities, the regional principle must now come to the fore.","301",NA
"Hierzu bedarf es demokratisch verfasster Regionen, die den anfallenden überörtlichen Aufgaben gerecht werden und mit denen sich die Bürgerinnen und Bürger identifizieren können.","This requires democratically constituted regions that can cope with the supra-local tasks involved and with which the citizens can identify.","202",NA
"Starker und transparenter Parlamentarismus","Strong and transparent parliamentarism",NA,NA
"Demokratie braucht starke und transparente Parlamente.","Democracy needs strong and transparent parliaments.","202",NA
"Wir wollen deshalb die Legislative stärken – sowohl hinsichtlich einer sich verselbstständigenden Exekutive wie auch hinsichtlich einer immer mehr Entscheidungen treffenden Judikative.","We therefore want to strengthen the legislative branch - both with regard to an executive branch that is becoming increasingly independent and with regard to a judiciary that is making more and more decisions.","202",NA
"Die Parlamente sind die demokratischen Orte, in denen die wichtigen gesellschaftlichen Fragen im Rahmen der Verfassung zu entscheiden sind.","Parliaments are the democratic places where the important social issues are to be decided within the framework of the Constitution.","202",NA
"Wir wenden uns gegen ein Abschieben dieser Fragen in Expertinnen- und Expertenkommissionen ebenso, wie gegen eine Abschiebung der Verantwortung an das Bundesverfassungsgericht.","We oppose the relegation of these questions to expert commissions as well as the relegation of responsibility to the Federal Constitutional Court.","202",NA
"Wir Grüne wollen auch den schleichenden Übergang parlamentarischer Aufgaben in den Bereich der Exekutive verhindern.","We Greens also want to prevent the creeping transfer of parliamentary tasks to the executive branch.","202",NA
"Wie die USA wollen wir ein Parlament, das die Regierung mit eigenen Haushaltszahlen kontrollieren kann (»budget office«).","Like the USA, we want a parliament that can control the government with its own budget figures (""budget office"").","202",NA
"Wir setzen uns für die Bestätigung von Aufsichtsratsvertreterinnen und -vertretern des Staates im Parlament ein.","We advocate the confirmation of supervisory board representatives of the state in parliament.","202",NA
"Gutachten müssen zügig veröffentlicht werden.","Expert opinions must be published quickly.","202",NA
"Internationale Verhandlungen müssen vorab Thema im Parlament werden.","International negotiations must become a topic in parliament in advance.","202",NA
"Eine Verlängerung der Legislaturperiode kommt nur dann in Frage, wenn gleichzeitig die Entscheidungsrechte der Bürgerinnen und Bürger durch direkte demokratische Elemente gestärkt werden.","An extension of the legislative period can only be considered if, at the same time, citizens' decision-making rights are strengthened through direct democratic elements.","202",NA
"Um die Parlamente zu stärken, muss die Arbeit von Lobbyistinnen und Lobbyisten kontrolliert und transparent gemacht werden.","In order to strengthen parliaments, the work of lobbyists must be controlled and made transparent.","202",NA
