"text","text_en","cmp_code","eu_code"
"und alles dafür zu tun, dass der Zugang zu Sport, Musik und Kultur von den Interessen der Kinder und nicht vom Geldbeutel der Eltern abhängt.","and to do everything to ensure that access to sports, music and culture depends on the interests of the children and not on the purse of the parents.","503",NA
"Wir werden nicht hinnehmen, dass Leben mit Kindern ein Armutsrisiko bedeutet","We will not accept that living with children means a risk of poverty","603",NA
"und ein Viertel aller Kinder in Deutschland in Armut lebt","and that a quarter of all children in Germany live in poverty","503",NA
"– und genauso muss der Armut im Alter jetzt vorgebeugt werden.","- and in the same way, poverty in old age must be prevented now.","503",NA
"Der Neue Gesellschaftsvertrag setzt darauf, dass die Menschen frei entscheiden können, wie sie leben wollen.","The New Social Contract relies on people being free to decide how they want to live.","604",NA
"Für uns ist Familie überall dort, wo Menschen verbindlich füreinander Verantwortung übernehmen, und insbesondere dort, wo Kinder sind: in Ehen mit und ohne Trauschein, in Patchwork- und Regenbogenfamilien, bei Alleinerziehenden, bei Adoptiv- oder Pflegeeltern.","For us, family is everywhere where people take responsibility for each other in a binding way, and especially where there are children: in marriages with and without a marriage certificate, in patchwork and rainbow families, with single parents, with adoptive or foster parents.","604",NA
"Und auch wenn Menschen alt sind, sollen sie noch selbstbestimmt leben können.","And even when people are old, they should still be able to live self-determined lives.","706",NA
"Förderung und Bildung von Anfang an","Promotion and education from the beginning",NA,NA
"Jedes Kind hat ein Recht auf die bestmögliche Förderung.","Every child has a right to the best possible support.","706",NA
"Deshalb treten wir für einen Rechtsanspruch auf eine qualitativ hochwertige und vor allem ganztägige Bildung, Betreuung und Erziehung für alle Kinder ab dem ersten Lebensjahr ein.","That is why we advocate a legal right to high-quality and, above all, all-day education, care and upbringing for all children from the age of one.","506",NA
"Junge Eltern müssen sicher sein, dass sie nach der Elterngeldzeit das Leben mit ihrem Kind und eine Berufstätigkeit miteinander verbinden können.","Young parents need to be sure that they will be able to combine life with their child and a career after the parental allowance period.","603",NA
"Wir können es uns nicht leisten, auf viele Mütter und auch Väter im Berufsleben zu verzichten, bloß weil es nicht ausreichend flexible und qualifizierte Betreuungsmöglichkeiten gibt.","We cannot afford to do without many mothers and also fathers in their working lives simply because there are not enough flexible and qualified childcare options.","603",NA
"Wir brauchen eine Qualitätsoffensive für unsere Kindertageseinrichtungen.","We need a quality offensive for our day care centers.","706",NA
"In diesen frühen Jahren werden die Weichen für das spätere Leben der Kinder gestellt.","In these early years, the course is set for the children's later lives.","706",NA
"Mit einer besseren Personalausstattung, kleineren Gruppen und einem höheren Ausbildungsniveau des Personals steigt die Qualität der individuellen kindbezogenen Förderung.","With better staffing, smaller groups and a higher level of staff training, the quality of individual child-related support increases.","706",NA
"Wir GRÜNE wollen, dass Bund, Länder, Kommunen und Träger von Kindertagesstätten sich auf bundesweit gültige Betreuungsstandards verständigen und diese gemeinsam anstreben.","We Greens want the federal government, federal states, local authorities and daycare providers to agree on nationwide childcare standards and work together to achieve them.","302",NA
"Dazu gehören auch ein gesundes Mittagessen und eine gute Ausstattung der Einrichtungen sowie bessere Bezahlung des Personals.","This also includes healthy lunches and good facilities, as well as better pay for staff.","504",NA
"Eltern müssen sich darauf verlassen können, dass ihre Kinder dort gut aufgehoben sind.","Parents must be able to rely on the fact that their children are in good hands there.","603",NA
"Die Qualifizierung und Weiterbildung von Tagesmüttern wollen wir bundeseinheitlich sichern.","We want to ensure that the qualification and further training of childminders is standardized throughout Germany.","302",NA
"Auf den Anfang kommt es an – Frühe Hilfen ausbauen","It's all about the beginning - expanding early support services",NA,NA
"Täglich setzen Eltern alles daran, ihre Kinder zu eigenständigen und eigenverantwortlichen Persönlichkeiten zu erziehen.","Every day, parents do everything they can to raise their children to be independent and responsible individuals.","603",NA
"Eine beachtliche Leistung.","A remarkable achievement.","603",NA
"Gelegentliche Überforderungssituationen und Hilflosigkeit sind dabei ganz normal.","Occasional situations of excessive demands and helplessness are quite normal.","603",NA
"Daneben gibt es aber auch Eltern, die grundsätzlich überfordert sind und Schwierigkeiten mit der Erziehung ihrer Kinder haben.","In addition, there are also parents who are fundamentally overwhelmed and have difficulties with the upbringing of their children.","503",NA
"Für diese Eltern brauchen wir gezielte Unterstützung.","For these parents, we need targeted support.","503",NA
"Wir wollen, dass erfolgreiche Konzepte wie Elternbriefe, »Geburtsbegrüßungsprogramme«, Familienhebammen, Eltern-Kind-Zentren, Stadtteilmütter oder spezielle Hilfsangebote wie zum Beispiel für Eltern von Schreikindern flächendeckend ausgebaut werden und deutlich mehr Unterstützung bekommen.","We want successful concepts such as parenting letters, birth welcoming programs, family midwives, parent-child centers, district mothers or special support services such as for parents of crying children to be expanded nationwide and receive significantly more support.","504",NA
"Frühe Förderung ohne Zugangshürden","Early support without access barriers",NA,NA
"Von einer guten Bildungs- und Förderlandschaft haben alle etwas:","Everyone benefits from a good educational and support landscape:","506",NA
"Kinder aus einem günstigen familiären Umfeld gewinnen zusätzlich, Kindern aus schwierigen Verhältnissen hilft eine gute Kita, frühzeitig Nachteile auszugleichen.","children from a favorable family environment gain additional advantages, while a good daycare center helps children from difficult backgrounds to compensate for disadvantages at an early stage.","503",NA
"Der Zugang zu dieser Förderung muss zum einen unabhängig davon möglich sein, ob beide Eltern berufstätig sind.","On the one hand, access to this support must be possible regardless of whether both parents are employed.","503",NA
"Zum anderen müssen Elternbeiträge nach Einkommen gestaffelt und schrittweise abgebaut werden.","Second, parental contributions must be graduated according to income and gradually reduced.","504",NA
"Wir wollen die Beitragsfreiheit für die Kindertagesbetreuung.","We want the exemption from contributions for day care for children.","504",NA
"In einem ersten Schritt soll ein Betreuungsjahr für jedes Kind gebührenfrei sein.","As a first step, one year of care should be free of charge for every child.","504",NA
"Außerdem darf das ab 2013 geplante Betreuungsgeld nicht eingeführt werden.","In addition, the childcare allowance planned for 2013 must not be introduced.","305",NA
"Denn damit werden gerade die Kinder, die die Förderung und Unterstützung dringend bräuchten, von Kitas und Kindergärten ferngehalten, weil die Eltern für’s Zu-Hause-Betreuen Geld bekommen.","This is because the very children who urgently need support and encouragement are kept away from daycare centers and kindergartens because the parents receive money for taking care of them at home.","503",NA
"Von der besseren Vereinbarkeit von Beruf und Familie profitieren besonders Alleinerziehende, die am Arbeitsmarkt stark benachteiligt sind.","Single parents, who are at a great disadvantage in the labor market, benefit particularly from the improved reconciliation of work and family life.","705",NA
"Aber auch im Alltag sind sie stärker belastet.","But they are also under greater strain in everyday life.","705",NA
"Daher brauchen gerade Einelternfamilien ein gutes Netz aus unbürokratischen sozialen Diensten,","This is why single-parent families in particular need a good network of unbureaucratic social services,","503",NA
"flexiblen Betreuungsmöglichkeiten","flexible childcare options","504",NA
"und auf sie zugeschnittenen Gesundheitsangeboten.","and health services tailored to them.","504",NA
"Mit Hilfe von guter Infrastruktur und materieller Unterstützung wollen wir die Lebenssituation von Alleinerziehenden verbessern.","With the help of good infrastructure and material support, we want to improve the living situation of single parents.","504",NA
"Kinderarmut bekämpfen und verhindern","Combat and prevent child poverty",NA,NA
"Armut von Kindern hat viele Gesichter:","Child poverty has many faces:","706",NA
"Chancenarmut, Bildungsarmut, Mangel an Entwicklungsmöglichkeiten, aber natürlich auch materielle Armut.","Poverty of opportunity, educational poverty, lack of development opportunities, but of course also material poverty.","503",NA
"Wer in solcher Armut groß wird, hat bei uns schlechte Karten.","Anyone who grows up in such poverty has bad cards with us.","503",NA
"Die Risiken, die Schule ohne Abschluss zu verlassen, immer wieder arbeitslos zu werden und womöglich im Alter arm zu sein, sind hoch.","The risks of leaving school without a diploma, becoming repeatedly unemployed and possibly being poor in old age are high.","503",NA
"Um solche Armutskarrieren zu durchbrechen, muss vieles ineinandergreifen:","In order to break through such poverty careers, many things must be interlinked:","503",NA
"Es braucht gute Kindertagesbetreuung und Schulen,","good daycare and schools are needed,","506",NA
"wichtige Infrastruktur für Kinder wie Schwimmhallen und Bibliotheken dürfen nicht schließen,","important infrastructure for children such as swimming pools and libraries must not be allowed to close,","502",NA
"Eltern müssen in ihrer Kompetenz unterstützt werden","parents must be supported in their competencies","603",NA
"und nicht zuletzt muss auch für ein bedarfsgerechtes Auskommen der Familien gesorgt sein.","and, last but not least, families must be provided with an income that meets their needs.","504",NA
"Kinder kann man mit 211 Euro nicht gesund ernähren und ihnen eine kindgerechte Entwicklung ermöglichen.","You cannot feed children healthily and enable them to develop in a way that is appropriate for them with 211 euros.","504",NA
"Für Kinder und Jugendliche brauchen wir deshalb endlich Regelsätze, die den tatsächlichen Bedarf abdecken.","For this reason, we finally need standard rates for children and young people that cover their actual needs.","504",NA
"Aber nicht nur Kinder, deren Eltern Arbeitslosengeld II beziehen, machen die Erfahrung, was es bedeutet, wenig Geld zu haben.","But it is not only children whose parents receive unemployment benefit II who experience what it means to have little money.","503",NA
"Deshalb muss die Ehe- und Familienförderung grundsätzlich überarbeitet werden.","Therefore, marriage and family support must be fundamentally revised.","603",NA
"Wir schlagen eine eigenständige und bedingungslose Kindergrundsicherung für alle Kinder vor.","We propose an independent and unconditional basic child benefit for all children.","504",NA
"Sie soll das soziokulturelle Existenzminimum und Freibeträge für Erziehung und Betreuung umfassen, sofern diese Leistungen nicht öffentlich kostenfrei bereitgestellt werden.","It is to include the socio-cultural subsistence minimum and allowances for education and care, unless these services are provided free of charge by the public sector.","504",NA
"Die Eltern müssen diese Kindergrundsicherung versteuern.","Parents must pay tax on this basic child allowance.","503",NA
"Bei den Regelungen zur Besteuerung der Einkommen aus der Kindergrundsicherung müssen die Familiengröße ebenso berücksichtigt werden, wie Fragen des Unterhaltes.","The regulations on the taxation of income from the basic child allowance must take family size into account, as must questions of maintenance.","503",NA
"Mit dieser Leistung werden sämtliche Kinder unterstützt, unabhängig davon, ob ihre Eltern verheiratet sind oder nicht oder alleinerziehend.","This benefit supports all children, regardless of whether or not their parents are married or single parents.","503",NA
"Zur Finanzierung wollen wir das Ehegattensplitting im Rahmen der verfassungsrechtlichen Möglichkeiten abschaffen.","To finance this, we want to abolish the marital splitting system within the limits of constitutional possibilities.","303",NA
"Das bringt mehr Gerechtigkeit für alle.","This brings more justice for all.","503",NA
"Alleinerziehende, Familien mit geringem Einkommen und Familien mit mehreren Kindern profitieren deutlich.","Single parents, low-income families, and families with multiple children benefit significantly.","503",NA
"Aber auch bestimmte, vermeintlich nicht von Armut bedrohte Familien der Mittelschicht werden durch die einkommensorientierte Kindergrundsicherung abgesichert.","However, certain middle-class families who are supposedly not at risk of poverty are also protected by the income-based basic child allowance.","503",NA
"Familien mit hohen Einkommen bleibt dagegen im Vergleich zu heute unterm Strich weniger.","Families with high incomes, on the other hand, are left with less on the bottom line compared to today.","503",NA
"Mit einer solchen einkommensorientierten Kindergrundsicherung ordnen wir das Familien- und Ehefördersystem völlig neu und stellen es vom Kopf auf die Füße.","With such an income-oriented basic child allowance, we are completely reorganizing the family and marriage support system and turning it upside down.","503",NA
"Neue Väter hat das Land","New fathers the country has",NA,NA
"Eine familienfreundliche Gesellschaft muss die Bedürfnisse von Kindern, Müttern und eben auch Vätern ernst nehmen.","A family-friendly society must take the needs of children, mothers and fathers seriously.","603",NA
"Es gibt immer mehr Väter, die für ihre Kinder da sein wollen.","There are more and more fathers who want to be there for their children.","503",NA
"Unsere Gesellschaft muss sich darauf noch deutlich besser einstellen.","Our society needs to adapt to this much better.","503",NA
"Dazu gehört ganz zentral eine Arbeitskultur und flexible Arbeitszeitmodelle, die es Frauen wie Männern möglich macht, ein Leben mit Kindern und eine erfolgreiche Berufstätigkeit zu vereinbaren.","This includes, quite centrally, a work culture and flexible working time models that make it possible for both women and men to combine a life with children and a successful career.","701",NA
"Wir wollen das Elterngeld weiterentwickeln.","We want to further develop the parental allowance.","503",NA
"Mit der derzeitigen Ausgestaltung werden Erziehende mit keinem oder geringem Einkommen gegenüber dem früheren Erziehungsgeld schlechter gestellt.","With the current design, parents with no or low income are placed in a worse position compared to the previous child-raising allowance.","503",NA
"Deshalb wollen wir einen bedarfsgerechten Sockelbetrag für Geringverdienende und Studierende einführen.","That is why we want to introduce a needs-based basic amount for low-income earners and students.","504",NA
"Alleinerziehende und gleichgeschlechtliche Partnerschaften dürfen nicht benachteiligt werden.","Single parents and same-sex partnerships must not be disadvantaged.","503",NA
"Zwei Vätermonate machen noch keine Gleichberechtigung.","Two months of paternity leave do not make for equality.","503",NA
"Ziel ist die paritätische Aufteilung der Elternzeit.","The aim is to share parental leave equally.","503",NA
"Vielfalt der Familienformen anerkennen und fördern","Recognize and promote diversity of family forms",NA,NA
"Familie ist für uns GRÜNE da, wo Kinder sind oder wo Menschen dauerhaft füreinander Verantwortung übernehmen.","For us Greens, family is where there are children or where people take on long-term responsibility for each other.","603",NA
"In unserer Gesellschaft gibt es eine Vielzahl unterschiedlicher Formen des Zusammenhalts und Miteinanderlebens auch ohne verwandtschaftliche Beziehungen.","In our society there are many different forms of cohesion and living together even without kinship relations.","604",NA
"Wir wollen diese Vielfalt der Familienformen anerkennen und angemessen fördern.","We want to recognize and appropriately support this diversity of family forms.","604",NA
"Jedes Kind muss die gleichen Rechte und die gleiche Absicherung haben.","Every child must have the same rights and coverage.","503",NA
"Benachteiligungen in der Familienförderung abbauen","Eliminate disadvantages in family support","503",NA
"Familien mit Kindern werden derzeit grundlegend anders besteuert, je nachdem ob die Eltern verheiratet, alleinerziehend sind oder in einer Eingetragenen Lebenspartnerschaft leben.","Families with children are currently taxed fundamentally differently depending on whether the parents are married, single parents or living in a registered civil partnership.","503",NA
"Diese Ungleichbehandlung wollen wir beseitigen.","We want to eliminate this unequal treatment.","503",NA
"Wir wollen eine steuer- und sozialpolitische Gleichbehandlung aller Lebensformen mit Kindern.","We want equal tax and social policy treatment for all ways of life with children.","503",NA
"Realitäten anerkennen","Recognize realities",NA,NA
"Das derzeitige Familien- und Kindschaftsrecht deckt weder die Vielfalt noch die Veränderlichkeit der vielfältigen Familienformen ab.","The current family and child law does not cover the diversity or variability of the many forms of families.","604",NA
"Patchworkfamilien, in denen Kinder mit mehr als zwei erwachsenen Bezugspersonen aufwachsen, oder gleichgeschlechtliche Regenbogenfamilien sind bislang weitgehend unberücksichtigt.","Patchwork families, in which children grow up with more than two adult caregivers, or same-sex rainbow families have so far been largely ignored.","604",NA
"Kinderwunsch anerkennen – Gleiche Rechte herstellen","Recognize desire to have children - Establish equal rights",NA,NA
"Viele Paare ohne Trauschein, Lebenspartnerinnen und Lebenspartner und Alleinstehende wünschen sich Kinder und ziehen dafür auch ärztlich assistierte Reproduktion in Betracht.","Many couples without a marriage certificate, life partners and single people wish to have children and also consider medically assisted reproduction for this purpose.","604",NA
"Bei der Übernahme der anfallenden Behandlungskosten sollen alle diese Zielgruppen gleichgestellt werden.","All of these target groups are to be treated equally when it comes to covering the costs of treatment incurred.","503",NA
"Durch die früheren Gesundheitsreformen ist eine soziale Schieflage entstanden, weil sich Geringverdienende die hohen Behandlungskosten nicht mehr leisten können.","Previous health care reforms have created a social imbalance because low-income earners can no longer afford the high cost of treatment.","503",NA
"Die Kosten für eine begrenzte Anzahl von Behandlungen sollen künftig wie andere familienbezogenen Leistungen steuerfinanziert übernommen werden.","In the future, the cost of a limited number of treatments would be covered by taxes, like other family-related benefits.","504",NA
"Darüber hinaus wollen wir das Adoptionsrecht endlich auch für gemeinschaftliche Adoptionen durch Eingetragene Lebenspartnerschaften und für auf Dauer angelegte nicht-eheliche Lebensgemeinschaften öffnen.","In addition, we want to finally open up adoption law to joint adoptions by registered civil partnerships and to permanent non-marital partnerships.","604",NA
"The kids are alright","The kids are alright",NA,NA
"Kinder und Jugendliche haben eigenständige Rechte.","Children and young people have independent rights.","706",NA
"Sie haben ein Recht auf gewaltfreie Erziehung, ein Recht auf Bildung und Betreuung und sie haben ein Recht darauf, zu spielen.","They have a right to an upbringing free of violence, a right to education and care, and they have a right to play.","706",NA
"Sie brauchen die liebevolle Zuwendung ihrer Eltern, haben aber gleichzeitig auch Anspruch auf Unterstützung und Förderung durch den Staat.","They need the loving care of their parents, but at the same time they are entitled to support and funding from the state.","706",NA
"Damit daran kein Zweifel besteht, wollen wir eigenständige Kinderrechte in den Grundrechtekatalog unserer Verfassung aufnehmen","To ensure that there is no doubt about this, we want to include independent children's rights in the basic rights catalog of our constitution","201",NA
"– als starken Auftrag an die Politik, Prioritäten zugunsten von Kindern zu setzen.","- as a strong mandate to politicians to set priorities in favor of children.","706",NA
"Wir wollen, dass Kinder wissen, dass sie Rechte haben.","We want children to know that they have rights.","706",NA
"Deshalb gehört das Thema Kinderrechte verstärkt in Schulbücher und in die Öffentlichkeitsarbeit der Bundesregierung.","That is why the topic of children's rights should be increasingly included in school textbooks and in the public relations work of the German government.","706",NA
"Junge Menschen sind wie niemand sonst auf Freiraum jenseits der eigenen Wohnung angewiesen.","Young people are more dependent on free space beyond their own homes than anyone else.","706",NA
"Aber junge Menschen sind im öffentlichen Raum unbeliebt: Sie machen Lärm, sie fallen auf.","But young people are unpopular in public spaces: they make noise, they attract attention.","706",NA
"Wir meinen: Kinderlärm ist Zukunftsmusik und junges Leben gehört in die Mitte der Gesellschaft, in die Mitte von Dorf und Stadt.","We think: Children's noise is music of the future and young life belongs in the middle of society, in the middle of village and city.","706",NA
"Wir wollen die Vielfalt der Jugendkulturen fördern, auch weil vielfältige kulturelle Angebote der beste Schutz gegen rechtsextreme Einfalt sind.","We want to promote the diversity of youth cultures, also because diverse cultural offerings are the best protection against right-wing extremist simplicity.","502",NA
"Und wir brauchen eine starke Jugendhilfe und engagierte Jugendverbände, die auch zukünftig vielfältige Angebote machen und benachteiligte Jugendliche gezielt unterstützen können.","And we need strong youth welfare and committed youth associations that can continue to offer a wide range of services and provide targeted support for disadvantaged young people.","503",NA
"Öffentliche und freie Träger der Jugendhilfe sind so auszustatten, dass sie ihre vielfältigen Aufgaben, insbesondere auch im Bereich des Kinderschutzes verantwortlich wahrnehmen können.","Public and independent youth welfare organizations must be equipped in such a way that they can responsibly perform their diverse tasks, especially in the area of child protection.","503",NA
"Jugendfreiwilligendienste sind wichtige Einstiegsmöglichkeiten in eine engagierte Biografie, geben Orientierung in einer wichtigen Lebensphase und vermitteln soziale, ökologische und kulturelle Fähigkeiten.","Youth Volunteer Services are important entry points into a committed biography, provide orientation in an important phase of life, and impart social, ecological, and cultural skills.","606",NA
"Deshalb wollen wir das Angebot an Jugendfreiwilligendienstplätzen mehr als verdoppeln und es qualitativ weiter verbessern.","That's why we want to more than double the number of youth volunteer positions and further improve their quality.","606",NA
"Für ein neues Miteinander","For a new togetherness",NA,NA
"Unsere Gesellschaft wandelt sich.","Our society is changing.","604",NA
"Wir werden weniger, älter und bunter.","We are becoming fewer, older and more colorful.","604",NA
"Die Gesellschaft schrumpft, der Anteil der Menschen mit Migrationshintergrund nimmt zu.","Society is shrinking, and the proportion of people with an immigrant background is increasing.","607",NA
"Manche zeichnen angesichts des demografischen Wandels das Schreckensbild eines »Kriegs der Generationen«.","In view of demographic change, some people paint the horror of a ""war of the generations.","606",NA
"Neiddebatten und Schuldzuweisungen an einzelne Generationen lehnen wir ab.","We reject debates about envy and blaming individual generations.","606",NA
"Stattdessen können Junge und Alte nur gemeinsam die kommenden Probleme lösen.","Instead, young and old can only solve the coming problems together.","606",NA
