"text","text_en","cmp_code","eu_code"
"Die Ärztinnen und Ärzte und ihre Mitarbeiterinnen und Mitarbeiter in Ostdeutschland brauchen ausreichende Honorare, um eine drohende Gefährdung der Versorgung abzuwenden.","Physicians and their staff in eastern Germany need sufficient fees to avert a threat to care.","704",NA
"Wir wollen Wettbewerb um medizinische Qualität fördern.","We want to promote competition for medical quality.","403",NA
"Wichtig ist dabei, dass die Leistungs- und Produktanbieter die Wirksamkeit und die Wirtschaftlichkeit ihrer Angebote nachweisen müssen.","Importantly, service and product providers must demonstrate the effectiveness and cost-effectiveness of their offerings.","303",NA
"Und es geht um mehr Transparenz bei der medizinischen Versorgung und die Stärkung der Rechte von Patientinnen und Patienten.","And it is about more transparency in medical care and strengthening patients' rights.","403",NA
"Die Krankenhäuser müssen bürgernahe Versorgung und.","Hospitals must provide citizen-oriented care and.","504",NA
"angemessene Arbeits- und Tarifbedingungen","appropriate working and wage conditions","701",NA
"sowie erforderliche Aus- und Weiterbildung gewährleisten können","as well as the necessary training and further education","411",NA
"Die skandalöse Ausbeutung vor allem der jungen Ärztinnen und Ärzte, aber auch von Pflegekräften muss beendet werden.","The scandalous exploitation of young doctors in particular, but also of nursing staff, must be brought to an end.","704",NA
"Unausgeschöpfte Potenziale in Prävention und Gesundheitsförderung sind wichtige Ansatzpunkte für die Reform.","Untapped potential in prevention and health promotion are important starting points for reform.","303",NA
"Insbesondere für Kinder, für Frauen, für chronisch Kranke, für Seniorinnen und Senioren sowie für sozial benachteiligte Menschen wollen wir Präventions- und Versorgungsangebote ausbauen.","We want to expand prevention and care services, especially for children, women, the chronically ill, senior citizens and socially disadvantaged people.","503",NA
"Dazu muss endlich auch die Leistungsfähigkeit des Öffentlichen Gesundheitsdienstes wieder gestärkt werden.","To this end, the performance of the public health service must finally be strengthened again.","303",NA
"Jede Regierung hat sich bisher gescheut, die Preistreiberei der pharmazeutisch-medizintechnischen Industrie zu begrenzen.","Every government so far has shied away from limiting the pharmaceutical-medical device industry's price gouging.","412",NA
"Wir treten für gesetzliche Regelungen ein, die den Einfluss der Pharmaindustrie auf das medizinische Leistungsgeschehen zurück drängen.","We advocate legal regulations that push back the influence of the pharmaceutical industry on medical services.","403",NA
"Veränderte gesellschaftliche Bedingungen erfordern ein grundlegend neues Verständnis und Herangehen in der Pflege.","Changing social conditions require a fundamentally new understanding and approach to nursing.","303",NA
"Eine menschenwürdige Pflege und assistierende Begleitung im Alter und in hilfebedürftigen Lebenssituationen sind erklärtes Ziel der Politik der PDS in Gegenwart und Zukunft.","Dignified care and assistance in old age and in life situations requiring help are the declared goal of the PDS policy in the present and in the future.","706",NA
"Dazu bedarf es einer soliden materiellen und finanziellen Grundlage.","This requires a solid material and financial basis.","504",NA
"Alte, pflege- und hilfsbedürftige Menschen haben ein Recht auf ein selbstbestimmtes Leben in Würde und mit menschlicher Wärme sowie mit persönlicher Zuwendung ohne Angst und Gewalt.","Elderly people in need of care and assistance have a right to a self-determined life in dignity and with human warmth as well as personal attention without fear and violence.","706",NA
"Einkommen für Arbeitslose sichern","Secure income for the unemployed",NA,NA
"Langzeitarbeitslosigkeit sowie die soziale und regionale Spaltung des Arbeitsmarktes haben sich auf hohem Niveau verfestigt.","Long-term unemployment and the social and regional division of the labor market have become entrenched at a high level.","701",NA
"Andere Parteien nehmen diese fatale Entwicklung zum Anlass, die Arbeitslosenhilfe in der Sozialhilfe auflösen zu wollen.","Other parties are taking this fatal development as an opportunity to dissolve unemployment assistance in the social welfare system.","504",NA
"Sie wollen eine Versicherungsleistung für qualifizierte Arbeitslose mit guten Arbeitsmarktchancen und eine kommunalisierte Sozialhilfe-Leistung für die, denen bestenfalls noch einfache Dienstleistungsjobs im Niedriglohnbereich offen stehen sollen.","They want an insurance benefit for qualified unemployed people with good labor market prospects and a municipalized social welfare benefit for those to whom, at best, simple service jobs in the low-wage sector should still be open.","503",NA
"Die PDS tritt dieser Spaltung entgegen.","The PDS opposes this division.","305",NA
"Wir wollen die solidarische Einheit der Arbeitslosenunterstützung für alle Arbeitslosen wieder herstellen","We want to restore the solidarity-based unity of unemployment benefits for all the unemployed","701",NA
"und Einkommen sichern, wenn es an Arbeitsplätzen fehlt.","and secure incomes when jobs are lacking.","504",NA
"Lohnersatz soll die Arbeitslosen und die Beschäftigten vor der ruinösen Konkurrenz der Arbeit um jeden Preis schützen.","Wage replacement is intended to protect the unemployed and the employed from the ruinous competition of labor at any price.","701",NA
"Wir wollen in der Arbeitslosenunterstützung eine steuerfinanzierte Grundsicherung einführen.","We want to introduce a tax-financed basic benefit for the unemployed.","504",NA
"Damit sollen die lohnbezogenen Leistungen aufgestockt werden, wenn sie unter dem soziokulturellen Existenzminimum liegen.","This is intended to top up wage-related benefits if they are below the socio-cultural subsistence level.","504",NA
"Für alle Arbeitslosen sollen einheitliche Rechts- und Fördervorschriften gelten.","Uniform legal and support regulations should apply to all unemployed persons.","701",NA
"Kein Arbeitsloser soll mehr wegen unzureichender oder fehlender Leistungen vom Arbeitsamt zum Sozialamt gehen müssen.","No unemployed person should have to go from the employment office to the social welfare office anymore because of insufficient or missing benefits.","504",NA
"Diese Grundsicherung für Arbeitslose entlastet zudem die kommunalen Haushalte von den unmittelbaren Kosten der Arbeitslosigkeit.","This basic benefit for the unemployed also relieves municipal budgets of the direct costs of unemployment.","504",NA
"Durch eine verbesserte, arbeitsmarktnähere Vermittlung, durch Qualifikation und Fördermaßnahmen muss eine schnelle und dauerhafte Rückkehr ins aktive Erwerbsarbeitsleben unterstützt werden.","A quick and lasting return to active working life must be supported through improved placement closer to the labor market, through qualification and support measures.","701",NA
"Förderung und Qualifikation sollen auf den zukünftigen Arbeitsmarktbedarf orientiert sein.","Promotion and qualification should be oriented towards future labor market needs.","701",NA
"Angesichts fortbestehender Massenarbeitslosigkeit bleiben für uns arbeitsbeschaffende Maßnahmen im Rahmen der Arbeitsförderung unverzichtbar.","In view of the persistence of mass unemployment, we believe that job-creation measures within the framework of employment promotion remain indispensable.","504",NA
"Allerdings wollen wir sie nicht zum Zweck der reinen Beschäftigung, sondern volkswirtschaftlich und sozialstaatlich sinnvoll für aktuelle und vor allem absehbare zukünftige Erfordernisse der öffentlichen Daseinsvorsorge.","However, we do not want them for the purpose of pure employment, but in a way that makes economic and social sense for current and, above all, foreseeable future public service requirements.","504",NA
"Es muss besonders etwas gegen die extrem hohe Arbeitslosigkeit unter Menschen mit Behinderungen getan werden.","Something especially needs to be done about the extremely high unemployment rate among people with disabilities.","705",NA
"Dies schließt eine deutliche Verschärfung der Beschäftigungspflicht schwer behinderter Menschen für Arbeitgeber bei einer drastischen Erhöhung der Ausgleichsabgabe mit ein.","This includes a significant tightening of the employment obligation for severely disabled people for employers with a drastic increase in the compensatory levy.","705",NA
"Die Arbeitslosenversicherung ist besser an den beschleunigten Wandel in der Arbeitswelt anzupassen.","Unemployment insurance must be better adapted to the accelerated changes in the world of work.","303",NA
"Wir wollen sie zu einer Arbeitsversicherung für alle Erwerbstätigen machen, die nicht nur Ansprüche auf Einkommen, sondern auch auf Qualifikation schafft.","We want to make it a labor insurance for all working people, creating entitlements not only to income but also to qualifications.","504",NA
"Zugleich soll sie stärker präventiv ausgerichtet sein, Qualifikationsansprüche bereits im Vorfeld von tatsächlicher Arbeitslosigkeit verwirklichen, Job-Rotation ermöglichen und so einen Rückhalt für flexible Übergangsstrategien zwischen verschiedenen Arbeitsverhältnissen, aber auch zwischen Erwerbsarbeit und Familienarbeit bilden.","At the same time, it should have a stronger preventive focus, realize qualification requirements in advance of actual unemployment, enable job rotation, and thus provide a backstop for flexible transition strategies between different employment relationships, but also between gainful employment and family work.","701",NA
"Befristete Ausstiege aus dem Erwerbsleben zum Zwecke privater Pflegearbeit müssen für Frauen und Männer abgesichert werden.","Temporary withdrawals from working life for the purpose of private care work must be safeguarded for women and men.","504",NA
"Gleichzeitig sollen für Frauen und Männer nach Pflegephasen alle Maßnahmen der aktiven Arbeitsförderung offen stehen.","At the same time, all measures of active labor promotion should be open to women and men after care phases.","504",NA
"Dem weiteren Abbau der solidarischen Alterssicherung entgegen treten","Countering the further dismantling of the solidarity-based pension system",NA,NA
"Die Rentenreform 2001 bricht mit den seit 1957 geschaffenen Traditionen der sozialstaatlichen lebensstandardsichernden Alterssicherung.","The 2001 pension reform breaks with the traditions of the welfare state that have been in place since 1957 to ensure a standard of living in old age.","504",NA
"Sie erhöht das Armutsrisiko im Alter vor allem für Niedrigverdienende, Teilzeitbeschäftigte, Arbeitslose und Versicherte mit Lücken in der Erwerbsbiografie.","It increases the risk of poverty in old age, especially for low-income earners, part-time workers, the unemployed, and insured persons with gaps in their employment histories.","504",NA
"Frauen sind davon in besonderer Weise betroffen.","Women are particularly affected by this.","706",NA
"Zusätzlich gilt für Frauen der Grundsatz „Gleiche Beiträge führen zu gleichen Leistungen'' in der privaten Vorsorge nicht, weil Frauen im Durchschnitt eine höhere Lebenserwartung als Männer haben.","In addition, the principle of ""equal contributions lead to equal benefits'' does not apply to women in private pension plans because women have a higher average life expectancy than men.","706",NA
"Frauen sind die Hauptverlierer des Gesamtpakets der Rentenreform.","Women are the main losers in the overall pension reform package.","706",NA
"In der Zwischenzeit sind durch den Abschluss tariflicher Regelungen und privater Vorsorgeverträge einerseits Fakten geschaffen worden, andererseits haben steigende Arbeitslosigkeit und sinkende beitragspflichtige Beschäftigung die Modellrechnungen zur langfristigen Beitragssatzstabilisierung zur Makulatur werden lassen.","In the meantime, facts have been created through the conclusion of collective agreements and private pension contracts, while rising unemployment and falling employment subject to contributions have made the model calculations for long-term contribution rate stabilization a waste of time.","305",NA
"Bei der zu erwartenden „Reform der Rentenreform“ drohen ein weiterer Abbau der Leistungen der gesetzlichen Rentenversicherung und eine Erhöhung der privaten Vorsorge.","The expected ""pension reform"" threatens to further reduce the benefits of the statutory pension insurance and increase private provision.","504",NA
"So ist vor allem eine Heraufsetzung des Renteneintrittsalters zu befürchten.","The main concern is that the retirement age will be raised.","504",NA
"Wir werden diesen Weg nicht mitgehen.","We will not go down this road.","305",NA
"Wir werden uns weiterhin für eine Verbesserung der Leistungen der gesetzlichen Rentenversicherung einsetzen, damit sie altersarmutsfest wird.","We will continue to work to improve the benefits of the statutory pension insurance system to make it age-proof.","504",NA
"Hierzu gehören die Einführung einer Rente nach Grundbetrag für langjährig Versicherte","These include the introduction of a pension based on a basic amount for those insured for many years","504",NA
"und der weitere Ausbau der eigenständigen Alterssicherung von Frauen.","and the further expansion of independent old-age provision for women.","504",NA
"Eine Erhöhung des Renteneintrittsalters lehnt die PDS entschieden ab.","The PDS firmly rejects an increase in the retirement age.","504",NA
"Die staatliche Förderung für private Vorsorge soll so umgestaltet werden, dass der Grundsatz „Gleiche Beiträge - gleiche Leistungen'' für Frauen wieder gilt.","The state subsidy for private pension provision is to be redesigned so that the principle of ""equal contributions - equal benefits"" once again applies to women.","503",NA
"Schließlich wollen wir, dass die betriebliche Altersvorsorge zur vorrangigen Sicherungsform neben der gesetzlichen Rente wird.","Finally, we want occupational pensions to become the primary form of security alongside the statutory pension.","701",NA
"Die Einrichtung von betrieblichen Altersvorsorgesystemen in Betriebs- und Branchenverbünden soll obligatorisch werden.","The establishment of occupational pension schemes in company and industry associations is to become mandatory.","701",NA
"Selbstbestimmtes Leben durch Wissen und Kultur,","Self-determined life through knowledge and culture,",NA,NA
"Bildung und Forschung","Education and research",NA,NA
"Bildung, Wissen und Kultur - das sind die Schlüsselressourcen im 21. Jahrhundert.","Education, knowledge and culture - these are the key resources in the 21st century.","506",NA
"Wissen und neue Erkenntnisse hervor zu bringen und für alle zu nutzen, den gleichen Zugang und die gleiche Teilhabe für alle zu ermöglichen, die Wissbegierde zu wecken und zu fördern – darum geht es.","Bringing out knowledge and new insights and using them for all, enabling equal access and participation for all, awakening and fostering the thirst for knowledge - that's what it's all about.","506",NA
"Gerade weil Erkenntnisse schnell veralten und moderne Technologien und Verfahren immer speziellere Kenntnisse voraussetzen, zählen zu den unverzichtbaren Grundlagen moderner Bildung das Verständnis von Zusammenhängen, die Fähigkeit zu lebenslangem Lernen, soziales und historisches Wissen über die eigene Gesellschaft und Kultur wie über fremde Kulturen.","Precisely because knowledge quickly becomes obsolete and modern technologies and processes require increasingly specialized knowledge, the indispensable foundations of modern education include an understanding of interrelationships, the ability to learn throughout life, and social and historical knowledge about one's own society and culture as well as about foreign cultures.","506",NA
"Die Möglichkeiten des Zugangs und der Aneignung von Bildung, Wissen und Kultur entscheiden über soziale Chancen, reale Freiheit und gesellschaftliche Teilhabe jeder und jedes Einzelnen und damit zugleich über die Zukunftsfähigkeit moderner Gesellschaften.","The opportunities for access to and appropriation of education, knowledge and culture determine the social opportunities, real freedom and social participation of each and every individual, and thus at the same time the future viability of modern societies.","506",NA
"Bildung, Wissen, kulturelle Angebote, Kunst und die Möglichkeiten kulturellen Selbstausdrucks als Grundbedingungen selbstbestimmten Lebens müssen uneingeschränkt allen offen stehen – unabhängig von ihrem Geschlecht, ihrem Alter, von ihrer sozialen und kulturellen Herkunft, von ihrem Einkommen, ihrer körperlichen Verfasstheit.","Education, knowledge, cultural offerings, art and the opportunities for cultural self-expression as basic conditions for a self-determined life must be open to everyone without restriction - regardless of their gender, age, social and cultural background, income or physical condition.","503",NA
"Damit alle Menschen die Möglichkeiten des Internets nutzen können, muss der digitale Graben, der Nutzerinnen und Nutzer von Nicht-Nutzern trennt, geschlossen bzw. überbrückt werden.","In order for everyone to be able to use the possibilities of the Internet, the digital divide that separates users from non-users must be closed or bridged.","411",NA
"Alle Menschen sollen über die Voraussetzungen für die Nutzung des Internets verfügen können.","All people should be able to have the prerequisites for using the Internet.","503",NA
"Bildung, Kultur, Wissen sind überwiegend Bestandteile gesellschaftlicher und staatlicher Daseinsvorsorge, die beständig auf höherem Niveau erhalten und erweitert werden muss.","Education, culture and knowledge are predominantly components of social and state services of general interest that must be constantly maintained and expanded at a higher level.","506",NA
"Darauf bestehen wir gerade auch bei den Massenmedien.","We insist on this, especially in the mass media.","502",NA
"Eine demokratische Gesellschaft benötigt öffentlich-rechtliche, demokratisch strukturierte Anbieter, die nicht dem Profitprinzip unterworfen sind.","A democratic society needs public, democratically structured providers that are not subject to the profit principle.","502",NA
"Bildung und Wissen sind in Deutschland ins Hintertreffen geraten.","Education and knowledge have fallen behind in Germany.","506",NA
"Im Vergleich mit 29 Volkswirtschaften der OECD liegt Deutschland mit seinem Anteil öffentlicher Ausgaben am Bruttoinlandsprodukt für Bildung nur an 23. Stelle.","Compared with 29 OECD economies, Germany's share of public spending on education as a percentage of gross domestic product ranks only 23rd.","506",NA
"Nur 8 Prozent der Menschen aus unteren Einkommensschichten nehmen heute ein Hochschulstudium auf, während es bei einkommensstarken Familien über 70 Prozent sind.","Only 8 percent of people from lower-income backgrounds now enroll in higher education, compared to more than 70 percent of high-income families.","506",NA
"Die in den siebziger Jahren unter sozialdemokratischer Regierungsverantwortung erreichten Fortschritte bei der sozialen Durchlässigkeit des Bildungssystems sind heute substanziell in Frage gestellt.","The progress achieved in the 1970s under Social Democratic government responsibility in terms of the social permeability of the education system is now being substantially called into question.","506",NA
"Die PISA-Studie hat gerade hier die Mängel des deutschen Bildungssystems aufgezeigt.","It is precisely here that the PISA study highlighted the shortcomings of the German education system.","506",NA
"Der Zustand der Kitas und Schulen offenbart die Wertschätzung der Kinder und Jugendlichen","The state of daycare centers and schools reveals the appreciation of children and young people",NA,NA
"Die PDS will die Finanzierung der Zukunftsaufgabe Bildung sichern.","The PDS wants to secure funding for the future task of education.","506",NA
"Wir wollen durch eine neue Prioritätensetzung in der Haushaltspolitik von Bund und Ländern und durch entsprechende finanz- und steuerpolitische Rahmenbedingungen auf Bundesebene erreichen, dass Deutschland in vier Jahren bei den Bildungsausgaben mindestens das OECD-Durchschnittsniveau erreicht hat.","By setting new priorities in the budgetary policies of the federal and state governments and by creating an appropriate financial and tax policy framework at the federal level, we want to ensure that Germany reaches at least the OECD average level of education spending within four years.","506",NA
"Wir wollen Chancengleichheit für alle.","We want equal opportunities for all.","503",NA
"Chancengleichheit beginnt beim Start.","Equal opportunities begin at the start.","503",NA
"Deshalb muss bereits für Kleinkinder ein institutionell gesichertes und öffentlich gefördertes Angebot an Betreuungsplätzen zur Verfügung stehen.","For this reason, an institutionally secured and publicly funded supply of childcare places must already be available for young children.","506",NA
"Nicht erst die Schule, schon Krippen und Kindergärten erfüllen einen Bildungsauftrag.","Not only schools, but also daycare centers and kindergartens fulfill an educational mission.","506",NA
"Bildung und Wissen dürfen nicht vom Geldbeutel abhängen.","Education and knowledge must not depend on one's wallet.","506",NA
"Bildungschancen sind Lebenschancen.","Educational opportunities are life opportunities.","506",NA
"Chancengleichheit und Entwicklungsmöglichkeiten für alle Kinder zu bewahren, bedeutet ebenfalls, der besonderen Bedeutung motorischer Anregungen gerecht zu werden.","Preserving equal opportunities and developmental possibilities for all children also means doing justice to the special importance of motor stimulation.","502",NA
"Sport im Sinne von Bewegungserziehung sollte schon im Vorschulalter einsetzen und im Schulsport systematisch weiter geführt werden.","Sport in the sense of physical education should begin at preschool age and be systematically continued in school sports.","506",NA
"Das ist eine Grundvoraussetzung für Gesundheit und für ganzheitliche Entwicklung angesichts der Prognose weiter zunehmender Bewegungsarmut in der Lern- und späteren Berufstätigkeit.","This is a basic prerequisite for health and for holistic development in view of the prognosis of further increasing lack of movement in learning and later professional activity.","506",NA
"Begabungen und Begabte sollen besser unterstützt werden.","Gifted and talented people should be better supported.","506",NA
"Chancengleichheit herstellen heißt für uns auch, Kinder mit Lernschwierigkeiten oder mit Behinderungen besonders zu fördern.","For us, creating equal opportunities also means providing special support for children with learning difficulties or disabilities.","506",NA
"Wir wollen verhindern, dass der demografisch bedingte Rückgang der Schülerzahlen ab 2005 als Vorwand für weitere Einsparungen im Bildungsbereich benutzt wird.","We want to prevent the demographically induced decline in student numbers from 2005 onwards from being used as an excuse for further cuts in education.","506",NA
"Die PDS macht sich für eine bildungspolitische Offensive stark.","The PDS is pushing for an education policy offensive.","506",NA
"Die Schulklassen müssen kleiner, der Unterrichtsausfall geringer, Bildungsinhalte und Lehr- und Lernformen zeitgemäß erneuert werden.","School classes must be smaller, absenteeism must be reduced and educational content and forms of teaching and learning must be modernized.","506",NA
"Soziales Lernen ist zu fördern.","Social learning is to be encouraged.","506",NA
"Im Grundschulbereich bedarf es besonderer Anstrengungen – auch zur Integration und zur Sprachförderung –, um einer Ausgrenzung ausländischer Kinder entgegen zu wirken.","Special efforts are needed at the elementary school level - including integration and language support - to counteract the exclusion of foreign children.","506",NA
"Wir wollen die Voraussetzungen für mehr Ganztagsschulen mit Betreuungseinrichtungen schaffen.","We want to create the conditions for more all-day schools with childcare facilities.","506",NA
"Die Schulorganisation und die Schulzeiten sind in Richtung zur integrierten Gesamtschule zu überprüfen und zu reformieren.","School organization and school schedules must be reviewed and reformed in the direction of an integrated comprehensive school.","506",NA
"Zu einem demokratischen Bildungswesen zählen effektive Mitsprachemöglichkeiten von Schülerinnen und Schülern, Studierenden, Eltern, Lehrerinnen und Lehrern über die notwendige Reform von Ausbildungsinhalten, Schulorganisation und Schulzeiten.","A democratic education system includes effective opportunities for students, parents and teachers to have their say on the necessary reform of educational content, school organization and school hours.","506",NA
"In der Aus- und Weiterbildung der Lehrerinnen und Lehrer müssen die pädagogischen, didaktischen und methodischen Elemente gestärkt und besser mit der fachwissenschaftlichen Qualifizierung verbunden werden.","In teacher training and continuing education, the pedagogical, didactic and methodological elements must be strengthened and better linked to subject-specific qualifications.","506",NA
