"text","text_en","cmp_code","eu_code"
"Es geht auch anders: Nur Gerechtigkeit sichert Zukunft! Die Zeit drängt. Deutschland braucht Veränderung","There is another way: Only justice secures the future! Time is pressing. Germany needs change",NA,NA
"Deutschland hat eine Regierung, die mit großen Hoffnungen gewählt wurde – wegen Schröders Versprechen und Lafontaines Programm.","Germany has a government that was elected with high hopes - because of Schröder's promises and Lafontaine's program.","305",NA
"Doch den Politikwechsel ist sie schuldig geblieben.","But it has failed to bring about a change in policy.","305",NA
"Die Bundesregierung hat den großen Konzernen und Banken viel, den meisten Menschen in Deutschland wenig gebracht.","The federal government has brought a lot to the big corporations and banks, but little to most people in Germany.","503",NA
"Sie hat Krieg wieder zum Mittel deutscher Politik gemacht,","It has once again made war a tool of German policy,","105",NA
"und sie hat ihre Arbeitsplatzversprechen nicht gehalten.","and it has failed to deliver on its job promises.","701",NA
"Wir sehen nicht nur die Krisen dieses Landes und das Versagen der herrschenden Politik.","We see not only the crises of this country and the failure of the ruling policy.","305",NA
"Wir schätzen den geistigen, kulturellen und ethischen Reichtum der Menschen, die in Deutschland leben.","We value the intellectual, cultural and ethical richness of the people who live in Germany.","601",NA
"Wir wissen um die wirtschaftliche, finanzielle und politische Macht und die großen Möglichkeiten der Bundesrepublik Deutschland.","We are aware of the economic, financial and political power and the great opportunities of the Federal Republic of Germany.","601",NA
"Um so empörender ist die Bilanz mit Millionen Arbeitslosen,","The result is all the more outrageous, with millions of unemployed,","701",NA
"zunehmender sozialer Spaltung und Ausgrenzung","increasing social division and exclusion,","503",NA
"und einer Politik, die demokratische Standards abbaut,","and a policy that dismantles democratic standards","202",NA
"Bildung und Zukunftschancen junger Menschen kaputt spart,",", cuts education and future opportunities for young people,","506",NA
"Frauen gesellschaftlich benachteiligt und sie millionenfach in schlecht bezahlte Teilzeitarbeit und sozial ungesicherte Arbeitsverhältnisse abdrängt.","socially discriminates against women, and pushes millions of them into poorly paid part-time work and socially insecure jobs.","706",NA
"Gesellschaftliche Solidarität ist unter den Regierungen von Kohl und Schröder zum Auslaufmodell geworden.","Social solidarity has become a discontinued model under the governments of Kohl and Schröder.","503",NA
"Privatisierung der sozialen Sicherheit und eine skandalöse Umverteilung des gesellschaftlichen Reichtums von unten nach oben sind die bedrohlichen Ergebnisse dieser Politik.","Privatization of social security and a scandalous redistribution of social wealth from the bottom to the top are the ominous results of this policy.","504",NA
"Dem Osten, schon um viele Chancen von 1989 betrogen, droht ein unumkehrbarer Abstieg – die Jugend geht weg.","The East, already cheated of many opportunities from 1989, is threatened with irreversible decline - the youth is leaving.","503",NA
"In immer kürzeren Abständen ist Krieg das Instrument der Regierenden in der NATO, um ihre Vorherrschaft in dieser gefährdeten und konfliktreichen Welt durchzusetzen.","At ever shorter intervals, war is the instrument of NATO's rulers to assert their dominance in this vulnerable and conflict-ridden world.","105",NA
"Statt die Wurzeln des internationalen Terrorismus – Ausbeutung und Unterdrückung, Perspektivlosigkeit und kulturelle Zerstörung – zu beseitigen, werden mit Angriffskriegen und Völkerrechtsbruch weitere Ursachen für ihn gefördert.","Instead of eliminating the roots of international terrorism - exploitation and oppression, lack of prospects and cultural destruction - further causes for it are promoted with wars of aggression and violation of international law.","105",NA
"Die Alternative der CDU/CSU zu dieser Politik heißt Stoiber, nicht Gerechtigkeit, Frieden, Arbeit.","The CDU/CSU's alternative to this policy is Stoiber, not Justice, Peace, Work.","305",NA
"SPD und Grüne einerseits, CDU/CSU andererseits streiten um die Regierungsmacht und um Nuancen der gleichen Politik.","The SPD and the Greens on the one hand, and the CDU/CSU on the other, are fighting over government power and over nuances of the same policies.","305",NA
"Doch am Beginn des neuen Jahrhunderts sind die Gegenkräfte auch in Deutschland erkennbar.","But at the beginning of the new century, the opposing forces are also evident in Germany.","305",NA
"Globalisierungskritische Bewegungen haben neue Fragen auf die Tagesordnung dieser Gesellschaft gesetzt und Einfluss gewonnen.","Movements critical of globalization have put new questions on the agenda of this society and gained influence.","305",NA
"Die intellektuelle Debatte in der Bundesrepublik hat an gesellschaftskritischer Dimension gewonnen.","The intellectual debate in the Federal Republic has gained a socio-critical dimension.","305",NA
"In Teilen der Gewerkschaften und der Kirchen, in Frauen-, Jugend-, Friedens- und Antirassismusinitiativen wird dem herrschenden Neoliberalismus hörbar widersprochen.","In parts of the trade unions and the churches, in women's, youth, peace and anti-racism initiatives, there is audible opposition to the prevailing neoliberalism.","305",NA
"Und Deutschland hat eine Partei, die in Bundestag und Öffentlichkeit gegen Krieg, gesellschaftliche Erstarrung und soziale Ungerechtigkeit opponiert.","And Germany has a party that opposes war, social rigidity and social injustice in the Bundestag and in public.","305",NA
"Die Partei des Demokratischen Sozialismus will realistische Politik.","The Party of Democratic Socialism wants realistic politics.","305",NA
"Sie scheut nicht den kleinen Schritt und nicht den historischen Kompromiss.","It does not shy away from the small step or the historic compromise.","305",NA
"Sie hält fest an ihrem Ziel, wirkungsvoll zu einem Mitte-Links-Bündnis in Deutschland beizutragen.","It is sticking to its goal of contributing effectively to a center-left alliance in Germany.","305",NA
"Aber es gibt keine Ziele, wegen derer sie „Ja“ sagen würde zu einer Beteiligung an Kriegspolitik.","But there are no goals because of which it would say ""yes"" to involvement in war policy.","105",NA
"Es gibt keine Koalition, wegen der sie „Ja“ sagen würde zur Fortsetzung einer Politik der sozialen Kälte.","There is no coalition because of which it would say ""yes"" to the continuation of a policy of social coldness.","503",NA
"Es gibt kein Argument, wegen dessen sie bereit wäre, sich mit dem Abbruch demokratischer und freiheitlicher Rechte abzufinden.","There is no argument on the basis of which it would be willing to acquiesce in the abrogation of democratic and libertarian rights.","202",NA
"Die PDS will eine neue Politik.","The PDS wants a new policy.","305",NA
"Gemeinsam mit Betroffenen, mit Gewerkschaften, Verbänden, Vereinen, Initiativen.","Together with those affected, with trade unions, associations, clubs, initiatives.","606",NA
"Sie streitet für eine reiche Zukunft für Kinder und Jugendliche","It fights for a rich future for children and young people and does","706",NA
"und findet sich nicht ab mit der gesellschaftlichen Spaltung zu Lasten der Frauen.","not accept the social division to the detriment of women.","706",NA
"Die PDS hat viel geleistet, um Voraussetzungen für eine politische und gesellschaftliche Alternative zu schaffen.","The PDS has done much to create conditions for a political and social alternative.","305",NA
"Auf Seiten der Sozialdemokratie bestehen diese Bedingungen jedoch ganz offenkundig noch nicht.","On the part of social democracy, however, these conditions clearly do not yet exist.","305",NA
"Deshalb kann es für die PDS gegenwärtig keine andere Entscheidung geben: Sie geht als oppositionelle Partei gegenüber der jetzigen Regierungspolitik und deren allzu ähnlichen konservativen Alternativen in den Bundestagswahlkampf 2002 und in die neue Legislaturperiode.","Therefore, there can be no other decision for the PDS at present: It enters the 2002 Bundestag election campaign and the new legislative period as an opposition party to the current government policy and its all-too-similar conservative alternatives.","305",NA
"Das sollen die Wählerinnen und Wähler wissen.","That's what we want voters to know.","000",NA
"Darauf können sie sich verlassen.","They can count on that.","305",NA
"Deutschland braucht diese PDS, die gegen die Vorherrschaft des Großkapitals in Staat und Gesellschaft ankämpft,","Germany needs this PDS, which fights against the domination of big business in state and society,","503",NA
"die Engagement der Menschen will","wants the engagement of the people","606",NA
"und die natürlichen Lebensgrundlagen verteidigt.","and defends the natural foundations of life.","501",NA
"Ihr gesellschaftliches Ziel ist demokratischer Sozialismus – eine Gesellschaft, in der die freie Entwicklung der Einzelnen zur Bedingung der freien Entwicklung aller wird.","Its social goal is democratic socialism - a society in which the free development of individuals becomes the condition for the free development of all.","201",NA
"Es lohnt sich, mehr PDS in den Bundestag zu wählen: als Partei der sozialen Gerechtigkeit,","It is worth voting more PDS into the Bundestag: as a party of social justice,","503",NA
"§ als Friedens- und Antikriegspartei,","§ as a peace and anti-war party,","105",NA
"§ als Partei, die Ostdeutschland als Zukunftschance begreift.","§ as a party that sees East Germany as a chance for the future.","606",NA
"Deutschland braucht mehr PDS – dringender denn je!","Germany needs more PDS - more urgently than ever!",NA,NA
"Neue Arbeitsplätze – Basis für soziale Gerechtigkeit und Zukunftsfähigkeit","New jobs - the basis for social justice and sustainability",NA,NA
"Erwerbsarbeit ist in unserer Gesellschaft die ökonomische Grundlage für ein selbstbestimmtes Leben.","In our society, gainful employment is the economic basis for a self-determined life.","701",NA
"Bezahlte Arbeit ist das entscheidende Mittel für gesellschaftlichen Zusammenhalt.","Paid work is the decisive means for social cohesion.","606",NA
"Moderne, sozial gerechte Politik muss daher mehr sein als Anpassung an neue Bedingungen und Unterstützung der Wirtschaft.","Modern, socially just policies must therefore be more than adaptation to new conditions and support for the economy.","503",NA
"Sie muss bewusst Gestaltung sozialer Verhältnisse sein.","It must be a conscious shaping of social conditions.","503",NA
"Angesichts der Herausforderungen der demografischen Entwicklung der Gesellschaft gilt es, das solidarische Miteinander der Generationen, Ausgleich und Gerechtigkeit innerhalb und zwischen ihnen zu fördern.","In view of the challenges posed by the demographic development of society, it is important to promote solidarity between the generations, balance and justice within and between them.","606",NA
"Ohne Überwindung der Massenarbeitslosigkeit, ohne eine Politik mit dem Ziel neuer Vollbeschäftigung wird es nicht gelingen, den Sozialstaat wirksam zu erneuern und zu einer nachhaltigen, sozialökologischen Entwicklung der Gesellschaft überzugehen.","Without overcoming mass unemployment, without a policy aiming at new full employment, it will not be possible to effectively renew the welfare state and move to a sustainable, socio-ecological development of society.","701",NA
"Die Einkommens- und Lebensinteressen der Menschen müssen gegenüber den Profitinteressen, zumal denen der Banken und transnationalen Großkonzerne, durchgesetzt werden.","The income and living interests of the people must be asserted against the profit interests, especially those of the banks and large transnational corporations.","503",NA
"Längerfristige volkswirtschaftliche Erfordernisse und gesellschaftliche Zusammenhänge müssen gegen die soziale Blindheit und das Kurzzeitdenken der Märkte, insbesondere der Finanzmärkte, zur Geltung gebracht werden.","Longer-term economic requirements and social interrelationships must be brought to bear against the social blindness and short-term thinking of the markets, especially the financial markets.","503",NA
"Die PDS verteidigt die Tarifautonomie gegen diejenigen, die sie aushöhlen und letztlich beseitigen wollen.","The PDS defends collective bargaining autonomy against those who want to undermine and ultimately eliminate it.","405",NA
"Die Überwindung der Massenarbeitslosigkeit kann nicht dem Markt überlassen werden.","Overcoming mass unemployment cannot be left to the market.","701",NA
"Die Bundesregierung hat die Schaffung zukunftsfähiger Arbeitsplätze nicht in den Mittelpunkt ihrer Bemühungen gestellt.","The federal government has not made the creation of sustainable jobs the focus of its efforts.","701",NA
"Sie hat es versäumt, frühzeitig auf die sich abzeichnende weltweite Konjunkturkrise zu reagieren.","It failed to respond early to the looming global economic crisis.","305",NA
"Sie hat dogmatisch an der Politik der Haushaltskonsolidierung festgehalten.","It has dogmatically adhered to the policy of fiscal consolidation.","305",NA
"Deutschland steht in der Beschäftigungspolitik, bei der sozialen Daseinsvorsorge und den öffentlichen Zukunftsinvestitionen schlechter da als viele seiner europäischen Nachbarn.","Germany is worse off than many of its European neighbors in terms of employment policy, social services and public investment in the future.","305",NA
"Beschäftigungsorientierte Politik muss sich in der kommenden Legislaturperiode von zwei Irrtümern verabschieden: Die Behauptung, dass niedrigere Löhne zu mehr Beschäftigung führen, wird durch die Arbeitsmarktlage besonders in Ostdeutschland widerlegt.","Employment-oriented policies must abandon two misconceptions in the coming legislative period: The claim that lower wages lead to more employment is refuted by the labor market situation, especially in eastern Germany.","701",NA
"Die Behauptung, dass die Steuerreform neue Arbeitsplätze bringe, erwies sich als falsch, weil die Entlastungen für die Masseneinkommen durch den Anstieg der Preise und indirekten Steuern aufgezehrt wurden;","The claim that tax reform would bring new jobs turned out to be false, because the relief for mass incomes was eaten up by the rise in prices and indirect taxes;","305",NA
"zudem führten die Steuergeschenke an Banken, Großunternehmen und Spitzenverdiener ebenfalls nicht zu beschäftigungswirksamer Nachfrage, sondern förderten Unternehmensübernahmen, Fusionen und spekulative Finanzanlagen.","moreover, the tax giveaways to banks, large corporations and top earners also did not lead to job-creating demand, but encouraged corporate takeovers, mergers and speculative financial investments.","503",NA
"Im Ergebnis vermehrte sich privater Reichtum in den Händen weniger, zugleich schrumpften die Einnahmen in den öffentlichen Kassen.","As a result, private wealth increased in the hands of a few, while at the same time revenues in the public coffers shrank.","503",NA
"Die öffentlichen Investitionen sanken auf ein europäisches Rekordtief, die Handlungs- und Steuerungsfähigkeit von Politik schwand","Public investment fell to a European record low, the ability of policymakers to act and steer dwindled","409",NA
"Wirtschaftspolitische Instrumente beschäftigungspolitisch nutzen","Using economic policy instruments for employment policy",NA,NA
"Die Wirtschafts- und Strukturförderung soll strikt an Beschäftigungsziele gekoppelt werden.","Economic and structural support is to be strictly linked to employment targets.","701",NA
"Bei Nichteinhaltung dieser Ziele müssen die Fördermittel auch tatsächlich zurückgefordert werden.","In the event of non-compliance with these objectives, the subsidies must actually be reclaimed.","402",NA
"Öffentliche Wirtschafts- und Strukturförderung soll auf die Stärkung regionaler wirtschaftlicher Zusammenhänge konzentriert werden und die Position kleiner und mittlerer Unternehmen stärken.","Public economic and structural support should be focused on strengthening regional economic links and strengthening the position of small and medium-sized enterprises.","402",NA
"Die Forderung nach einem Sofortprogramm für kommunale Investitionen sollte umgehend umgesetzt werden.","The demand for an immediate program for municipal investments should be implemented immediately.","409",NA
"Öffentliche Aufträge sollen viel mehr als bisher in Fach- und kleineren Teil-Losen ausgeschrieben werden, statt Generalunternehmer zu beauftragen.","Public contracts are to be put out to tender in specialist and smaller sub-lots much more than in the past, instead of using general contractors.","403",NA
"Existenzgründerinnen und Existenzgründer brauchen gezielte Absatz- und Managementhilfen über mehrere Jahre.","Start-ups need targeted sales and management support over several years.","402",NA
"Der abnehmenden Finanzierungsbereitschaft der Banken kann durch neue, stille Beteiligungsformen der öffentlichen Hand begegnet werden.","The decreasing willingness of banks to provide financing can be countered by new, dormant forms of public-sector participation.","413",NA
"Die Gründung und kontinuierliche Förderung von Genossenschaften soll erleichtert werden.","To facilitate the establishment and continued promotion of cooperatives.","402",NA
"Die positiven Erfahrungen der Genossenschaften und ihrer Netzwerke in vielen europäischen Länder können auch in Deutschland Anwendungen finden.","The positive experiences of cooperatives and their networks in many European countries can also find applications in Germany.","415",NA
"Die Wirtschafts- und Währungsunion muss durch eine Beschäftigungs-, Sozial- und Umweltunion ergänzt werden.","Economic and monetary union must be complemented by employment, social and environmental union.","108",NA
"Umwelt- und Sozialstandards dürfen nicht dem Diktat internationaler Handelsorganisationen wie der WTO überlassen werden.","Environmental and social standards must not be left to the dictates of international trade organizations such as the WTO.","416",NA
"Die Aufgaben der Europäischen Zentralbank sollten über die Preisstabilität hinaus auf ihre Verantwortung bezüglich Wirtschaftswachstum und Beschäftigung erweitert werden.","The tasks of the European Central Bank should be extended beyond price stability to its responsibilities regarding economic growth and employment.","108",NA
"Europa braucht eine neue Beschäftigungsstrategie mit überprüfbaren Konvergenzkriterien, die soziale Kriterien einschließen, und quantitativen Zielen.","Europe needs a new employment strategy with verifiable convergence criteria, including social criteria, and quantitative targets.","108",NA
"Die EU-Fonds sollen zugunsten beschäftigungsfördernder Maßnahmen umgeschichtet und die Strukturpolitik unter diesem Gesichtspunkt geöffnet werden.","EU funds are to be redirected in favor of employment-promoting measures and structural policy is to be opened up with this in mind.","110",NA
"Wir wollen in der EU ein öffentliches Investitionsprogramm, das den ökologischen Umbau der Verkehrssysteme und der Energieversorgung sowie die Schaffung transeuropäischer Informationsnetze unterstützt.","We want a public investment program in the EU that supports the ecological restructuring of transport systems and energy supply and the creation of trans-European information networks.","108",NA
"Einer Renationalisierung der Agrar- und Strukturpolitik wird die PDS gerade vor dem Hintergrund der EU-Erweiterung nicht zustimmen.","The PDS will not agree to a renationalization of agricultural and structural policy, especially against the background of EU enlargement.","108",NA
"Die Arbeitslosenzahl deutlich senken!","Significantly reduce the unemployment rate!",NA,NA
"Die Stärkung der Binnennachfrage durch öffentliche Zukunftsinvestitionen","Strengthening domestic demand through public investment in the future","409",NA
"und Erhöhung der Massenkaufkraft durch eine aktive Lohn- und sozial gerechte Steuerpolitik können die Nachfrage nach Gütern und Dienstleistungen erhöhen und neue existenzsichernde Arbeitsplätze schaffen.","and increasing mass purchasing power through active wage and socially just tax policies can increase demand for goods and services and create new living wage jobs.","701",NA
"Die Verringerung der regelmäßigen Arbeitszeit bei vollem Lohn- und Gehaltsausgleich bleibt ein Hauptinstrument zur Sicherung der Beschäftigung.","Reducing regular working hours with full wage and salary compensation remains a key instrument for securing employment.","701",NA
"Das Gleiche gilt für die Verwandlung der 1,9 Milliarden Überstunden in neue Ar­beitsplätze.","The same goes for turning the 1.9 billion hours of overtime into new jobs.","701",NA
"Wir wollen deshalb den Überstundenabbau mit einer Initiative zur Begrenzung der gesetzlichen Höchstarbeitszeit auf 40 Stunden voranbringen und das Nebeneinander von Überstunden und Unterbeschäftigung eindämmen.","We therefore want to advance the reduction of overtime with an initiative to limit the statutory maximum working time to 40 hours and curb the coexistence of overtime and underemployment.","701",NA
"Wir werden Initiativen zur weiteren Flexibilisierung der Arbeitszeit unterstützen, wenn sie die Zeitsouveränität der Beschäftig­ten erhöhen, und sie immer ablehnen, wenn lediglich die Arbeitskosten gesenkt werden sol­len.","We will support initiatives to further flexibilize working hours if they increase employees' time sovereignty, and always reject them if they are intended merely to reduce labor costs.","701",NA
"Wir wenden uns dagegen, dass ältere Arbeitnehmerinnen und Arbeitnehmer chancenlos aus der Arbeitswelt verdrängt werden.","We are opposed to older workers being forced out of the workforce without opportunity.","701",NA
"In unserer Gesellschaft wächst der Bedarf an sozialen, kulturellen und ökologischen Dienstleistungen.","In our society, the need for social, cultural and ecological services is growing.","408",NA
"Dieser Bedarf wird marktwirtschaftlich nicht gedeckt, weil die Arbeit nicht profitbringend organisiert werden kann.","This need is not met by the market economy because the work cannot be organized for profit.","415",NA
"Erforderliche Leistungen werden oftmals schlecht, inhuman oder einkommensabhängig und damit Einkommensschwache ausgrenzend erbracht, wenn sie marktwirtschaftlich angeboten werden.","Necessary services are often provided poorly, inhumanely, or based on income, and thus exclude low-income people, when they are provided in a market economy.","503",NA
"Wir fordern daher, dass ein öffentlich geförderter Beschäftigungssektor ausgebaut wird, in dem gesellschaftlich sinnvolle Arbeiten mit öffentlicher Finanzierung vorwiegend von gemeinnützigen oder genossenschaftlichen Trägern geleistet werden.","We therefore call for the expansion of a publicly funded employment sector in which socially useful work is performed with public funding, primarily by non-profit or cooperative providers.","409",NA
"Solche Ausgaben für die öffentliche Daseinsvorsorge rechnen sich volkswirtschaftlich auch unter dem Gesichtspunkt, Arbeit statt Arbeitslosigkeit zu finanzieren.","Such expenditures for public services also pay off economically from the point of view of financing work instead of unemployment.","409",NA
"Um vorhandene Haushaltsmittel und öffentliche Fördermittel hierfür zusammenzubinden, schlagen wir die Einrichtung eines „Fonds für regionale Gemeinschaftsaufgaben'' vor.","In order to combine existing budgetary resources and public funding for this purpose, we propose the establishment of a ""Fund for Regional Community Tasks''.","409",NA
"In diesen Fonds kann auch ein Teil der bisherigen ABM- und SAM-Fördermittel überführt werden.","Some of the previous ABM and SAM funding can also be transferred to this fund.","409",NA
"Gesellschaftlich sinnvolle, zumal personennahe Dienstleistungen müssen angemessen bezahlt werden.","Socially useful services, especially those that are close to people, must be paid for appropriately.","701",NA
"Statt pauschal niedrige Löhne zu subventionieren, treten wir dafür ein, gezielt soziale Dienste, die wie z.B. Pflege- und Betreuungsdienstleistungen in der Zukunft mehr gebraucht werden, öffentlich zu subventionieren.","Instead of subsidizing low wages across the board, we advocate targeted public subsidies for social services that will be needed more in the future, such as nursing and care services.","409",NA
"Angemessene Altenpflege lässt sich nicht über Lohndumping und den Einsatz gering Qualifizierter erreichen.","Adequate care for the elderly cannot be achieved through wage dumping and the use of low-skilled workers.","701",NA
"Demokratie und Menschenrechte müssen auch am Arbeitsplatz gelten","Democracy and human rights must also apply in the workplace",NA,NA
"Lohnarbeit und andere abhängige Beschäftigung sind das Schicksal von rund 90 Prozent aller erwerbstätigen Menschen in unserem Land.","Wage labor and other dependent employment are the fate of about 90 percent of all employed people in our country.","701",NA
