"text","text_en","cmp_code","eu_code"
"Wir treten weiter für die Abschaffung von diskriminierenden Sondergesetzen, wie es das Asylbewerberleistungsgesetz oder die Residenzpflicht sind, ein.","We continue to advocate for the abolition of discriminatory special laws, such as the Asylum Seekers' Benefits Act or the Residence Obligation.","705",NA
"Hunderttausende von Menschen leben illegalisiert hier.","Hundreds of thousands of people live here illegally.","705",NA
"Sie sind oft Opfer skrupelloser Ausbeutung.","They are often victims of unscrupulous exploitation.","705",NA
"Für sie müssen wir Perspektiven eines legalen Aufenthalts schaffen.","We must create prospects of legal residence for them.","705",NA
"Die PDS tritt für eine EU-weite Harmonisierung der Asyl- und Migrationspolitik auf der Basis menschenrechtlicher Standards ein.","The PDS advocates an EU-wide harmonization of asylum and migration policy on the basis of human rights standards.","201",NA
"Die Bundesregierung muss ihre Blockadehaltung im Ministerrat bei einer Festschreibung menschenrechtlicher Mindeststandards in der EU-Flüchtlingspolitik aufgeben.","The German government must abandon its blocking position in the Council of Ministers regarding the establishment of minimum human rights standards in EU refugee policy.","201",NA
"Eine neue Asyl- und Migrationspolitik muss Abschied nehmen von der gescheiterten rigorosen Abschottungspolitik, die nicht nur an den Außengrenzen der EU das Leben von Flüchtlingen in Gefahr bringt, sondern auch in den Mitgliedstaaten zum Entstehen von „Schattengesellschaften'' von Illegalisierten beiträgt.","A new asylum and migration policy must say goodbye to the failed rigorous policy of closure, which not only puts the lives of refugees at risk at the external borders of the EU, but also contributes to the emergence of ""shadow societies"" of illegalized persons in the member states.","201",NA
"Ihnen müssen Perspektiven für eine Legalisierung gegeben werden.","They must be given prospects for legalization.","705",NA
"Konzepte zur Abwehr von Flüchtlingen, wie die des „Sicheren Drittstaats'' und des „Sicheren Herkunftslandes'', die die Genfer Flüchtlingskonvention untergraben, sollten nicht in eine gemeinsame EU-Asylpolitik eingehen.","Concepts of refugee defense, such as ""safe third country"" and ""safe country of origin,"" which undermine the Geneva Refugee Convention, should not be included in a common EU asylum policy.","201",NA
"Die EU soll mit ihrer menschenrechtlich orientierten Flüchtlingspolitik international Vorbild für andere Staaten und Staatenverbünde werden und den Schutz für Menschen in Not ausbauen.","With its human rights-oriented refugee policy, the EU should become an international role model for other states and alliances of states and expand protection for people in need.","201",NA
"Die PDS fordert die volle Umsetzung der UN-Kinderrechtskonvention","The PDS demands the full implementation of the UN Convention on the Rights of the Child","201",NA
"und die Anpassung des Ausländer- und Asylrechts im Hinblick auf den Schutz und die Rechte von Flüchtlingskindern unter 18 Jahren.","and the adaptation of the law on aliens and asylum with regard to the protection and rights of refugee children under the age of 18.","201",NA
"Die Bundesrepublik Deutschland ist ein Einwanderungsland","The Federal Republic of Germany is a country of immigration",NA,NA
"Die PDS tritt für klare und transparente Regelungen ein, die Vorgaben aus Verfassungs- und Völkerrecht umsetzen und eindeutige Rechtsansprüche schaffen.","The PDS advocates clear and transparent regulations that implement requirements from constitutional and international law and create clear legal entitlements.","201",NA
"Zu uns kommen immer Menschen, nie nur „Arbeitskräfte''.","People always come to us, never just ""workers"".","201",NA
"Sie brauchen eine rechtliche Gleichstellung im Rahmen eines demokratischen Einwanderungs- und Niederlassungsrechts.","They need legal equality within the framework of a democratic immigration and settlement law.","201",NA
"Die durch Arbeitsmigration seit langem in Deutschland lebenden ethnischen Gruppen haben das Recht auf Schutz und Förderung der Pflege ihrer Sprache, Kultur und Traditionen.","The ethnic groups that have been living in Germany for a long time due to labor migration have the right to protection and promotion of the cultivation of their language, culture and traditions.","607",NA
"Rechtliche Regelungen sollen auch verhindern, dass Migrantinnen und Migranten für Lohn- und Sozialdumping missbraucht werden.","Legal regulations should also prevent migrants from being abused for wage and social dumping.","705",NA
"Ein Antidiskriminierungsgesetz muss gegen den alltäglichen Rassismus, gegen Ausgrenzung schützen.","An anti-discrimination law must protect against everyday racism, against exclusion.","503",NA
"Wir brauchen eine aktive Integrationspolitik für die, die einwandern, und für jene, die schon lange oder immer hier leben.","We need an active integration policy for those who immigrate and for those who have lived here for a long time or always.","705",NA
"Eine aktive Einwanderungspolitik verpflichtet die Gesellschaft zugleich zu sozialen Investitionen in Sprachförderung, in kulturelle Einrichtungen, in konkrete Integrationshilfen und Sozialarbeit.","At the same time, an active immigration policy obliges society to make social investments in language support, in cultural institutions, in concrete integration assistance and social work.","705",NA
"Wir wollen in den Schulen die interkulturelle Bildung fächerübergreifend stärken und Mehrsprachigkeit fördern;","We want to strengthen intercultural education in schools across all subjects and promote multilingualism; in","506",NA
"wir fordern im Kultur- und Jugendbereich mehr Mittel zur Förderung demokratischer Jugendkultur","the area of culture and youth, we call for more funding to promote democratic youth culture","202",NA
"und für internationalen Jugendaustausch.","and for international youth exchanges.","107",NA
"Respekt vor dem Anderen und Fremden ist Existenzbedingung einer demokratischen Gesellschaft in einer globalisierten Welt.","Respect for the other and the foreign is a condition of existence of a democratic society in a globalized world.","202",NA
"Globale Probleme friedlich, kooperativ und gerecht lösen","Solving global problems peacefully, cooperatively and equitably",NA,NA
"„Frieden,","""Peace,","106",NA
"Freiheit,","Freedom,","201",NA
"Gerechtigkeit,","Justice,","503",NA
"Menschenrechte","Human rights","201",NA
"und eine Leben in Würde“ – diesen Zielen muss deutsche Außenpolitik verpflichtet sein.","and a life in dignity"" - German foreign policy must be committed to these goals.","503",NA
"Frieden kann nur wachsen, wo Gerechtigkeit herrscht.","Peace can only grow where justice prevails.","106",NA
"Freiheit gibt es nur dort, wo die Menschen ohne Angst vor Gewalt und ohne Sorge um das tägliche Brot leben können.","Freedom exists only where people can live without fear of violence and without worrying about their daily bread.","201",NA
"Die dauerhafte Sicherung von Frieden und Freiheit verlangt daher kategorisch, die in der Welt von heute herrschenden Gegensätze zwischen Reich und Arm, Nord und Süd, Starken und Schwachen zu überwinden.","The lasting safeguarding of peace and freedom therefore categorically demands that the antagonisms prevailing in the world today between rich and poor, North and South, strong and weak, be overcome.","107",NA
"Deutsche Außenpolitik soll durch eigenes Handeln, durch entsprechendes Wirken in der Europäischen Union, in Kooperation mit anderen Staaten und in der UNO dazu einen Beitrag leisten.","German foreign policy should contribute to this through its own actions, through appropriate action in the European Union, in cooperation with other states and in the UN.","107",NA
"Für die anderen Parteien im Deutschen Bundestag zeigt sich die wiedergewonnene staatliche Souveränität Deutschlands an der Bereitschaft und Fähigkeit, Krieg führen und mit ihm als Normalität leben zu können.","For the other parties in the German Bundestag, Germany's regained state sovereignty is demonstrated by its willingness and ability to wage war and to live with it as a normality.","105",NA
"Erstmals seit dem Zweiten Weltkrieg wurden deutsche Soldaten, und zwar entgegen dem Verfassungsgebot und out of area, in den Krieg geschickt,","For the first time since World War II, German soldiers were sent to war, against constitutional dictates and out of area;","105",NA
"Streitkräfte gelten wieder als Mittel zur Durchsetzung außenpolitischer Interessen.","armed forces are once again seen as a means of enforcing foreign policy interests.","105",NA
"Damit finden wir uns nicht ab.","We are not resigned to this.","105",NA
"Deutschland zählt heute zu den stärksten Nationen in Europa mit weltpolitischem Gewicht.","Today, Germany is one of the strongest nations in Europe with global political weight.","601",NA
"Wir halten an der Kultur militärischer und machtpolitischer Zurückhaltung fest, die lange Zeit die deutsche Nachkriegsgeschichte prägte.","We are adhering to the culture of military and power-political restraint that has long characterized Germany's postwar history.","103",NA
"Die PDS hat im Bundestag aus guten Gründen die Beteiligung der Bundeswehr an Kriegen und Militärinterventionen abgelehnt und den Abzug dieser Militärkontingente aus den Einsatzgebieten gefordert.","In the Bundestag, the PDS has rejected the participation of the Bundeswehr in wars and military interventions for good reasons and has demanded the withdrawal of these military contingents from the areas of operation.","105",NA
"Dies wird so bleiben.","This will remain so.","105",NA
"Die PDS will Konflikte zivil und nicht militärisch lösen.","The PDS wants to resolve conflicts by civilian rather than military means.","105",NA
"Deutschland muss sich in der Welt als fairer Partner für globale Gerechtigkeit, nachhaltige Entwicklung und Wohlstand erweisen.","Germany must prove itself to be a fair partner in the world for global justice, sustainable development and prosperity.","107",NA
"Gerade als weltwirtschaftlich eng verflochtenes Land muss Deutschland an einer friedlichen, überlebensfähigen, sich nachhaltig entwickelnden Welt aktiv mitarbeiten.","As a country with close global economic ties, Germany must play an active role in creating a peaceful, viable and sustainably developing world.","107",NA
"Dies bedeutet für uns auch, dass Deutschland seine Mitgliedschaft in der EU zur Durchsetzung einer sozialen.","For us, this also means that Germany must use its membership of the EU to enforce a social.","503",NA
"und ökologischen Politik nutzt","and ecological policy","501",NA
"Auf internationaler Ebene treten wir für die Stärkung der internationalen Institutionen wie UNO und OSZE und für eine zuverlässige Einbindung Deutschlands in diese Institutionen ein.","At international level, we advocate the strengthening of international institutions such as the UN and OSCE and the reliable integration of Germany into these institutions.","107",NA
"Deutschlands Zukunft liegt in einem geeinten Europa,","Germany's future lies in a united Europe,","108",NA
"einem Europa, das hegemoniale Ansprüche anderer zurückweist, ohne eigene Vorherrschaftsansprüche zu stellen,","a Europe that rejects the hegemonic claims of others without making its own claims to supremacy,","103",NA
"einem Europa, das seine sozialstaatlichen Traditionen weiterentwickelt","a Europe that continues to develop its welfare state traditions","503",NA
"und sich für eine gerechte Weltordnung stark macht.","and is committed to a just world order.","107",NA
"Globalisierung gestalten","Shape globalization",NA,NA
"Das vergangene Jahrzehnt begann mit großen Hoffnungen auf Frieden,","The past decade began with great hopes for peace,","106",NA
"auf mehr Demokratie,","for more democracy,","202",NA
"mehr Gerechtigkeit","more justice","503",NA
"und eine ökologisch erneuerte Welt.","and an ecologically renewed world.","501",NA
"Weitreichende Programme zur Rettung und Besserung der Welt wurden auf Konferenzen der Vereinten Nationen beschlossen, jedoch nicht realisiert.","Far-reaching programs for the salvation and betterment of the world were decided at United Nations conferences, but were not realized.",NA,NA
"Stattdessen wurden die Gegensätze in der Welt durch eine ungebremste kapitalistische Globalisierung verschärft.","Instead, the contrasts in the world have been exacerbated by unchecked capitalist globalization.","415",NA
"Die sich an den Machtinteressen großer Industrienationen orientierende Politik der kapitalistischen Globalisierung führt zu desaströsen Folgen.","The policy of capitalist globalization, which is oriented toward the power interests of large industrial nations, leads to disastrous consequences.","103",NA
"Sie sind unübersehbar: mehr Instabilität, mehr Gewalt, mehr Ungerechtigkeit.","They are unmistakable: more instability, more violence, more injustice.","103",NA
"Wir wollen stattdessen Globalisierung nach dem Leitbild einer kooperativen Weltwirtschaftsordnung gestalten: sozial, ökologisch, demokratisch.","Instead, we want to shape globalization according to the model of a cooperative world economic order: social, ecological, democratic.","107",NA
"Wir wollen erreichen, dass Deutschland zum Aktivposten bei der demokratischen Kontrolle der internationalen Finanzströme","We want to ensure that Germany becomes an asset in the democratic control of international financial flows.","202",NA
"und der Einbindung internationaler Konzerne in die soziale Verantwortung wird.","and the involvement of international corporations in social responsibility.","403",NA
"Dabei geht es um die Austrocknung jeglicher Geldwäsche aus illegalen Geschäften, deren Umfang auf weltweit jährlich 1.500 Milliarden Dollar geschätzt wird.","The aim is to dry up all money laundering from illegal transactions, which is estimated to be worth 1,500 billion dollars a year worldwide.","605",NA
"Es geht aber auch darum, dass sich Vermögende und Konzerne durch die Flucht in Steueroasen der Besteuerung entziehen und die Steuerdumpingkonkurrenz vorantreiben.","But it is also about wealthy individuals and corporations escaping taxation by fleeing to tax havens and driving tax dumping.","605",NA
"Daher ist es erforderlich, dass sich die Bundesrepublik Deutschland für die Abschaffung der Steueroasen einsetzt.","It is therefore necessary for the Federal Republic of Germany to work for the abolition of tax havens.","408",NA
"Die zügige Umsetzung des OECD-Sanktionskataloges gegen die Steueroasen ist ein erster Schritt dazu.","The swift implementation of the OECD sanctions catalog against tax havens is a first step in this direction.","408",NA
"Staatliche Handlungsspielräume müssen zurück gewonnen, die zersetzende Macht transnational agierender Kapitale muss zurück gedrängt,","State room for maneuver must be regained, the corrosive power of transnationally operating capitals must be pushed back, and","412",NA
"die internationalen Handlungsoptionen für die Entwicklung müssen gestärkt werden.","international options for development must be strengthened.","107",NA
"Dazu gehört auch die Einführung einer Steuer auf Devisengeschäfte (Tobin-Tax).","This also includes the introduction of a tax on foreign exchange transactions (Tobin tax).","403",NA
"Wenn ein weltweites Abkommen nicht erreichbar ist, sollte sie in der EU eingeführt werden.","If a global agreement is not achievable, it should be introduced in the EU.","108",NA
"Die Vereinbarung von Währungskooperation wäre ein weiterer Schritt zur Stabilisierung der internationalen Finanzmärkte.","Agreeing on monetary cooperation would be another step toward stabilizing international financial markets.","107",NA
"Transnationale Konzerne und Investoren müssen auf soziale Verantwortung verpflichtet werden.","Transnational corporations and investors must be held to social responsibility.","503",NA
"Deshalb unterstützen wir Maßnahmen zur Durchsetzung sozialer Standards im Welthandel.","That is why we support measures to enforce social standards in global trade.","503",NA
"Wir bejahen die gewerkschaftlichen Bemühungen um verbindliche Verhaltenskodizes und Maßnahmen der Transparenz, mit denen Unternehmen verpflichtet werden, über ihre Investitionsaktivitäten und deren Sozial-, Umwelt- und Beschäftigungswirkungen in jedem Land, in dem sie aktiv sind, zu informieren.","We affirm union efforts to establish binding codes of conduct and transparency measures that require companies to provide information about their investment activities and their social, environmental and employment impacts in each country in which they operate.","701",NA
"Es sind Verfahren zur gesellschaftlichen Kontrolle dieser Anlageaktivitäten zu entwickeln.","Procedures for social control of these investment activities must be developed.","403",NA
"Internationale Organisationen wie die Internationale Arbeitsorganisation oder der UN-Ausschuss für wirtschaftliche, soziale und kulturelle Rechte müssen stärker unterstützt und in ihrem Durchsetzungsvermögen gestärkt werden.","International organizations such as the International Labor Organization or the UN Committee on Economic, Social and Cultural Rights must be given greater support and strengthened in their assertiveness.","107",NA
"Die Richtlinien für die Vergabe von Hermes-Ausfuhrbürgschaften sind verbindlich an Umwelt- und Sozialverträglichkeit und an der Einhaltung der Menschenrechte auszurichten.","The guidelines for the issuance of Hermes export guarantees are to be bindingly aligned with environmental and social compatibility and the observance of human rights.","416",NA
"Transparenz, parlamentarische Kontrolle und die Einbeziehung der Nichtregierungsorganisationen sind zu gewährleisten.","Transparency, parliamentary control and the involvement of non-governmental organizations must be guaranteed.","202",NA
"Außerdem lehnen wir die geplante Neuregelung des Kreditgeschäftes (Basel II-Abkommen) ab, weil jedes weitere Vorenthalten und Verteuern von Darlehen an Kleinunternehmen weiterem Mittelstandssterben Vorschub leistet.","We also reject the planned new regulation of the credit business (Basel II agreement), because any further withholding of loans to small businesses and making them more expensive will further kill off small and medium-sized businesses.","403",NA
"Bildung, Forschung, Gesundheit und Wasser stellen für uns öffentliche Güter dar, die aus den Verhandlungen über die weltweite Liberalisierung und Privatisierung der öffentlichen Daseinsvorsorge ausgenommen werden müssen.","For us, education, research, health and water are public goods that must be excluded from the negotiations on the global liberalization and privatization of public services.","413",NA
"Öffentliche Aufträge und das öffentliche Beschaffungswesen sind an die Einhaltung sozialer und ökologischer Standards zu binden.","Public contracts and public procurement must be tied to compliance with social and ecological standards.","416",NA
"Wir treten für die Freigabe von Patentrechten für Produkte der menschlichen Grundversorgung ein – zum Beispiel für Medikamente, die sich im Besitz pharmazeutischer Konzerne befinden und die für die Bekämpfung schwerwiegender und weit verbreiteter Krankheiten wie etwa Aids in Afrika aus Preis- und Patentgründen nicht zur Verfügung stehen.","We advocate the release of patent rights for basic human care products - for example, drugs owned by pharmaceutical corporations that are not available to fight serious and widespread diseases such as AIDS in Africa for price and patent reasons.","107",NA
"Im Rahmen der Welthandelsorganisation und anderer internationaler Institutionen soll sich Deutschland für eine faire Entwicklung verwenden.","Within the framework of the World Trade Organization and other international institutions, Germany should advocate fair development.","107",NA
"Hierzu gehört nach unserer Auffassung die Schaffung globaler politischer und ökonomischer Rahmenbedingungen, die es Entwicklungsländern ermöglichen, ihre eigenen Märkte zu entwickeln und gleichzeitig Zugang zu den Märkten des Nordens zu erlangen.","In our view, this includes the creation of global political and economic framework conditions that enable developing countries to develop their own markets and at the same time gain access to the markets of the North.","107",NA
"Dies schließt den Abbau von Exportsubventionen der reichen Länder ein.","This includes reducing export subsidies from rich countries.","407",NA
"Im Interesse unverzüglicher Katastrophenhilfe im Falle von Vulkanausbrüchen, Erdbeben, Überschwemmungen usw. ist das System des internationalen Katastrophenschutzes zu verbessern.","In the interest of immediate disaster relief in the event of volcanic eruptions, earthquakes, floods, etc., the system of international disaster management must be improved.","107",NA
"Wir wollen erreichen, dass sich die Kreditprogramme der internationalen Organisationen auf langfristige Kooperationen konzentrieren, die für die eigenständige Entwicklung der Schuldnerländer Voraussetzung sind: ressourcenschonende Technologien im Bereich der Nahrungsmittelproduktion und Energiegewinnung, Gesundheit, Wasser, Bildung.","We want to ensure that the credit programs of international organizations focus on long-term cooperation, which is a prerequisite for the independent development of the debtor countries: resource-saving technologies in the field of food production and energy generation, health, water, education.","416",NA
"Solche Entwicklungsprogramme müssen mit einer Stärkung der Rechte der Frauen verbunden werden.","Such development programs must be linked to women's empowerment.","706",NA
"Kehrtwende in der Entwicklungspolitik herbeiführen – Armut überwinden","Bring about a turnaround in development policy - overcoming poverty",NA,NA
"Kaum noch überschaubar ist die Zahl der internationalen Abkommen, in denen die Industrieländer Selbstverpflichtungen zur Entwicklungszusammenarbeit eingegangen sind.","The number of international agreements in which the industrialized countries have made voluntary commitments to development cooperation is hardly manageable.","305",NA
"Nicht gehaltene Zusagen sind in vielen Ländern der Erde auch Quelle für Hoffnungslosigkeit und für Wut auf westliche Arroganz.","Unkept promises are also a source of hopelessness and anger at Western arrogance in many countries around the world.","305",NA
"Deutsche Außenpolitik soll darauf gerichtet sein, diesen Kreislauf zu durchbrechen.","German foreign policy should aim to break this cycle.","107",NA
"Das Versprechen, 0,7 Prozent des Bruttoinlandsproduktes für Entwicklungsprojekte aufzuwenden, muss die Bundesregierung erfüllen.","The German government must fulfill its promise to spend 0.7 percent of gross domestic product on development projects.","107",NA
"Deutschland soll die Initiative für einen internationalen „Marshallplan für Entwicklung“ ergreifen, der alle Staaten zur Umschichtung von Rüstungsausgaben in die Entwicklungsförderung verpflichtet.","Germany should take the initiative for an international ""Marshall Plan for Development"" that commits all states to reallocating arms spending to development support.","107",NA
"Die großen Industriestaaten der OECD gaben zuletzt jährlich ca. 800 Milliarden Dollar für Rüstungszwecke aus,.","The large industrialized countries of the OECD recently spent about 800 billion dollars annually on armaments, and","105",NA
"für die öffentliche Entwicklungshilfe erübrigten sie weniger als fünf Prozent dieser Summe","less than five percent of this sum was spent on official development assistance.","107",NA
"Wir sagen: Statt Rüstungsboom sollen 100 Milliarden Dollar in die Wassergewinnung sowie die Wasserversorgung und -entsorgung investiert werden!","We say: Instead of an armaments boom, 100 billion dollars should be invested in water production and water supply and sanitation!","107",NA
"Das wäre ein wirkungsvoller Beitrag für eine friedliche Welt, für Ressourceneffizienz, für mehr Arbeitsplätze und Wohlstandsentwicklung.","This would be an effective contribution to a peaceful world, to resource efficiency, to more jobs and prosperity development.","107",NA
"Von überragender Bedeutung ist für die Länder des Südens nach wie vor der Abbau ihrer immensen Schuldenlast.","Of paramount importance for the countries of the South continues to be the reduction of their immense debt burden.","107",NA
"Durch die Fortführung und Ausweitung umfassender Schuldenerlasse für die ärmsten Länder und großzügige Entschuldungsvereinbarungen mit den anderen Entwicklungsländern müssen Signale für einen entwicklungspolitischen Aufbruch gesetzt werden.","Signals of a new departure in development policy must be given by continuing and extending comprehensive debt relief for the poorest countries and generous debt relief agreements with the other developing countries.","107",NA
"Entwicklungsprogramme sollen vor allem dazu dienen, eine binnenmarktorientierte Wirtschaft in den Entwicklungsländern zu stärken, beim Auf- und Ausbau der sozialen Infrastruktur zu helfen und deren Kooperation zu fördern.","Development programs are primarily intended to strengthen a domestic market-oriented economy in developing countries, to help build and expand social infrastructure and to promote their cooperation.","107",NA
