"text","text_en","cmp_code","eu_code"
"§ und die stärkere Ausrichtung der Unternehmensbesteuerung an den Finanzierungs- und Liquiditätserfordernissen insbesondere kleiner und mittlerer Unternehmen;","§ and a stronger alignment of corporate taxation with the financing and liquidity requirements of small and medium-sized enterprises in particular;","403",NA
"§ die Einschränkung von steuerlichen Gestaltungsmöglichkeiten und Steuerschlupflöchern, beispielsweise durch eine Mindestbesteuerung für Gewinne und andere Einkommen;","§ the restriction of tax structuring options and tax loopholes, for example through a minimum taxation for profits and other income;","503",NA
"§ eine Abgaben- und Steuerreform, die eine höhere Beteiligung von großen Vermögen und Erbschaften an der Finanzierung öffentlicher Aufgaben und vor allem an der Förderung gemeinnütziger Zwecke sichert.","§ a levy and tax reform that ensures a higher participation of large assets and inheritances in the financing of public tasks and above all in the promotion of charitable purposes.","503",NA
"§ Vermögen in Höhe des üblicherweise selbstgenutzten Wohneigentums soll steuerfrei bleiben;","§ assets equivalent to the amount of residential property normally used by the owner should remain tax-exempt;","503",NA
"§ die Ersetzung der so genannten Ökosteuer durch eine Primärenergiesteuer, deren Einnahmen insbesondere für den Ausbau und die Finanzierung des öffentlichen Personennahverkehrs und ein ökologisches Investitionsprogramm eingesetzt werden;","§ the replacement of the so-called eco-tax by a primary energy tax, the revenue from which would be used in particular for the expansion and financing of local public transport and an ecological investment program;","416",NA
"§ eine Erweiterung des ermäßigten Mehrwertsteuersatzes - beispielsweise auf apothekenpflichtige Medikamente und arbeitsintensive Dienstleistungen des Handwerks - und durch Anwendung erhöhter Mehrwertsteuersätze auf Luxusgüter;","§ an extension of the reduced VAT rate - for example, to pharmacy-only medicines and labor-intensive craft services - and by applying higher VAT rates to luxury goods;","503",NA
"§ eine konsequente Besteuerung von Börsen- und anderen Spekulationsgewinnen, Einführung einer Tobinsteuer;","§ a consistent taxation of stock market and other speculative profits, introduction of a Tobin tax;","503",NA
"§ die Verbesserung der personellen und vor allem materiellen Möglichkeiten der Finanzverwaltungen, um regelmäßigere Betriebsprüfungen zu gewährleisten und Steuerhinterziehungen zu bekämpfen;","§ the improvement of the personnel and, above all, material possibilities of the tax authorities in order to ensure more regular audits and to combat tax evasion;","605",NA
"§ eine Geldpolitik, deren politische Zielsetzungen national und international, insbesondere im Rahmen der europäischen Union, auf die Lösung auch beschäftigungspolitischer, sozialer und ökologischer Probleme orientiert sind.","§ a monetary policy whose political objectives are geared towards solving employment, social and ecological problems, both nationally and internationally, particularly within the European Union.","416",NA
"Von Deutschlands Rand zu Europas Mitte:","From Germany's Edge to Europe's Center:",NA,NA
"Ostdeutschland braucht einen neuen Aufbruch","Eastern Germany needs a new departure",NA,NA
"Die soziale und ökonomische Wirklichkeit fällt ein hartes Urteil über vier Jahre rotgrüne Politik in Ostdeutschland.","Social and economic reality is passing harsh judgment on four years of Red-Green policies in East Germany.","305",NA
"Seit 1997 bleibt der wirtschaftliche Zuwachs im Osten hinter dem im Westen zurück; der Abstand vergrößert sich wieder.","Since 1997, economic growth in the east has lagged behind that in the west; the gap is widening again.","408",NA
"Im vergangenen Jahr schrumpfte die ostdeutsche Wirtschaft.","Last year, the East German economy contracted.","408",NA
"Die Erwerbstätigkeit nahm seit 1998 im Westen zu, im Osten sank die Zahl sozialversicherungspflichtiger Arbeitsplätze erstmals unter die 5-Millionen-Grenze.","Since 1998, employment has increased in the west, while in the east the number of jobs subject to social insurance contributions fell below the 5 million mark for the first time.","408",NA
"Dafür erhöhte sich die Arbeitslosenquote Ost vom 1,8-fachen auf mehr als das 2,3-fache der West-Quote.","On the other hand, the unemployment rate in the east increased from 1.8 times to more than 2.3 times the rate in the west.","408",NA
"Die Zahl der Langzeitarbeitslosen stieg um mehr als 10 Prozent, die Jugendarbeitslosigkeit um 15 Prozent. Erwerbslosigkeit, Ausbildungsplatzmangel, niedrigere Einkommen, Wohnungsleerstand und Abwanderung mehren für viele Ostdeutsche nicht die Erwartungen auf eine lebenswerte Zukunft in ihrer Region.","The number of long-term unemployed rose by more than 10 percent, youth unemployment by 15 percent. Unemployment, a lack of apprenticeships, lower incomes, vacant housing and emigration are not raising the expectations of many East Germans for a livable future in their region.","503",NA
"Die „Chefsache Ost” blieb eine Worthülse.","The ""Chief Concern East"" remained an empty phrase.","305",NA
"Wir halten daran fest: Ostdeutschland braucht einen neuen Aufbruch!","We are sticking to our guns: East Germany needs a new departure!","606",NA
"Eine Perspektive, die im Osten und im Westen trägt und die von in Ostdeutschland lebenden Menschen verwirklicht wird.","A perspective that is sustainable in the East and in the West and that is realized by people living in East Germany.","606",NA
"Eine Perspektive, die die Erfahrungen der Ostdeutschen mit zwei politischen und gesellschaftlichen Systemen, ihre Qualifikationen und ihren kreativen Leistungswillen nutzt, fordert und fördert.","A perspective that uses, demands and promotes the East Germans' experience with two political and social systems, their qualifications and their creative will to perform.","606",NA
"Eine Perspektive, die Ostdeutschland zu einem anziehenden Lebensstandort macht.","A perspective that makes eastern Germany an attractive place to live.","408",NA
"EU-Osterweiterung als Chance nutzen!","Use EU enlargement to the east as an opportunity!",NA,NA
"Die Zeit drängt.","Time is of the essence.","000",NA
"Der soziale und wirtschaftliche Einigungsprozess steckt in der Sackgasse.","The social and economic unification process is at an impasse.","110",NA
"Die 2004 bevorstehende EU-Osterweiterung lässt viele Menschen befürchten, dass ihre Lebensregionen zur reinen Transitstrecke im größeren EU-Binnenmarkt und zum perspektivlosen, vergessenen Hinterhof westdeutscher Wirtschaftszentren werden.","The EU's imminent eastward enlargement in 2004 makes many people fear that their living regions will become mere transit routes in the larger EU internal market and the forgotten backyard of West German economic centers without prospects.","110",NA
"Wir setzen uns dafür ein, dass sich diese Befürchtungen nicht bewahrheiten.","We are committed to ensuring that these fears do not come true.","305",NA
"Die PDS sieht und sucht die neuen Chancen für Ostdeutschland.","The PDS sees and seeks the new opportunities for East Germany.","408",NA
"Die Erweiterung der EU kann zu einer Chance Ostdeutschlands werden.","The expansion of the EU can become an opportunity for eastern Germany.","108",NA
"Diese wollen wir mit aller Kraft nutzen: in den Kommunen, in den Ländern und Regionen, im Bund und in Europa.","We want to use this with all our strength: in the municipalities, in the states and regions, in the federal government and in Europe.","305",NA
"Wenn Ostdeutschland mit der Osterweiterung geografisch vom Rand der EU in die Mitte rückt, so muss das auch wirtschaftlich, sozial und kulturell gelingen!","If eastern Germany moves geographically from the edge of the EU to the center with the eastward expansion, this must also succeed economically, socially and culturally!","606",NA
"Nicht zuletzt die vielfältigen traditionellen Verbindungen mit den ost- und mitteleuropäischen Staaten bieten hierfür eine Grundlage.","Not least the manifold traditional connections with the Eastern and Central European states provide a basis for this.","107",NA
"Wir werben für ehrgeizige Ziele.","We promote ambitious goals.","408",NA
"Wir setzen uns dafür ein, dass die ostdeutschen Länder als europäische Region mit Zukunft – unabhängig von Sonderalimentierungen und ohne soziale Verwerfungen – lebensfähig werden.","We are committed to making the eastern German states viable as a European region with a future - independent of special alimentation and without social distortions.","410",NA
"Einen neuen Solidarpakt III und Sonderzahlungen an die ostdeutschen Länder ab 2020 wollen wir so überflüssig machen.","In this way, we want to make a new Solidarity Pact III and special payments to the eastern German states from 2020 superfluous.","410",NA
"Wir setzen auf eine neue Modernisierungswelle in und für Ostdeutschland.","We are counting on a new wave of modernization in and for eastern Germany.","411",NA
"Wir setzen auf neue Elemente in der Politik: von der Westanpassung zur sozialen und ökonomischen Binnenintegration durch Aufbau und Stärkung ostdeutscher Leistungspotenziale, durch die Entfaltung Ostdeutschlands als Verflechtungsraum von alter und neuer EU, durch eine Neustrukturierung von politischen Entscheidungskompetenzen und durch eine flexible und verantwortliche Finanzierung.","We are focusing on new elements in policy: from adjustment to the West to internal social and economic integration by building up and strengthening East German performance potential, by developing East Germany as an interlinked area of the old and new EU, by restructuring political decision-making competencies and by flexible and responsible financing.","404",NA
"Innovationen und neue Wirtschaftsstrukturen für zukunftsfähige Produkte und Dienstleistungen","Innovations and new economic structures for sustainable products and services",NA,NA
"Die Vergrößerung der Marktanteile ostdeutscher Unternehmen ist eine Kernfrage für die angestrebte selbsttragende Wirtschaftsentwicklung in Ostdeutschland.","Increasing the market shares of eastern German companies is a key issue for the self-sustaining economic development sought in eastern Germany.","408",NA
"Die entscheidende Basis dafür ist Unternehmensentwicklung.","The decisive basis for this is corporate development.","402",NA
"Wir streben eine Innovations-, Investitions- und Gründungsoffensive für ostdeutsche Unternehmen an.","We aim to launch an innovation, investment and start-up offensive for eastern German companies.","402",NA
"Neue technologische Entwicklungen – wie etwa die Wasserstofftechnologie und andere Formen der regenerativen Energien – bieten die Chance, Ostdeutschland zu einem wichtigen Standort für umweltverträgliche Energieerzeugung zu machen.","New technological developments - such as hydrogen technology and other forms of renewable energy - offer the opportunity to make eastern Germany an important location for environmentally compatible energy production.","411",NA
"Wir wollen regionale Innovations-, Kompetenz- und Kooperationszentren, um eine engere Verflechtung technologieintensiver Produktions- und Dienstleistungsunternehmen mit den Zulieferern und mit leistungsfähigen Wissenschafts- und Bildungseinrichtungen der Region herbeizuführen und die Chancen von Start-up-Unternehmen zu verbessern.","We want regional innovation, competence and cooperation centers to bring about closer integration of technology-intensive production and service companies with suppliers and with high-performance scientific and educational institutions in the region and to improve the opportunities for start-up companies.","402",NA
"Unternehmerische Menschen mit kreativen Ideen, sozialem Verantwortungsbewusstsein, mit Risikobereitschaft, Selbstständigkeit und überdurchschnittlichem Engagement brauchen eine intelligente öffentliche Förderung statt Entmutigung durch die restriktiven Kreditkonditionen der Großbanken.","Entrepreneurial people with creative ideas, a sense of social responsibility, a willingness to take risks, independence and above-average commitment need intelligent public support instead of discouragement from the restrictive lending conditions of the major banks.","402",NA
"Intelligente Förderung heißt für uns auch, betriebswirtschaftlich verengtes Denken und Handeln zu Gunsten volkswirtschaftlicher Nutzeffekte zu überwinden, zum Beispiel durch die Bereitstellung von leerstehenden öffentlich verfügbaren Immobilien zu symbolischen Mietpreisen für Existenzgründerinnen und Existenzgründer.","For us, intelligent support also means overcoming narrow economic thinking and action in favor of economic benefits, for example by making vacant publicly available real estate available to start-ups at symbolic rents.","402",NA
"Die Ansiedlungspolitik soll sich vor allem an Unternehmen mit hohen regionalen Verflechtungseffekten wenden","The relocation policy should primarily target companies with high regional integration effects","402",NA
"und auf eine sozialökologische Re-Industrialisierung,","and a socio-ecological re-industrialization,","416",NA
"die Beförderung regionaler Wirtschaftskreisläufe","the promotion of regional economic cycles","404",NA
"und die Re-Vitalisierung ländlicher Räume zielen.","and the revitalization of rural areas.","408",NA
"Zur Neuausrichtung der Förderpolitik gehört die verstärkte Förderung von Unternehmensverbünden und von Netzwerken zwischen Klein- und Mittelunternehmen, wissenschaftlichen und Bildungseinrichtungen sowie regionalen Akteuren gegenüber der Einzelförderung, um Nachteile, die sich aus der ostdeutschen Unternehmenslandschaft ergeben, einzuschränken und die innovativen Potenziale in den Regionen zu stärken.","The reorientation of funding policy includes increased support for business associations and networks between small and medium-sized enterprises, scientific and educational institutions, and regional actors as opposed to individual funding, in order to limit disadvantages resulting from the eastern German business landscape and to strengthen the innovative potential in the regions.","404",NA
"Dazu gehört auch die stärkere Konzentration der Fördermittel auf Schwerpunkte, auf innovative Kompetenzzentren und Produktionscluster sowie auf Produktions- und Dienstleistungskomplexe mit größeren Erweiterungspotenzialen und regionaler Ausstrahlung.","This also includes a stronger concentration of funding on focal points, on innovative competence centers and production clusters as well as on production and service complexes with greater potential for expansion and regional impact.","404",NA
"Die wettbewerbs- und zukunftsfähigen ostdeutschen Agrarstrukturen, insbesondere die Genossenschaften, sollen zu Motoren einer verbrauchernahen und -freundlichen Landwirtschaft mit vielfältigen Kooperationsformen in Verarbeitung und Vermarktung werden.","The competitive and sustainable eastern German agricultural structures, especially the cooperatives, are to become the motors of a consumer-friendly agriculture with diverse forms of cooperation in processing and marketing.","703",NA
"Landwirtschaft bedeutet für uns auch den Erhalt der Produktionsgrundlage Natur durch ökologisch orientierte nachhaltige Bewirtschaftung.","For us, agriculture also means preserving nature as a basis for production through ecologically oriented sustainable management.","501",NA
"Nicht bis 2004 warten, jetzt aktiv werden!","Don't wait until 2004, take action now!",NA,NA
"Wir wollen jetzt Erleichterungen im kleinen Grenzverkehr.","We now want facilitation in local border traffic.",NA,NA
"Wir wollen jetzt eine durchdachte Planung für ein Verkehrsprojekt Osterweiterung.","We now want thoughtful planning for a transportation project eastward expansion.","411",NA
"Die Verkehrsbelastung in den Grenzorten ist bereits heute kaum erträglich.","Traffic congestion in border towns is already barely tolerable.","411",NA
"Der Ausbau grenznaher und grenzüberschreitender Verkehrsverbindungen gerade auch für den Güterverkehr kann zudem Vorbildfunktion für eine sozialökologische Wende in der Verkehrspolitik Gesamtdeutschlands erhalten.","The expansion of cross-border transport links, especially for freight transport, can also serve as a model for a socio-ecological change in Germany's transport policy as a whole.","411",NA
"Regionale Wirtschaftsverflechtungen brauchen regionale Verkehrswege, regionale Knotenpunkte und Tarife, die den regionalen öffentlichen Verkehr unterstützen.","Regional economic linkages need regional transportation routes, regional hubs, and fares that support regional public transportation.","411",NA
"Vordringlich ist auch, dass unverzüglich mit einer „Bildungs- und Sprachenoffensive Osterweiterung'' begonnen wird, die in eine gemeinsame grenzüberschreitende Bildungsinitiative mit Polen und Tschechien münden soll.","It is also urgent that an ""Education and Language Offensive for Eastern Enlargement"" be started without delay, which should lead to a joint cross-border education initiative with Poland and the Czech Republic.","506",NA
"Eine erfolgreiche Osterweiterung braucht sozialen und kulturellen Austausch, regionale Offenheit und gegenseitige Kenntnis, Besuchs- und Begegnungsprojekte sowie Mehrsprachigkeit.","Successful eastward enlargement needs social and cultural exchange, regional openness and mutual knowledge, visiting and meeting projects, and multilingualism.","606",NA
"Um die Chancen der Osterweiterung zu nutzen, braucht es eine Neuausrichtung der Förderpolitik.","In order to take advantage of the opportunities offered by eastward expansion, a reorientation of subsidy policy is needed.","303",NA
"Das von der EU-Kommission vorgelegte Aktionsprogramm „Grenzregionen'' verdient diesen Namen nicht.","The action program ""Border Regions"" presented by the EU Commission does not deserve this name.","305",NA
"Die Grenzregionen müssen eine beträchtliche substanzielle Aufstockung im Rahmen dieses Sonderprogramms erhalten.","Border regions must receive a substantial substantial increase under this special program.","404",NA
"Die Verkehrsinfrastruktur muss vor allem innerhalb der Regionen und nicht nur für die großen transeuropäischen Netze gefördert werden.","Transport infrastructure must be promoted above all within the regions and not just for the major trans-European networks.","411",NA
"Klein- und mittelständische Unternehmen brauchen wirksame Anpassungshilfen und vor allem Unterstützung für die Entwicklung grenzüberschreitender Kooperation.","Small and medium-sized enterprises need effective adaptation assistance and, above all, support for the development of cross-border cooperation.","402",NA
"In der bundesdeutschen Förderpolitik soll die aktive Vorbereitung auf die Osterweiterung zu einem hervorragenden Vergabekriterium werden.","Active preparation for eastward expansion is to become an outstanding award criterion in German federal funding policy.","402",NA
"Gleichzeitig muss sich dieser Schwerpunkt in der Haushaltspolitik des Bundes widerspiegeln.","At the same time, this focus must be reflected in federal budget policy.","404",NA
"Die grenzüberschreitende Kooperation muss besonders auf den Ausbau der gegenseitigen Forschungs- und Produktionskooperation gerichtet werden.","Cross-border cooperation must be particularly focused on the development of mutual research and production cooperation.","107",NA
"Die EU-Osterweiterung ist eine neue Chance für die innere Einheit.","EU enlargement to the East is a new opportunity for internal unity.","606",NA
"Das vordergründige Bild von den westdeutschen Gebern und den ostdeutschen Nehmern kann damit erfahrbar widerlegt werden.","The superficial image of West German donors and East German takers can thus be experientially refuted.","606",NA
"Mit der Osterweiterung erneuert sich die Chance auf gemeinsame Problemwahrnehmung.","With the eastward enlargement, the chance for a common perception of problems is renewed.","606",NA
"Die bayrisch-fränkischen Grenzregionen stehen vor ähnlichen Herausforderungen wie Vorpommern, Brandenburg und Sachsen.","The Bavarian-Franconian border regions face similar challenges as Western Pomerania, Brandenburg and Saxony.","606",NA
"Das fordert zu einem solidarisch-kooperativen Föderalismus heraus:","This calls for a cooperative federalism based on solidarity:","606",NA
"Gewinnt Ostdeutschland bei der Osterweiterung eine neue Perspektive, nutzt das allen Ländern, und umgekehrt schadet es allen.","If eastern Germany gains a new perspective in the eastward expansion, this benefits all the Länder, and conversely it harms all of them.","606",NA
"Dafür brauchen wir in der Bundesregierung keinen Beauftragten für Ostdeutschland, sondern einen Beauftragten für die Ostintegration, der Aktivitäten vernetzt, Grundlinien entwirft und strukturiert, Kontakte vermittelt und der eine „Ständige Konferenz Ostdeutschland“ ins Leben ruft.","For this we do not need a Commissioner for Eastern Germany in the Federal Government, but rather a Commissioner for Eastern Integration who networks activities, drafts and structures basic guidelines, mediates contacts and who establishes a ""Permanent Conference on Eastern Germany"".","303",NA
"Politische Signale für einen neuen Aufbruch setzen!","Setting political signals for a new departure!",NA,NA
"Wir bleiben dabei: Die Menschen in Ostdeutschland brauchen eindeutige politische Signale, dass der neue Aufbruch ernst gemeint ist und zur Verbesserung und Angleichung der Lebensverhältnisse führen soll.","We maintain that the people in eastern Germany need clear political signals that the new departure is serious and should lead to an improvement and equalization of living conditions.","606",NA
"Lebensqualität zeigt sich vor allem im kommunalen Raum.","Quality of life is most evident in the community space.","301",NA
"Die ostdeutschen Städte stehen angesichts der demografischen Entwicklung und des wirtschaftlichen Strukturwandels vor zusätzlich komplizierten Aufgaben.","In view of demographic developments and economic structural change, eastern German cities are facing additional complicated tasks.","301",NA
"Die Last der „Altschulden'', der Modernisierungskredite und der Einnahmeausfälle aus über 1 Million leer stehender Wohnungen sind nicht länger zu tragen.","The burden of ""old debt,'' modernization loans, and lost revenue from more than 1 million vacant apartments can no longer be borne.","606",NA
"Die Altschulden des DDR-Wohnungsbaus müssen endlich gestrichen werden.","The old debts of GDR housing must finally be cancelled.","606",NA
"Das Programm „Stadtumbau Ost“ ist so auszustatten, dass die ostdeutsche Wohnungswirtschaft ökonomisch überleben","The ""Urban Redevelopment East"" program must be equipped in such a way that the eastern German housing industry can survive economically and","402",NA
"und stadt- und sozialverträgliche Rück- und Umbaukonzepte realisiert werden können.","urban and socially compatible redevelopment and conversion concepts can be implemented.","411",NA
"Angleichung der Lebensverhältnisse heißt vor allem auch Lohnangleichung.","The equalization of living conditions also means, above all, the equalization of wages.","701",NA
"Die Politik muss die Tarifpartner mit einem Fahrplan zur Angleichung der Löhne unterstützen.","Policymakers must support the collective bargaining partners with a roadmap for wage alignment.","405",NA
"Die Diskriminierung ostdeutscher Berufsabschlüsse muss unmittelbar beendet,","Discrimination against East German professional qualifications must end immediately,","503",NA
"die verbliebenen Überführungslücken bei Renten- und Versorgungsansprüchen müssen jetzt geschlossen werden, jegliche Reste von Rentenunrecht gehören abgeschafft.","the remaining transfer gaps in pension and benefit entitlements must be closed now, and any remnants of pension injustice must be abolished.","503",NA
"Sondergebietsregelungen – wie bei den ostdeutschen Rentenwerten, den Sozialhilfe- und Unterhaltsregelsätzen – müssen in der kommenden Legislaturperiode überwunden werden.","Special area regulations - as in the case of East German pension values, social welfare and maintenance rule rates - must be overcome in the coming legislative period.","503",NA
"Das gilt auch für weitere Regelungen des Sozialversicherungs- und Förderrechts.","This also applies to other regulations of social security and subsidy law.","503",NA
"Wir wollen, dass vernünftige Indikatoren zur Beurteilung der sozialen und wirtschaftlichen Entwicklung in Ost und West einheitlich gelten.","We want reasonable indicators for assessing social and economic development to apply uniformly in East and West.","303",NA
"Denn über die ostdeutschen Probleme vergessen wir die westdeutscher Regionen an der Küste, im Ruhrgebiet, in der Pfalz oder in der Rhön nicht.","After all, we do not forget about the problems in eastern Germany and those in western Germany on the coast, in the Ruhr region, in the Palatinate or in the Rhön.","606",NA
"Das Denken und Handeln im Ost-West-Muster muss politisch, sozial und wirtschaftlich überwunden werden.","Thinking and acting in the East-West pattern must be overcome politically, socially and economically.","606",NA
"Wir treten für die Anerkennung der Gleichwertigkeit des Grund- und des Gebäudeeigentums im Interesse der ostdeutschen Nutzerinnen und Nutzer von Freizeit- und Erholungsgrundstücken ein.","We advocate the recognition of the equivalence of land and building ownership in the interest of East German users of recreational and leisure land.","503",NA
