"text","text_en","cmp_code","eu_code"
"Um die sprachliche Integration qualitativ nachhaltig zu verbessern, sind die Integrationskurse stärker nach Zielgruppen und Vorkenntnissen zu differenzieren und zu erweitern.","In order to improve the quality of linguistic integration in the long term, the integration courses must be differentiated more strongly according to target groups and prior knowledge and expanded.","607",NA
"Insbesondere für Frauen sind nachholende Integrationsangebote zu eröffnen.","Catch-up integration opportunities must be opened up for women in particular.","705",NA
"Wir brauchen mehr interkulturelle Kompetenz in der Verwaltung und in den Gesundheitsberufen.","We need more intercultural competence in administration and in the health professions.","607",NA
"Seniorenpolitik neu denken – den demographischen Wandel meistern","Rethinking senior citizens' policy - mastering demographic change",NA,NA
"Die FDP legt als einzige Partei einen schlüssigen Ansatz für die Bewältigung des demographischen Wandels vor.","The FDP is the only party to present a coherent approach to managing demographic change.","305",NA
"Nach liberaler Überzeugung lassen sich die vielfältigen Folgeprobleme der demographischen Entwicklung am besten durch Einbeziehung der älteren Generation lösen -durch Mitsprache und Mitarbeit.","Liberals are convinced that the best way to solve the many problems resulting from demographic change is to involve the older generation - through participation and collaboration.","706",NA
"Ältere Menschen sollten so lange aktiv sein, wie sie selber wollen.","Older people should be active as long as they want to be.","706",NA
"Die überwiegende Mehrheit der Bürger ist bis ins hohe Alter körperlich und geistig fit.","The vast majority of citizens remain physically and mentally fit into old age.","706",NA
"Ihre Bereitschaft, sich zu engagieren und zu beteiligen, möchte die FDP fördern und nutzen.","Their willingness to get involved and participate is something the FDP wants to encourage and take advantage of.","606",NA
"Wir können es uns nicht länger leisten, Kenntnisse, Kompetenz und Kreativität älterer Menschen brachliegen zu lassen.","We can no longer afford to let the knowledge, competence and creativity of older people lie idle.","706",NA
"Die FDP fordert daher den Wegfall aller Altersgrenzen für Arbeit,","The FDP therefore calls for the abolition of all age limits for work, the","702",NA
"den Aufbau eines Altersmanagements in den Unternehmen (das heißt persönliches Training und individuelle Förderung älterer Mitarbeiter),","development of age management in companies (i.e. personal training and individual support for older employees),","706",NA
"den Ausbau des lebenslangen Lernens,","the expansion of lifelong learning,","411",NA
"stärkere Förderung des bürgerschaftlichen Engagements","greater support for civic engagement","606",NA
"sowie mehr Angebote zur gesellschaftlichen und politischen Mitwirkung für die ältere Generation.","and more offers for social and political participation for the older generation.","706",NA
"Die Forschungsmittel für Gerontologie, Geriatrie und Alterspsychologie sind so aufzustocken, dass sie einem internationalen Vergleich standhalten.","Research funding for gerontology, geriatrics, and geriatric psychology must be increased so that it stands up to international comparison.","411",NA
"Die FDP will eine selbständige Lebensführung im Alter ermöglichen.","The FDP wants to enable independent living in old age.","706",NA
"Dazu gehört eine barrierefreie Gestaltung der eigenen Wohnung ebenso wie altersgerechte Aufenthaltsqualität im öffentlichen Raum.","This includes barrier-free design of one's own home as well as age-appropriate quality of stay in public spaces.","706",NA
"Die FDP unterstützt mit Nachdruck neue quartiersbezogene Wohnkonzepte für generationenübergreifendes Zusammenleben und Selbsthilfegruppen.","The FDP strongly supports new neighborhood-based housing concepts for intergenerational coexistence and self-help groups.","706",NA
"Menschen mit Behinderung die tatsächliche Teilhabe ermöglichen","Enable people with disabilities to participate effectively",NA,NA
"Liberale Politik will Menschen mit Behinderung eine tatsächliche Teilhabe am gesellschaftlichen Leben ermöglichen.","Liberal policies aim to enable people with disabilities to actually participate in social life.","705",NA
"Wir fordern ein prinzipiell und flächendeckend trägerübergreifendes persönliches Budget.","We are calling for a personal budget that covers the whole country and all providers.","504",NA
"So können hilfebedürftige Menschen statt der Sachleistung eine Geldleistung in Anspruch nehmen.","Thus, people in need of assistance can claim a cash benefit instead of a benefit in kind.","504",NA
"Sie sind Kunden und entscheiden, welcher Anbieter oder welche Person die Hilfe erbringen soll.","They are customers and decide which provider or person should provide the assistance.","705",NA
"Dies stellt das höchstmögliche Maß an Selbständigkeit und Eigenverantwortung sicher.","This ensures the highest possible degree of independence and personal responsibility.","705",NA
"Liberale Sozialpolitik betont das Prinzip der individuellen Hilfe.","Liberal social policy emphasizes the principle of individual assistance.","705",NA
"Durch den demographischen Wandel wird der Anteil von Menschen mit Behinderung an der Gesamtbevölkerung weiter zunehmen.","Demographic change will continue to increase the proportion of people with disabilities in the overall population.","705",NA
"Unser vorrangiges Ziel ist deshalb die rechtzeitige und zukunftsfeste Weiterentwicklung der Eingliederungshilfe.","Our primary goal is therefore the timely and future-proof further development of integration assistance.","503",NA
"Die Lasten müssen zwischen Bund, Ländern und Kommunen verteilt werden.","The burden must be shared between the federal, state and local governments.","303",NA
"Die FDP tritt für ein Recht von Kindern und Jugendlichen mit Behinderungen auf den Besuch von inklusiven Kinderbetreuungseinrichtungen, Schulen sowie Freizeit- und Bildungseinrichtungen ein, um das Miteinander von Menschen mit und ohne Behinderung zu verbessern.","The FDP advocates for the right of children and youth with disabilities to attend inclusive childcare facilities, schools, and recreational and educational facilities to improve the coexistence of people with and without disabilities.","503",NA
"Barrierefreiheit ist Grundvoraussetzung für eine tatsächliche Teilhabe.","Accessibility is a basic prerequisite for actual participation.","705",NA
"Menschen mit Behinderung müssen alle öffentlichen Gebäude, Verkehrsmittel und Kommunikationseinrichtungen weitgehend unabhängig von fremder Hilfe nutzen können.","People with disabilities must be able to use all public buildings, means of transport and communication facilities largely independently of outside assistance.","705",NA
"Grundlage für die Möglichkeit, zu arbeiten, können neben beruflichen Fördermaßnahmen","The basis for the opportunity to work, in addition to vocational support measures, can be","503",NA
"nur die konsequente Vorhaltung von Rehabilitationsinfrastrukturen","only the consistent provision of rehabilitation infrastructures","503",NA
"sowie der Ausbau spezieller Beschäftigungsgesellschaften sein.","and the expansion of special employment companies.","503",NA
"Soweit Menschen mit Behinderung erwerbsfähig sind, sind sie in den allgemeinen Arbeitsmarkt zu integrieren.","Insofar as people with disabilities are capable of working, they are to be integrated into the general labor market.","503",NA
"Die FDP sieht dabei vor allem die Integrationsfachdienste in der Pflicht, ihre Personalstrukturen dahingehend zu qualifizieren, dass sie ihre Instrumente zur beruflichen Eingliederung voll ausschöpfen.","In this context, the FDP sees it as the duty of the integration services in particular to qualify their personnel structures so that they can make full use of their instruments for vocational integration.","705",NA
"Staat und Gesellschaft: Mehr Freiheit wagen","State and Society: Daring More Freedom",NA,NA
"Demokratie lebt von der Teilhabe der Bürger am Geschehen in Gesellschaft und Staat.","Democracy thrives on the participation of citizens in what happens in society and the state.","202",NA
"Die FDP will mehr Freiheit wagen, indem mehr Menschen an der Gestaltung des Gemeinwesens mitwirken können.","The FDP wants to dare more freedom by allowing more people to participate in shaping the community.","202",NA
"Dazu gehört eine Stärkung der demokratischen Entscheidungsprozesse durch mehr Transparenz und mehr Bürgerbeteiligung.","This includes strengthening democratic decision-making processes through greater transparency and more citizen participation.","202",NA
"Notwendig dafür ist eine bessere Zuordnung von politischen Prozessen, wer für welche politische Entscheidung auf welcher Ebene verantwortlich ist.","This requires a better allocation of political processes, who is responsible for which political decision at which level.","202",NA
"Und durch mehr direkte Beteiligungsmöglichkeiten werden Wege für mehr Demokratie eröffnet.","And more direct participation opportunities open up avenues for more democracy.","202",NA
"Im Rahmen eines zusammengewachsenen Europas ist eine verbesserte Bürgerbeteiligung künftig auch auf der europäischen Ebene zu verwirklichen.","In the context of a Europe that has grown together, improved citizen participation must also be realized at the European level in the future.","108",NA
"Wir setzen uns daher für ein kommunales Wahlrecht aller Migranten ein, die sich seit mindestens fünf Jahren rechtmäßig im Land aufhalten.","We therefore advocate for local voting rights for all migrants who have been legally resident in the country for at least five years.","202",NA
"Die FDP bekennt sich zur repräsentativen Demokratie.","The FDP is committed to representative democracy.","202",NA
"Sie will diese aber um Elemente der direkten Demokratie bereichern.","However, it wants to enrich them with elements of direct democracy.","202",NA
"Der Bürger muss sich besonders in seinem unmittelbaren Umfeld stärker an Entscheidungen beteiligen können.","Citizens must be able to participate more in decision-making, especially in their immediate environment.","202",NA
"Deshalb setzen wir uns für Bürgerentscheide, Bürgerbegehren und Bürgerbefragungen auf Landes- und auf Bundesebene ein.","That's why we advocate for citizen referendums, citizen petitions and citizen surveys at the state and federal level.","202",NA
"Es sollten alle in einem Jahr regulär stattfindenden Wahlen – ausgenommen Kommunalwahlen – auf ein bis maximal zwei festzusetzende Wahltermine gebündelt werden.","All elections regularly held in a year - with the exception of local elections - should be bundled into one or at most two election dates to be set.","303",NA
"Diese Bündelung wird den Dauerwahlkampf beenden","This bundling will end the permanent election campaign","303",NA
"und auch wieder zu wachsender Wahlbeteiligung führen.","and also lead to growing voter turnout again.","202",NA
"Eine Neuorganisation der Bund-Länder-Finanzbeziehungen ist notwendig.","A reorganization of federal-state financial relations is necessary.","303",NA
"Im Vordergrund stehen daher eine Reform des Bund-Länder-Finanzausgleichs,","The focus is therefore on reforming the federal-state fiscal equalization system,","303",NA
"der Ausbau der Finanzautonomie der Länder","expanding the fiscal autonomy of the states","301",NA
"und eine Belebung des Wettbewerbs zwischen ihnen.","and stimulating competition between them.","301",NA
"Für Liberale ist bürgerschaftliches Engagement Ausdruck einer lebendigen Bürgerkultur.","For liberals, civic engagement is an expression of a vibrant civic culture.","606",NA
"Bürgerschaftliches Engagement braucht den ermöglichenden, nicht den gewährenden Staat.","Civic engagement needs the enabling, not the granting, state.","606",NA
"Ziel der FDP ist die Schaffung von Freiräumen für bürgerschaftliche Organisationen.","The FDP's goal is to create open space for civic organizations.","606",NA
"Hürden, wie die verschuldensunabhängige Haftung ehrenamtlich tätiger Vereinsvorstände, sind abzubauen.","Hurdles, such as the strict liability of honorary board members, must be removed.","606",NA
"Die FDP will neue innovative Ansätze des bürgerschaftlichen Engagements fördern.","The FDP wants to promote new innovative approaches to civic engagement.","606",NA
"Hierzu gehört eine das Engagement unterstützende Infrastruktur wie Freiwilligenagenturen und Seniorenbüros.","This includes an infrastructure that supports engagement, such as volunteer agencies and senior citizens' offices.","606",NA
"Regelmäßig ehrenamtlich tätige Bürger sollen Zertifikate erhalten, diese sollen bei der Einstellung in den öffentlichen Dienst und bei Beförderung sowie in der Schule bei Zeugnissen berücksichtigt werden.","Citizens who regularly perform voluntary work should receive certificates, which should be taken into account when recruiting for the civil service and for promotions, as well as for school reports.","606",NA
"Kultur von allen","Culture from all",NA,NA
"Kunst und Kultur sind die Grundlagen in der Gesellschaft für die Verständigung untereinander und die Quelle von Identität und Kreativität.","Art and culture are the foundations in society for understanding each other and the source of identity and creativity.","502",NA
"Kunst und Kultur spiegeln den Zustand einer Gesellschaft wider und treiben deren Entwicklung voran.","Art and culture reflect the state of a society and drive its development.","502",NA
"Ohne Kunst und Kultur wäre unsere Gesellschaft nicht kreativ, unsere Bildung technokratisch und unsere Wirtschaft nicht innovativ.","Without art and culture, our society would not be creative, our education technocratic and our economy innovative.","502",NA
"Kunst und Kultur entscheiden wesentlich über die Anpassungsfähigkeit einer Gesellschaft.","Art and culture play a key role in determining the adaptability of a society.","502",NA
"Liberale Kulturpolitik steht unter dem Leitgedanken „Kultur von allen“.","Liberal cultural policy is based on the guiding principle of ""culture for all"".","502",NA
"Der Bürger als Kulturschaffender, Kulturnutzer und Kulturförderer steht im Mittelpunkt liberaler Kulturpolitik.","The citizen as a creator of culture, user of culture and promoter of culture is at the center of liberal cultural policy.","502",NA
"Zudem muss Kulturpolitik Anreize zu stärkerem privaten Engagement schaffen.","In addition, cultural policy must create incentives for greater private involvement.","401",NA
"Zugleich bekennt sich die FDP zur öffentlichen Kulturförderung.","At the same time, the FDP is committed to public cultural funding.","502",NA
"Die FDP wirbt für die Verankerung des Staatsziels Kultur im Grundgesetz.","The FDP is promoting the anchoring of culture as a state objective in the Basic Law.","502",NA
"Kulturelle Bildung ermöglicht gesellschaftliche Teilhabe und persönliche Entfaltung.","Cultural education enables social participation and personal development.","502",NA
"Ihre Förderung mit einem niedrigschwelligen Zugang ist daher eine Verpflichtung des Staates und muss verstärkt werden.","Their promotion with low-threshold access is therefore an obligation of the state and must be strengthened.","502",NA
"Träger der Kultur sind hauptsächlich eine Vielzahl von Vereinen und Initiativen, die weitgehend auf ehrenamtlicher Tätigkeit beruhen.","The main sponsors of culture are a large number of associations and initiatives, which are largely based on voluntary work.","606",NA
"Das Gemeinnützigkeitsrecht ist so umzugestalten, dass nicht der gewährende, sondern der ermöglichende Staat zum Prinzip wird.","The non-profit law must be redesigned in such a way that the principle is not the granting but the enabling state.","606",NA
"Im Steuer-und Haftungsrecht darf ehrenamtliche Arbeit nicht erschwert werden.","In tax and liability law, voluntary work must not be made more difficult.","606",NA
"Für Liberale sind ehrenamtlich tätige Bürgerinnen und Bürger die Grundlage einer freien Bürgergesellschaft.","For liberals, citizen volunteers are the foundation of a free civil society.","606",NA
"Die Kultur- und Kreativwirtschaft ist eine wichtige Zukunftsbranche.","The cultural and creative industries are an important industry of the future.","502",NA
"Die FDP setzt sich für Kredit- und Wagniskapitalinstrumente ein, die die spezifische Situation der Kultur- und Kreativwirtschaft bei den Förderbedingungen berücksichtigt.","The FDP advocates for credit and venture capital instruments that take into account the specific situation of the cultural and creative industries in the funding conditions.","502",NA
"Der Film ist sowohl Wirtschafts- als auch Kulturgut.","Film is both an economic and cultural asset.","502",NA
"Die FDP tritt deshalb für eine Stärkung der Filmwirtschaft am Standort Deutschland ein.","The FDP therefore advocates strengthening the film industry in Germany.","402",NA
"Die Instrumente der Filmförderung müssen auf ihre Eignung überprüft werden, den deutschen Film international wettbewerbsfähig zu machen.","The instruments of film funding must be reviewed to determine their suitability for making German film internationally competitive.","402",NA
"Die Hauptstadtkulturförderung des Bundes ist auf eine klare gesetzliche Grundlage zu stellen.","The federal government's capital city cultural funding must be placed on a clear legal footing.","303",NA
"Ein starkes Engagement des Bundes ist unverzichtbar.","A strong federal commitment is essential.","502",NA
"Dies muss jedoch nach transparenten Kriterien erfolgen und darf nicht zu einer Vernachlässigung der Kulturförderung in den übrigen Bundesländern führen.","However, this must be done according to transparent criteria and must not lead to a neglect of cultural funding in the other federal states.","303",NA
"Staat und Museen müssen die Provenienzforschung verstärken.","The state and museums must strengthen provenance research.","502",NA
"Die Verfahren zur Ermittlung und etwaigen Rückgabe von NS-Raubkunst bedürfen einer Professionalisierung nach internationalen Vorbildern.","The procedures for identifying and possibly returning Nazi looted art need to be professionalized according to international models.","303",NA
"Wir wollen zudem die Rückgabe kriegsbedingt verschleppter Kulturgüter vorantreiben.","We also want to press ahead with the return of cultural assets that were displaced as a result of the war.","502",NA
"Die Terrorherrschaft der Nationalsozialisten von 1933 bis 1945 ist eine in jeder Hinsicht nie da gewesene Katastrophe der deutschen Geschichte.","The National Socialists' reign of terror from 1933 to 1945 is a catastrophe in German history that is unprecedented in every respect.","502",NA
"Das Gedenken an und die Aufklärung über die unvorstellbaren Gräueltaten im Nationalsozialismus gilt es unvermindert und mit Nachdruck zu bewahren.","The remembrance of and information about the unimaginable atrocities of National Socialism must be preserved undiminished and with emphasis.","502",NA
"Bei der Aufarbeitung der deutsch-deutschen Geschichte gibt es großen Nachholbedarf.","There is a great need to catch up on the reappraisal of German-German history.","502",NA
"Für die Zukunft unseres demokratischen Staats ist es wichtig, gerade der jungen Generation über Schulen und Kulturprojekte die Ursachen und Folgen von Unfreiheit und Misswirtschaft zu vermitteln – in allen Bundesländern.","For the future of our democratic state, it is important to use schools and cultural projects to teach the young generation in particular about the causes and consequences of unfreedom and mismanagement - in all German states.","502",NA
"Das Erinnern an die ermordeten Gegner des kommunistischen Regimes soll in die politische Bildung einbezogen werden.","Remembering the murdered opponents of the communist regime should be included in political education.","502",NA
"Die authentischen Stätten des SED-Unrechts sind zu erschließen und zu erhalten.","The authentic sites of SED injustice are to be made accessible and preserved.","502",NA
"Urheberrecht: Hohes Schutzniveau und wirksame Durchsetzung","Copyright: High level of protection and effective enforcement",NA,NA
"Das Urheberrecht hat in der digitalen Welt eine Schlüsselfunktion.","Copyright has a key function in the digital world.","403",NA
"Die FDP fordert deshalb die konsequente Weiterentwicklung des Urheberrechts zur weiteren Verbesserung des urheberrechtlichen Schutzes.","The FDP therefore calls for the consistent further development of copyright law to further improve copyright protection.","403",NA
"Die Einführung einer „Kulturflatrate“ lehnt die FDP ab.","The FDP rejects the introduction of a ""culture flat rate"".","502",NA
"Eine besondere Herausforderung bleibt die Bekämpfung von Urheberrechtsverletzungen vor allem im Internet, denn die „Internetpiraterie“ ist eine existenzielle Bedrohung für die Kultur- und Kreativwirtschaft.","Combating copyright infringement remains a particular challenge, especially on the Internet, because ""Internet piracy"" is an existential threat to the cultural and creative industries.","502",NA
"Das Internet darf kein urheberrechtsfreier Raum sein.","The Internet must not be a copyright-free space.","403",NA
"Die FDP setzt sich deshalb für Lösungen ein, die unter Wahrung des Datenschutzes eine effektive und konsequente Rechtsdurchsetzung gewährleisten.","The FDP therefore advocates solutions that ensure effective and consistent law enforcement while safeguarding data protection.","605",NA
"Die FDP bekennt sich zur kollektiven Wahrnehmung von Urheber- und Leistungsschutzrechten durch Verwertungsgesellschaften mit effizienten und transparenten Strukturen.","The FDP is committed to the collective management of copyrights and ancillary copyrights by collecting societies with efficient and transparent structures.","303",NA
"Vor allem in Bezug auf Online-Nutzungen muss die grenzüberschreitende Lizenzierung durch Verwertungsgesellschaften erleichtert und eine Fragmentierung der Repertoires verhindert werden.","Especially with regard to online uses, cross-border licensing by collecting societies must be facilitated and fragmentation of repertoires prevented.","107",NA
"Die FDP setzt sich für die Schaffung eines europäischen Wahrnehmungsrechts als Grundlage für die Förderung des Wettbewerbs unter den europäischen Verwertungsgesellschaften unter einheitlichen Rahmenbedingungen ein.","The FDP advocates the creation of a European right of administration as a basis for promoting competition among European collecting societies under uniform framework conditions.","403","108"
"Neue Medien – Chancen für mehr Freiheit verantwortlich nutzen","New media - using opportunities for more freedom responsibly",NA,NA
"Die FDP setzt sich für die Modernisierung des Telemedienrechts ein.","The FDP is committed to modernizing telemedia law.","303",NA
"Dieses muss Zuständigkeiten genauso wie Haftungsfreistellungen auf den verschiedenen Ebenen der Anbieter und der Nutzer klar definieren und zuordnen.","This must clearly define and assign responsibilities as well as indemnifications at the various levels of providers and users.","303",NA
"Das Internet ist ein freies Medium.","The Internet is a free medium.","201",NA
"Es muss vor zu starker staatlicher Regulierung und übermäßiger Überwachung geschützt werden.","It must be protected from too much government regulation and excessive surveillance.","201",NA
"Internetdienstanbieter dürfen nicht mit überzogenen Überwachungspflichten belegt werden.","Internet service providers must not be subject to excessive monitoring obligations.","401",NA
"Die Presse- und Meinungsfreiheit einer vernetzten Wissensgesellschaft muss auch im Internet gewahrt werden.","The freedom of the press and freedom of opinion in a networked knowledge society must also be safeguarded on the Internet.","201",NA
"Kinder und Jugendliche müssen aber vor für sie ungeeigneten Inhalten in den Medien geschützt werden.","However, children and young people must be protected from content in the media that is unsuitable for them.","403",NA
"Erwachsenen darf der Zugang zu strafrechtlich unbedenklichen Inhalten dabei allerdings nicht verwehrt werden.","Adults, however, must not be denied access to content that does not violate criminal law.","201",NA
"Zensur darf auch im Internet nicht stattfinden.","Censorship must not take place on the Internet either.","201",NA
"Diese Prinzipien müssen in einem modernen Jugendmedienschutzrecht verankert werden.","These principles must be anchored in modern youth media protection law.","303",NA
"Vielen unerwünschten Effekten des Internets kann nicht im Internet selbst entgegengewirkt werden, jedoch zu Hause am PC.","Many undesirable effects of the Internet cannot be counteracted on the Internet itself, but they can be counteracted at home on the PC.","201",NA
"Die FDP setzt auf Filtern zu Hause statt Sperren durch den Staat.","The FDP favors filtering at home instead of blocking by the state.","201",NA
"Mit der FDP wird es keine aktionistischen Verbote oder staatliche Zensur im Internet geben.","With the FDP, there will be no actionist bans or state censorship on the Internet.","201",NA
"Die so genannte Online-Durchsuchung lehnt die FDP strikt ab.","The FDP strictly rejects the so-called online search.","201",NA
"Die FDP will mehr Wettbewerb bei den Infrastrukturen der Telekommunikation","The FDP wants more competition in telecommunications infrastructures","403",NA
