"text","text_en","cmp_code","eu_code"
"Die Mitte stärken. Deutschlandprogramm 2009 Programm der Freien Demokratischen Partei zur Bundestagswahl 2009 beschlossen auf dem Bundesparteitag vom 15.-17. Mai 2009 in Hannover.","Strengthening the center. Germany Program 2009 Program of the Free Democratic Party for the 2009 Bundestag Elections adopted at the Federal Party Congress in Hanover, May 15-17, 2009.",NA,NA
"1. Präambel: Die Mitte stärken","1. preamble: strengthening the center",NA,NA
"Der Mensch steht im Mittelpunkt liberaler Politik.","People are at the center of liberal politics.",NA,NA
"Wir machen uns für die Freiheit des Einzelnenin Verantwortung für eine bessere Zukunft unseres Landes stark.","We stand up for the freedom of the individual in responsibility for a better future of our country.","401",NA
"Wir wollen die liberale Bürgergesellschaft, in der der Einzelne nicht losgelöst von seinen Mitbürgern lebt, sondern gemeinsam mit ihnen in einer Wertegemeinschaft.","We want a liberal civil society in which individuals do not live in isolation from their fellow citizens, but together with them in a community of values.","606",NA
"Sie ist geprägt von Weltoffenheit, Toleranz und Solidarität und ist der Menschenwürde verpflichtet.","It is characterized by openness to the world, tolerance and solidarity and is committed to human dignity.","606",NA
"In der liberalen Bürgergesellschaft entscheiden die Bürgerinnen und Bürger über die ZukunftDeutschlands.","In a liberal civil society, citizens decide on the future of Germany.","202",NA
"Die liberale Bürgergesellschaft lebt vom Engagement und der politischen Teilhabe der Menschen.","Liberal civil society thrives on people's commitment and political participation.","606",NA
"Denn durch sie wird Politik gestaltet.","Because it is through them that policy is shaped.","202",NA
"Sie schöpft ihre Kraft aus der Eigeninitiative und Kreativität ihrer Bürgerinnen und Bürger.","It draws its strength from the initiative and creativity of its citizens.","401","108"
"Sie stellt sich den vielfältigen Herausforderungen des demographischen Wandels.","It is facing up to the many challenges of demographic change.","408",NA
"Wir Liberale vertrauen auf die Leistungsbereitschaft der Menschen","We liberals trust in people's willingness to perform and in","401",NA
"und auf einen Staat, der seine Stärke aus der Beschränkung auf seine hoheitlichen Aufgaben schöpft.","a state that draws its strength from limiting itself to its sovereign tasks.","401",NA
"Wir wenden uns an alle mündigen und verantwortungsbereiten Bürgerinnen und Bürger.","We address all mature and responsible citizens.","401",NA
"Sie erkennen selbst, was getan werden muss und brauchen dafür keine bevormundende Staatsbürokratie.","They recognize for themselves what needs to be done and do not need a patronizing state bureaucracy to do it.","401",NA
"Die FDP ist die Partei für alle, die ihr Leben selbst gestalten und dabei nicht vom Staat bevormundet werden wollen.","The FDP is the party for everyone who wants to shape their own lives and not be patronized by the state.","401",NA
"Wir wollen die Maßstäbe politischen Handelns neu definieren: Freiheit vor Gleichheit,","We want to redefine the standards of political action: Freedom before equality,","201",NA
"Erwirtschaften vor Verteilen,","Generate before distributing,","401",NA
"Privat vor Staat,","Private before state,","401",NA
"Eigenverantwortung statt Staatsgläubigkeit,","Personal responsibility instead of faith in the state,","401",NA
"Chancengleichheit statt Gleichmacherei.","Equal opportunities instead of egalitarianism.","503",NA
"Wer mehr Freiheit und Chancengerechtigkeit in Deutschland will, braucht eine starke FDP.","Anyone who wants more freedom and equal opportunities in Germany needs a strong FDP.","201",NA
"Wir setzen uns für mehr Freiheit und Verantwortung und weniger staatliche Bevormundung ein.","We advocate more freedom and responsibility and less government paternalism.","401",NA
"Freiheit ist mehr als ein abstrakter Begriff.","Freedom is more than an abstract concept.","201",NA
"Sie ist die Grundlage für die freie Entwicklung und Entfaltung der Persönlichkeit.","It is the basis for the free development and unfolding of the personality.","201",NA
"Maßstab aller Politik muss die Freiheit sein.","The yardstick of all politics must be freedom.","201",NA
"Denn nur sie erweitert Handlungsspielräume.","Because only it expands the scope for action.","201",NA
"Unsere realistische Betrachtung der Gegenwart liefert Antworten und Lösungsvorschläge, die frei sind von ideologischer Verblendung.","Our realistic view of the present provides answers and proposed solutions that are free of ideological delusion.","305",NA
"Wir wollen die Chancen der Zukunft nutzen, indem wir ihre Herausforderungen erfolgreich meistern.","We want to seize the opportunities of the future by successfully mastering its challenges.","305",NA
"Dazu gehört auch, die Freiheiten zu verteidigen, die wir heute in Deutschland selbstverständlich genießen.","This also includes defending the freedoms that we enjoy as a matter of course in Germany today.","201",NA
"Wir sind nicht dazu bereit, Bürgerrechte für eine trügerische Sicherheit aufzugeben.","We are not willing to give up civil liberties for a deceptive security.","602",NA
"Wir Liberale stehen für eine Politik, die vom Respekt vor den Bürgerrechten","We liberals stand for a policy that is based on respect for civil rights.","201",NA
"und der Verfassung geprägt ist.","and the constitution.","203",NA
"Für Deutschlands Zukunftsfähigkeit ist es zentral, allen Bürgerinnen und Bürgern gleiche Chancen auf freie Entfaltung zu eröffnen.","It is central to Germany's future viability to give all citizens equal opportunities for free development.","503",NA
"Verantwortungsvolle Bürgerinnen und Bürger wissen, dass der Staat ihnen nicht alle Mühen abnimmt.","Responsible citizens know that the state does not take all their troubles away.","401",NA
"Aber sie müssen darauf vertrauen können, dass er ihnen nicht noch zusätzliche Lasten aufbürdet.","But they must be able to trust that he will not place additional burdens on them.","401",NA
"Die FDP ist der Anwalt der Mitte der Gesellschaft.","The FDP is the advocate of the middle of society.","704",NA
"Die Mitte steht gegen Extreme, aber sie ist mehr als etwas zwischen links und rechts.","The center stands against extremes, but it is more than something between left and right.","704",NA
"Sie ist vor allem eines: eine Grundhaltung.","It is one thing above all: a basic attitude.","704",NA
"Für sie sind Leistungsbereitschaft, Fleiß und Aufstiegswille keine Fremdwörter.","For them, a willingness to perform, diligence and the will to advance are not foreign words.","401",NA
"Ihr Denken in Generationen und sozialen Zusammenhängen, ihr Verantwortungsbewusstsein und ihr Fleiß, ihre Eigenverantwortung und der starke Leistungswille sind das Fundament unserer Gesellschaft.","Their thinking in generational and social contexts, their sense of responsibility and diligence, their personal responsibility and strong will to achieve are the foundation of our society.","401",NA
"Die FDP ist der Partner der Mitte.","The FDP is the partner of the middle.","704",NA
"Denn es sind diese Menschen, die unsere Gemeinschaft starkmachen.","Because it is these people who make our community strong.","704",NA
"Sie kümmern sich um eine gute Ausbildung ihrer Kinder, sorgen für die Familie vor und leben Solidarität mit den Schwachen.","They take care of a good education of their children, provide for the family and live solidarity with the weak.","704",NA
"Umweltbewusstsein und ein ausgeprägtes Gefühl für Gerechtigkeit sind für die Mitte der Gesellschaft selbstverständlich.","Environmental awareness and a strong sense of justice are taken for granted by the middle of society.","503",NA
"Die Gängelung der Mitte muss aufhören, damit sich Leistung endlich wieder lohnt.","The squeezing of the middle has to stop so that performance finally pays off again.","401",NA
"Dies trifft insbesondere für den Mittelstand zu, denn Mittelstand ist keine betriebswirtschaftliche Recheneinheit.","This is particularly true for SMEs, because SMEs are not a business computing unit.","704",NA
"Mittelstand ist eine Geisteshaltung.","Middle class is a state of mind.","704",NA
"Mit Pioniersinn und Patriotismus, Mut und Verantwortungsgefühl hat der Mittelstand unser Land einst wieder aufgebaut und das deutsche Wirtschaftswunder möglich gemacht.","With a pioneering spirit and patriotism, courage and a sense of responsibility, the middle classes once rebuilt our country and made the German economic miracle possible.","704",NA
"Wer morgens früher aufsteht, wer sich und anderen auf eigenes Risiko eine Existenz aufbaut, wer selbst vorsorgt, nicht fragt, was der Staat ihm schuldet, sondern was er für andere erreichen kann, der verdient den Respekt aller und braucht politischen Rückenwind.","Those who get up earlier in the morning, who build up an existence for themselves and others at their own risk, who provide for themselves, who don't ask what the state owes them but what they can achieve for others, deserve everyone's respect and need political backing.","401",NA
"Diese mittelständischen Tugenden sind auch heute gefragt, um unser Land weiter nach vorn zu bringen.","These middle-class virtues are also in demand today to move our country forward.","401",NA
"Ohne solche Menschen, die ein umfassendes Versorgungsprinzip vorleben, kann es keine freiheitliche Gesellschaft geben.","Without such people who exemplify a comprehensive supply principle, there can be no free society.","704",NA
"Der Mittelstand steht für Freiheit und Verantwortung.","The Mittelstand stands for freedom and responsibility.","401",NA
"Deutschland braucht eine Politik, die den Mittelstand stärkt und nicht schwächt.","Germany needs a policy that strengthens, not weakens, the middle class.","403",NA
"Die FDP will den Wohlstand in Deutschland nicht nur erhalten, sondern alle Menschen daran teilhaben lassen.","The FDP not only wants to maintain prosperity in Germany, but to let everyone share in it.","503",NA
"Wenn die Mitte wieder gestärkt wird, werden diejenigen belohnt, die sich anstrengen und ihre Chancen ergreifen.","When the center is strengthened again, those who work hard and seize their opportunities will be rewarded.","401",NA
"Hierzu hat Deutschland bereits ein bewährtes und solides Erfolgskonzept: die Soziale Marktwirtschaft.","To this end, Germany already has a proven and solidly successful concept: the social market economy.","403",NA
"Wir halten es für falsch, ihre Leistungsfähigkeit in Frage zu stellen","We believe it is wrong to question their performance","403",NA
"und immer neue und weitergehende staatliche Regulierungen zu fordern.","and demanding ever new and more far-reaching state regulations.","401",NA
"Deutschland braucht nicht weniger, sondern mehr Soziale Marktwirtschaft.","Germany needs more social market economy, not less.","403",NA
"Die Geschichte hat gezeigt, dass die Soziale Marktwirtschaft am besten dauerhaften Wohlstand schaffen kann.","History has shown that the social market economy can best create lasting prosperity.","403",NA
"Wir setzen uns für einen staatlichen Regelungsrahmen ein, der den Missbrauch von Marktmacht wirksam verhindert,","We advocate a state regulatory framework that effectively prevents the abuse of market power,","403",NA
"den Bürgern jedoch ihre Eigenverantwortung lässt.","but leaves citizens with their own responsibility.","401",NA
"Wir setzen Eigenverantwortung gegen die Bevormundung durch die bürokratischen Auswüchse des sozialdemokratischen Wohlfahrtsstaates.","We set personal responsibility against the paternalism of the bureaucratic excesses of the social democratic welfare state.","401",NA
"Wir sind für den liberalen Sozialstaat.","We are in favor of the liberal welfare state.","401",NA
"Die zentrale Staatsaufgabe ist nicht die Schaffung absoluter Gleichheit, sondern die Sicherung von Chancen- und Leistungsgerechtigkeit für alle Menschen.","The central task of the state is not to create absolute equality, but to ensure equality of opportunity and achievement for all people.","503",NA
"Unsere Politik der Freiheit schafft Wohlstand durch fairen Wettbewerb","Our policy of freedom creates prosperity through fair competition","403",NA
"und ein eigenverantwortliches, gesellschaftliches Miteinander.","and responsible social cooperation.","505",NA
"Nur so können die sozialen Sicherungssysteme, wie das Gesundheitswesen, leistungsfähig und bezahlbar bleiben.","Only in this way can social security systems, such as the health care system, remain efficient and affordable.","504",NA
"Die Politik der staatlich verordneten Gleichheit hat bisher immer zu Unfreiheit geführt.","The policy of state-imposed equality has always led to lack of freedom.","201",NA
"Solidarität braucht Eigenverantwortung.","Solidarity needs personal responsibility.","505",NA
"Wir wollen durch einen Ordnungsrahmen einen Beitrag dazu leisten, dass jeder Mensch in Freiheit seine Chancen erkunden und daraus eigenverantwortlich seine Werte finden und sein Glück verfolgen kann:","By providing a regulatory framework, we want to help ensure that everyone can explore their opportunities in freedom, find their own values and pursue their own happiness:","401",NA
"Liberale wollen eine solidarische Gesellschaft.","Liberals want a society based on solidarity.","606",NA
"Im Gegensatz zu anderen denken wir bei Solidarität nicht zuallererst an das Verteilen vom Geld anderer Leute, sondern an das Eintreten füreinander in der Familie, im sozialen Umfeld und erst zuletzt durch den Staat.","Unlike others, we do not think of solidarity first and foremost in terms of handing out other people's money, but in terms of standing up for one another in the family, in the social environment and only lastly through the state.","505",NA
"Zu einem eigenverantwortlichen Leben gehört auch, sich selbst versorgen zu können.","A self-reliant life also includes being able to provide for oneself.","505",NA
"Neid, Missgunst und Missmut setzen wir Mut und Anerkennung für Leistung entgegen.","We counter envy, resentment and ill will with courage and recognition for achievement.","401",NA
"Leistung muss sich lohnen.","Performance must be worthwhile.","401",NA
"Die FDP will den Bürgerinnen und Bürgern wieder mehr ihres hart erarbeiteten Geldes belassen.","The FDP wants to leave citizens more of their hard-earned money again.","414",NA
"Wir wollen einfache, niedrige und gerechte Steuern für mehr Netto vom Brutto.","We want simple, low and fair taxes for more net income.","414",NA
"Für Liberale gilt: Bildung ist Bürgerrecht.","For liberals, education is a civil right.","506",NA
"Nur gute Bildung ermöglicht gesellschaftliche Teilhabe und befähigt zu einem freiheitlichen und selbstbestimmten Leben.","Only good education enables participation in society and empowers people to lead a free and self-determined life.","506",NA
"Wir Liberale stehen für den Wettbewerb um die besten Lösungen und für Vielfalt, die die Begabungen der Kinder fördert und für alle einen möglichst großen Lernerfolg bietet.","We liberals stand for competition for the best solutions and for diversity that promotes children's talents and offers the greatest possible learning success for everyone.","506",NA
"Nur gute Bildung schafft die Grundlage für Innovationen und gesellschaftliche Entwicklung.","Only good education creates the basis for innovation and social development.","506",NA
"Wir maßen uns nicht an, die Zukunft zu kennen.","We do not presume to know the future.","411",NA
"Wir sind aber sicher, dass das kreative Ringen um neue Lösungen der beste Weg ist, um unsere Zukunft zu gestalten.","But we are certain that the creative struggle for new solutions is the best way to shape our future.","411",NA
"Denkverbote sind nicht nur in der Forschung fehl am Platz.","Prohibitions on thinking are not only out of place in research.","411",NA
"Politik muss im Umgang mit natürlichen Ressourcen technologieoffen und ideologiefrei gestaltet werden.","Policies for dealing with natural resources must be open to technology and free of ideology.","411",NA
"Daher setzen wir auch in der Umwelt- und Energiepolitik auf Fortschritt durch moderne Technik.","That is why we are also focusing on progress through modern technology in environmental and energy policy.","411",NA
"Eine intensive internationale Vernetzung Deutschlands ist sowohl Voraussetzung für unsere wirtschaftliche Stärke als auch Garant für unsere Sicherheit und die Bewahrung unserer Werte.","Germany's intensive international networking is both a prerequisite for our economic strength and a guarantor of our security and the preservation of our values.","107",NA
"Deshalb muss deutsche Außenpolitik die Globalisierung aktiv mitgestalten.","That is why German foreign policy must play an active role in shaping globalization.","107",NA
"Dies wird am besten dann gelingen, wenn wir den Schulterschluss mit den europäischen und transatlantischen Partnern suchen.","This will best succeed if we seek to close ranks with our European and transatlantic partners.","107",NA
"Mit ihnen wollen wir neue Impulse in der Abrüstung setzen und dadurch für dauerhaften Frieden sorgen.","With them, we want to give new impetus to disarmament and thereby ensure lasting peace.","106",NA
"In unserer multipolaren Welt, in der sich derzeit große außenpolitische Herausforderungen mit einer Weltwirtschaftskrise und einem politischen Neuanfang in den USA kreuzen, ist mehr internationale Kooperation notwendig und machbar.","In our multipolar world, where major foreign policy challenges currently intersect with a global economic crisis and a new political beginning in the United States, more international cooperation is necessary and feasible.","107",NA
"Neue aufstrebende Mächte müssen in die gemeinsame Wahrnehmung von globaler Verantwortung eingebunden und internationale Organisationen entsprechend reformiert werden.","New emerging powers must be integrated into the joint exercise of global responsibility, and international organizations must be reformed accordingly.","107",NA
"Auf der Suche nach den besten Konzepten für die Zukunft Deutschlands setzt die FDP auf den Dialog mit den Bürgerinnen und Bürgern.","In its search for the best concepts for Germany's future, the FDP relies on dialog with citizens.","202",NA
"Wir wollen bei den Menschen für die Chancen der Freiheit werben und uns von der Kreativität und Innovationsfähigkeit der Menschen anregen lassen.","We want to promote the opportunities of freedom among people and be inspired by people's creativity and capacity for innovation.","201",NA
"Nur durch intensiven Austausch kann das Wissen aller in konkrete Politik umgesetzt werden.","Only through intensive exchange can everyone's knowledge be translated into concrete policy.","202",NA
"Unser Programm soll den Bürgerinnen und Bürgern die Angst vor der Zukunft nehmen und die Chancen der Freiheit aufzeigen.","Our program is intended to take away citizens' fear of the future and show them the opportunities of freedom.","201",NA
"Gerade die Mitte der Gesellschaft besitzt großes Potenzial, das in den letzten Jahren mehr und mehr gehemmt wurde.","The middle of society in particular has great potential, which has been increasingly inhibited in recent years.","704",NA
"Es braucht jetzt den Mut für Veränderungen.","What is needed now is the courage to make changes.",NA,NA
"Freiheit braucht Mut, und die FDP hat den Mut, an ihrer Vision einer liberalen Bürgergesellschaft festzuhalten.","Freedom needs courage, and the FDP has the courage to stick to its vision of a liberal civil society.","201",NA
"Politik braucht Vertrauen.","Politics needs trust.",NA,NA
"Wir sind davon überzeugt: Liberale Politik verdient Vertrauen.","We are convinced that liberal policies deserve trust.","305",NA
"Dafür werben wir mit unserem Programm zur Bundestagswahl 2009.","We are campaigning for this with our program for the 2009 Bundestag elections.","305",NA
"2. Mehr Freiheit und Fairness durch Soziale Marktwirtschaft Grundsätze der Sozialen Marktwirtschaft","2. More freedom and fairness through a social market economy Principles of the social market economy","403",NA
"Unsere wirtschaftspolitische Leitlinie ist die Soziale Marktwirtschaft.","Our economic policy guideline is the social market economy.","403",NA
"Sie greift weit über ökonomische Ziele hinaus, ist ein unverzichtbarer Teil einer freiheitlichen offenen Gesellschaft.","It reaches far beyond economic goals and is an indispensable part of a free and open society.","403",NA
"Wir Liberale achten, schützen und verteidigen die Wirtschaftsordnung der Sozialen Marktwirtschaft mit aller Kraft.","We Liberals respect, protect and defend the economic order of the social market economy with all our might.","403",NA
"Das System der Sozialen Marktwirtschaft hat nicht nur zu großem Wohlstand breiter Bevölkerungsgruppen, sondern auch zu einem einmaligen sozialen Frieden in der Bundesrepublik Deutschland geführt.","The system of the social market economy has not only led to great prosperity for broad sections of the population, but also to a unique social peace in the Federal Republic of Germany.","403",NA
"Die staatliche Ordnungspolitik setzt für die Soziale Marktwirtschaft die Rahmenbedingungen.","The state's regulatory policy sets the framework conditions for the social market economy.","403",NA
"Deren oberstes Ziel muss sein, dass Bürger und Unternehmen ihre produktiven Kräfte entfalten können.","Their primary goal must be to enable citizens and companies to unleash their productive powers.","401",NA
"Dabei ist es eine Daueraufgabe des Staates, diesen Ordnungsrahmen den gesellschaftlichen und wirtschaftlichen Entwicklungen anzupassen und zu verbessern.","At the same time, it is a permanent task of the state to adapt and improve this regulatory framework to social and economic developments.","403",NA
"Das freie wirtschaftliche Handeln der Bürger ist die Grundlage der Sozialen Marktwirtschaft","Free economic action by citizens is the foundation of the social market economy","401",NA
"und der Motor für Wachstum und Wohlstand.","and the engine of growth and prosperity.","410",NA
"Die Menschen in der gesellschaftlichen Mitte verwirklichen den Kerngedanken der Sozialen Marktwirtschaft in beispielhafter Weise.","The people in the center of society realize the core idea of the social market economy in an exemplary manner.","704",NA
"Jeder Arbeitnehmer und jeder Unternehmer, der mit seiner täglichen Arbeit den Unterhalt für sich, seine Familie und über Steuern und Abgaben für sozial Benachteiligte sichert, schafft Wohlstand und Sicherheit für alle.","Every employee and every entrepreneur whose daily work provides a livelihood for himself, his family and, through taxes and duties, for the socially disadvantaged, creates prosperity and security for all.","704",NA
"Sozialpolitik soll die Menschen zu mehr Teilhabe befähigen und Sicherheit vor großen Lebensrisiken schaffen.","Social policy should enable people to participate more and provide security against major life risks.","503",NA
"Wir Liberale wissen, dass eine staatliche Absicherung des Existenzminimums notwendig ist.","We liberals know that state protection of the subsistence level is necessary.","504",NA
"Jeder kann in eine Situation geraten, in der er ohne Unterstützung nicht mehr weiter kann.","Anyone can find themselves in a situation where they can't go on without support.","504",NA
"Bequemlichkeit honorieren wir nicht.","We do not honor convenience.","505",NA
"Ziel liberaler Sozialpolitik ist es, allen Bürgern selbstbestimmtes und eigenverantwortliches Handeln zu ermöglichen.","The goal of liberal social policy is to enable all citizens to act in a self-determined and responsible manner.","505",NA
"Ein neues Steuer- und Transfersystem für Deutschland","A new tax and transfer system for Germany",NA,NA
"Die FDP macht sich deshalb stark für ein Steuersystem, das soziale Gerechtigkeit,","The FDP therefore advocates a tax system that promotes social justice,","503",NA
"staatliche Fairness","State fairness","503",NA
"und eine nachhaltige Finanzpolitik vereint.","and a sustainable financial policy.","414",NA
"Gemeinsam mit dem leistungsgerechten Bürgergeld folgt dieses Gesamt-Steuer- und Transfersystem durchgehend den Prinzipien der Leistungsgerechtigkeit und Leistungsbelohnung","Together with the performance-based citizen's income, this overall tax and transfer system follows the principles of performance equity and performance rewards throughout","503",NA
"und vermeidet Missbrauch zu Lasten der Bürgergemeinschaft.","and avoids abuses to the detriment of the citizen's community.","303",NA
"Eine gerechte Steuer muss auf Ausnahmen und Sonderregelungen für Einzelfälle weitestgehend verzichten:","A fair tax must largely dispense with exceptions and special regulations for individual cases:","303",NA
"Gleich hohe Einkommen werden auch gleich besteuert.","The same amount of income is taxed in the same way.","503",NA
"Pauschalen ersetzen die heute nur mit komplizierten Nachweisen und hohem bürokratischem Aufwand zu verwaltenden Individualvorschriften.","Flat rates replace the individual regulations that today can only be administered with complicated evidence and a high level of bureaucracy.","303",NA
